Scan ID,Attendee ID,First Name,Last Name,Title,Company,Email,Phone,Address,City,State,Postal Code,Country,Lead Score,Qualifiers,Notes,Timestamp,Session ID
35225106-6251-432b-a15b-35184fc27d90,9225cb48-a2c0-4bc6-9b7b-7f775ff45bb1,Jesus,Ford,iOS Developer,"Roberts, Hoover and Skinner",jesus.ford@example.org,(332)708-9335x847,6855 Tech Blvd,New York,NY,10001,United States,4,cultivate plug-and-play networks,Looking for a partner to help with a large-scale cloud migration.,2025-07-01T20:53:20.378694,BOOTH-174
3510d1d6-5be8-4a65-9fa9-f7d2254b5e5e,7d3e3261-a1a4-49aa-9336-75455920dde0,Amy,Bailey,Frontend Developer,Aguirre-Stevenson,amy.bailey@example.org,6462845782,2667 Maple Ave,Guadalajara,JAL,44100,Mexico,57,leverage efficient infrastructures,Needs a solution for log aggregation and anomaly detection.,2025-04-03T05:31:30.736834,BOOTH-174
af82bffd-34d2-42c6-8e4c-ca22f7b1f488,d11380f3-ff3e-4423-af38-635cc32b66bb,Gregory,Haas,Engineering Manager,Patton-Russell,gregory.haas@example.com,+1-474-608-8485x074,2412 Tech Blvd,Montreal,QC,H3B 1A7,Canada,78,extend visionary functionalities,Looking for a partner to help with a large-scale cloud migration.,2025-08-11T09:07:57.627086,BOOTH-174
557b9f17-85d6-41c5-ae37-f6492acac3bd,f2676a82-b7ff-47b0-b1e6-a2e3abc98907,Roger,Bell,Frontend Developer,"Skinner, Watts and Hunt",roger.bell@example.org,202.734.7789x2069,4755 Broadway,Vancouver,BC,V6B 1P1,Canada,24,syndicate ubiquitous architectures,Looking for a solution to optimize their CI/CD pipeline latency.,2025-06-04T06:50:13.800453,BOOTH-174
d856df90-33cf-469b-bad3-8a8acde6428a,b7f07d02-169a-4fcd-8b55-eb940bdd67d2,Angela,Johnson,AI Researcher,"Prince, Hunt and Simpson",angela.johnson@example.com,+1-395-978-5331x7889,3866 Tech Blvd,Seattle,WA,98109,United States,96,whiteboard scalable initiatives,Interested in automated testing strategies for their mobile app.,2025-09-22T02:40:07.279389,BOOTH-174
713e64e6-2e66-460d-88dd-86501ac6f7a5,f62b2d95-8921-4218-b823-dbf8b5b29887,Wesley,Davis,Product Manager,Smith Ltd,wesley.davis@example.org,001-330-519-3212x957,6597 Oak St,Sydney,NSW,2000,Australia,43,iterate interactive convergence,Concerned about data sovereignty and GDPR compliance in the EU region.,2025-05-11T06:25:17.997825,BOOTH-174
865a5470-89a1-4063-ab54-0dfdcd1221bd,4094f686-5de2-4f3f-864a-6fa7afe05d90,Laura,Morgan,VP of Engineering,Norton-Holland,laura.morgan@example.org,849-459-0641,2940 Oak St,Los Angeles,CA,90001,United States,51,re-contextualize distributed bandwidth,Discussed potential integration with their existing Kubernetes cluster.,2025-05-15T18:05:00.273898,BOOTH-174
500fc636-1516-4818-ab52-5537e9872aed,14b3bace-8ea7-4a75-bb93-de707f3ca9fc,Gabriela,Eaton,Solutions Architect,Henry Ltd,gabriela.eaton@example.org,713-283-0583x9171,2446 Market St,Atlanta,GA,30303,United States,41,enable best-of-breed e-commerce,Interested in automated testing strategies for their mobile app.,2025-07-21T12:29:08.980508,BOOTH-174
f55a6c9a-2cee-4ed1-81d7-6fc34944502d,96446120-be54-434e-b46a-48c33f2eb7a1,Marcia,Chandler,Senior Software Engineer,"Welch, Miller and Liu",marcia.chandler@example.com,(838)822-0663x23210,3491 Broadway,Seattle,WA,98109,United States,63,target holistic paradigms,Looking to replace their current data warehouse with a more scalable solution.,2025-08-10T12:10:02.906942,BOOTH-174
5f40c070-f2b8-48f9-8ea2-b29275218eda,cb65a259-4c08-4763-a5a1-a26e8a671717,Loretta,Davidson,Data Scientist,Pace LLC,loretta.davidson@example.net,686-495-3690x828,5422 Washington St,Munich,Bavaria,80331,Germany,37,utilize proactive vortals,Interested in migrating legacy systems to a microservices architecture.,2025-01-25T16:58:23.749300,BOOTH-174
5ed27b42-5cda-45de-a41f-f9754974d25a,10f232ab-508d-4daf-8c8a-edb58adccd5b,Richard,Smith,Developer Advocate,"Wallace, Vazquez and Diaz",richard.smith@example.org,360.998.6384x74256,9945 Market St,Mexico City,CDMX,01000,Mexico,11,re-contextualize visionary content,Wants to know more about our machine learning model training capabilities.,2025-06-12T15:40:25.647927,BOOTH-174
5ee0c3ed-5518-471e-92cc-a6a9730fb309,a9fe59ba-933e-4ad6-979d-2d7d3aa7004e,Ian,Lester,VP of Engineering,Frazier LLC,ian.lester@example.org,(787)952-4762,3351 Market St,Melbourne,VIC,3000,Australia,6,engineer extensible web services,Inquired about volume pricing for high-throughput data streaming.,2025-06-22T09:25:39.964749,BOOTH-174
b65fa1ed-a6c8-4cfb-b2e2-260eebf4c1c2,9a6ecc9e-fd63-4b17-b126-a36b6c910fca,Karen,Jenkins,Technical Product Manager,Lyons-Rush,karen.jenkins@example.com,508.808.2731x39364,5479 Main St,Denver,CO,80202,United States,3,target B2C interfaces,Discussed the benefits of Rust over C++ for their new engine.,2025-07-19T15:31:22.096671,BOOTH-174
7225065d-4bb7-479e-af9c-174f7b50858c,9ed91786-7b36-41d0-95f7-b83d2e935239,Amy,Li,Machine Learning Engineer,Mullen-Hughes,amy.li@example.org,(845)464-8911,9030 Main St,Chicago,IL,60601,United States,55,morph magnetic metrics,Needs a solution for log aggregation and anomaly detection.,2025-01-17T03:31:16.913123,BOOTH-174
03c664e3-19e1-4ef6-8b9e-2f893548ceeb,1d56d6ac-5095-4bd2-9e02-f1227c784160,Sheila,Petty,Test Automation Engineer,"Hanson, Odonnell and Harrington",sheila.petty@example.com,305.599.4308,8809 Maple Ave,Seattle,WA,98109,United States,35,leverage impactful mindshare,Discussed potential integration with their existing Kubernetes cluster.,2025-06-20T07:13:53.650978,BOOTH-174
e14e90e8-eccd-4840-a257-fd5a267d4732,d37b7e17-ef3e-4524-a415-d03da44b921c,Judith,Scott,Software Engineer,"Shaw, Simmons and Mcbride",judith.scott@example.com,+1-921-215-9035,8672 Main St,Melbourne,VIC,3000,Australia,96,transition one-to-one partnerships,Evaluating our platform against AWS and Azure alternatives.,2025-05-03T01:31:44.074139,BOOTH-174
391acd0b-7916-439f-a4bf-c8342e1bb832,a00e841c-30ea-4670-bc05-8e4f47317faa,Sonya,Hubbard,Site Reliability Engineer (SRE),Rogers-Peters,sonya.hubbard@example.org,469-356-2621,5849 Tech Blvd,Atlanta,GA,30303,United States,3,seize global communities,Wants to integrate our widget into their React Native application.,2025-04-27T09:08:31.361190,BOOTH-174
d451a69f-9df5-4cd0-b06a-323d467cc2c4,f44802cf-ace0-407f-b527-7fa3319b4fb2,Charles,Baldwin,Test Automation Engineer,Barr Inc,charles.baldwin@example.com,(993)990-2805x8163,5420 Maple Ave,Los Angeles,CA,90001,United States,75,redefine integrated platforms,Discussed the benefits of Rust over C++ for their new engine.,2025-04-04T18:56:46.611124,BOOTH-174
c7c1f3e2-4050-48bf-86e7-5603b101db08,0c3ee943-a7aa-4286-9134-5cbbae77b203,Jesse,Rios,Android Developer,Myers-Riley,jesse.rios@example.org,868-537-0440,9531 Broadway,Singapore,SG,049318,Singapore,38,envisioneer sticky web-readiness,Discussed potential integration with their existing Kubernetes cluster.,2025-09-01T16:35:19.793141,BOOTH-174
5c4e546d-85aa-4ab3-ae76-542d321d98e5,83ce009c-1213-4b87-83b0-6b494d4cafa5,Shawn,Collins,Network Engineer,Brooks Inc,shawn.collins@example.net,924.504.1475,1763 Maple Ave,Mexico City,CDMX,01000,Mexico,29,drive collaborative ROI,Asked detailed questions about our GraphQL API rate limits.,2025-02-28T15:19:58.972597,BOOTH-174
a235e058-166c-4182-aeec-8e93651a7126,a4d6aa10-857e-4a45-996e-3c5fccd21641,Christine,Roman,Network Engineer,"Miller, Chapman and Stanley",christine.roman@example.com,+1-242-422-0583x204,8388 Innovation Way,Denver,CO,80202,United States,18,leverage ubiquitous partnerships,Excited about the roadmap for serverless function support.,2025-07-04T02:24:52.649596,BOOTH-174
f576cccb-19cd-4919-a977-9e95c53b4e33,17c9e193-edee-47e7-af32-b5e69e465234,Crystal,Beck,QA Engineer,Stevenson Ltd,crystal.beck@example.org,+1-549-219-3040x24920,6273 Tech Blvd,New York,NY,10001,United States,80,incubate holistic markets,Looking for a solution to optimize their CI/CD pipeline latency.,2025-10-04T03:31:34.843663,BOOTH-174
676073e6-f1d4-4cca-8c5e-ec70fc551344,16b30426-51bf-4df2-98f9-f8c6f5e32c3e,Amanda,Weber,AI Researcher,"Clements, Anderson and Day",amanda.weber@example.net,200-674-3242,8791 Oak St,Denver,CO,80202,United States,13,streamline mission-critical supply-chains,Asked about our uptime SLAs and incident response times.,2025-09-24T06:25:04.272738,BOOTH-174
d33b36d4-43ac-4c9a-b5af-a83601f838db,3fc558e0-3fd3-42e9-980a-c87f49643bd0,Brandon,Lee,Cloud Architect,Hill-Hernandez,brandon.lee@example.net,(917)321-4532x55720,3257 Broadway,Rio de Janeiro,RJ,20000-000,Brazil,17,architect next-generation convergence,Looking for a partner to help with a large-scale cloud migration.,2025-09-20T11:09:27.027337,BOOTH-174
5512fe93-0964-49d0-84cb-329ee136274f,f8185acd-512d-4216-b2ef-8458d91807a1,Lauren,Bush,Software Engineer,Moore LLC,lauren.bush@example.net,550.966.7960x77601,818 Washington St,Seattle,WA,98109,United States,53,whiteboard plug-and-play web-readiness,Wants to schedule a deep-dive demo of the new security features.,2025-03-24T01:22:57.481942,BOOTH-174
cc9d85e9-5020-4dc9-b06f-4e7b10672a92,a8a617e7-1205-4a0d-b26f-13aadddc9738,Ashley,Gill,Technical Writer,Hines and Sons,ashley.gill@example.org,554.795.5098x164,1722 Market St,Guadalajara,JAL,44100,Mexico,24,engineer out-of-the-box eyeballs,Evaluating the feasibility of a multi-tenant architecture.,2025-02-25T03:26:39.187855,BOOTH-174
a4f81933-2f5b-4f48-9a6b-513bf3e716ab,89fad606-bdb6-4aed-be53-92a864fc0439,Robert,Morrison,Site Reliability Engineer (SRE),Fitzgerald-Mathis,robert.morrison@example.com,(460)930-2581,9588 Market St,Los Angeles,CA,90001,United States,61,reinvent end-to-end e-tailers,Evaluating our platform against AWS and Azure alternatives.,2025-04-29T00:37:29.123444,BOOTH-174
d452026e-55ff-4719-8848-34cae880d03b,601e03b5-a8ec-43fe-8595-829597ff02ae,Brandy,Thompson,Frontend Developer,"Campbell, Dawson and Robinson",brandy.thompson@example.net,853-972-5615x225,791 Maple Ave,Los Angeles,CA,90001,United States,47,strategize impactful experiences,Concerned about data sovereignty and GDPR compliance in the EU region.,2025-09-23T07:42:19.796377,BOOTH-174
b8cf7621-3b47-4fa3-9e4a-2d30a2232630,b5696e45-2eac-452d-bcac-b13c9b9ef1e4,Margaret,Williams,Mobile Developer,"Cox, Ward and Melton",margaret.williams@example.com,786-218-1244,1920 Market St,Ottawa,ON,K1P 1J1,Canada,62,exploit next-generation infrastructures,Evaluating the feasibility of a multi-tenant architecture.,2025-03-04T18:40:09.957152,BOOTH-174
f2e47a3e-6f13-48eb-ad66-c1f88307043a,25fdc1b9-cfd2-4e9c-9708-7684f95275f9,Jennifer,Scott,Engineering Manager,Smith-White,jennifer.scott@example.org,001-707-836-4467x0147,2535 Innovation Way,San Francisco,CA,94105,United States,25,scale killer supply-chains,Wants to schedule a deep-dive demo of the new security features.,2025-05-24T14:26:42.600766,BOOTH-174
b4a8a3c5-f1d6-4ab5-8b3b-39b2fffc7425,b717acb2-3857-4e59-a0fb-c8e24c4c5ab3,James,Johnston,Android Developer,Sharp LLC,james.johnston@example.org,538-690-3976x651,1392 Broadway,Vancouver,BC,V6B 1P1,Canada,22,whiteboard holistic networks,Needs a solution for log aggregation and anomaly detection.,2025-09-01T23:49:14.551177,BOOTH-174
aee20837-b5c1-4f03-8899-38fa12ee330c,f565a0f5-41b1-4da1-bb79-976a848d3046,Michelle,Black,Backend Developer,"Berry, Collins and Barker",michelle.black@example.net,365.864.0236,7060 Maple Ave,Guadalajara,JAL,44100,Mexico,4,repurpose distributed metrics,Exploring options for edge computing and low-latency delivery.,2025-02-01T08:23:43.904670,BOOTH-174
6b4878f3-310c-4d26-a3e1-4757f415ab47,27923da9-c2e0-4769-be72-77c832531c0b,Derrick,Thomas,Data Scientist,"Taylor, Good and Thompson",derrick.thomas@example.net,2274111160,1798 Washington St,Dublin,Dublin,D01,Ireland,22,redefine ubiquitous experiences,Exploring options for edge computing and low-latency delivery.,2025-05-24T21:14:31.783596,BOOTH-174
d72f48ff-3a47-40ce-ac68-0fad357a7619,61e6c1f3-a815-4353-8b56-2b469a32f616,Christina,Gentry,CTO,Kirk PLC,christina.gentry@example.com,001-699-789-6580x71552,6326 Market St,Stockholm,Stockholm,111 22,Sweden,28,syndicate open-source schemas,Excited about the roadmap for serverless function support.,2025-06-26T01:30:31.789450,BOOTH-174
c5123205-4e5c-4511-b6b3-97a6099013c2,c0495c70-acac-4a59-8b02-4d8646c3330e,Rebecca,Taylor,QA Engineer,"Frederick, Ferguson and Alvarado",rebecca.taylor@example.com,423.954.7566,8221 Maple Ave,London,England,SW1A 1AA,United Kingdom,54,expedite magnetic relationships,Mentioned a need for real-time analytics and dashboarding.,2025-06-07T00:35:45.645661,BOOTH-174
189a83e5-05a0-42e7-aa9c-d01a76be66ec,095e761f-cc77-4263-bda4-381887f682f4,Deborah,Wood,VP of Engineering,Jensen-Gomez,deborah.wood@example.com,+1-224-922-6972x38666,2029 Broadway,Seattle,WA,98109,United States,73,benchmark leading-edge mindshare,Excited about the roadmap for serverless function support.,2025-05-25T01:30:36.072032,BOOTH-174
5ac63ce9-a40d-4c59-8b37-608b20c91231,6b5aeb5e-8760-4e90-bdf5-b7d27781383d,Peter,Carr,Engineering Manager,"Carroll, Wilson and Davis",peter.carr@example.com,001-751-951-6669,8659 Maple Ave,Boston,MA,02110,United States,53,productize cross-platform eyeballs,Interested in automated testing strategies for their mobile app.,2025-02-23T11:35:23.284300,BOOTH-174
a84cb292-ca0a-43d9-a6c4-ccf9388523b4,0a455979-08e2-432d-badc-d088380dd5fc,John,Zimmerman,Network Engineer,Martin LLC,john.zimmerman@example.org,625-220-5909x15284,2197 Broadway,Seattle,WA,98109,United States,74,revolutionize synergistic interfaces,Excited about the roadmap for serverless function support.,2025-05-14T13:30:33.668218,BOOTH-174
7d62d046-e980-4103-933a-c7aac33c79a7,34d3f3f4-b297-40fe-9bdb-7754d38704c0,Jessica,Green,Developer Advocate,Parker-Murphy,jessica.green@example.com,+1-948-536-4610x70727,8839 Broadway,Vancouver,BC,V6B 1P1,Canada,48,cultivate efficient metrics,Needs better documentation for the Python SDK.,2025-04-25T07:38:10.966900,BOOTH-174
eade8221-4ebd-405e-bee6-d946cb677033,c454278a-99ab-4c50-841b-be29dac15eff,Steven,Baldwin,CTO,Brooks Group,steven.baldwin@example.org,(585)212-6173x651,4107 Maple Ave,Rio de Janeiro,RJ,20000-000,Brazil,54,transform front-end e-markets,Wants to schedule a deep-dive demo of the new security features.,2025-05-02T18:43:54.186175,BOOTH-174
5c00c373-fab3-41cc-8882-ec760f18d347,2a21928a-f97e-4864-9729-cc319e4e197b,Nathan,Nelson,Machine Learning Engineer,Peters Inc,nathan.nelson@example.org,917-541-4355,2616 Tech Blvd,Dublin,Dublin,D01,Ireland,18,redefine bricks-and-clicks interfaces,Interested in migrating legacy systems to a microservices architecture.,2025-10-08T04:31:31.143325,BOOTH-174
7c00fdfc-abf1-4c3a-b30a-6a19b8455c8a,36373a79-8fdd-409e-98c4-5b90520eab8d,Michael,Mack,Test Automation Engineer,Allen-Miller,michael.mack@example.net,(371)646-2401,7384 Tech Blvd,Miami,FL,33101,United States,77,repurpose wireless e-commerce,Evaluating the feasibility of a multi-tenant architecture.,2025-03-11T08:40:02.712785,BOOTH-174
eb6a1732-46c9-453d-bd86-0fd4cf309fd8,274ca765-ace8-41b2-8fb9-14abec6a8814,Scott,Pollard,Software Engineer,Rice-Mack,scott.pollard@example.org,+1-967-466-1627x947,1903 Tech Blvd,Ottawa,ON,K1P 1J1,Canada,44,cultivate cross-platform bandwidth,Evaluating our platform against AWS and Azure alternatives.,2025-09-01T07:52:04.979585,BOOTH-174
c6bbaa16-fc2e-4ca1-b7cc-bff784f098d5,f9efae8f-3723-45f8-9628-bad5720d2648,Tamara,Shaw,Mobile Developer,"Sanchez, Jacobson and Price",tamara.shaw@example.com,482-842-5753x614,4130 Tech Blvd,New York,NY,10001,United States,50,streamline rich partnerships,Concerned about data sovereignty and GDPR compliance in the EU region.,2025-01-27T17:16:57.094688,BOOTH-174
7f4deb0f-f9c5-4b63-9393-c65b18a2efcc,733b317f-8c66-40c6-9ab8-3a7bf7abeaf2,Gina,Garcia,Machine Learning Engineer,Goodwin-Phillips,gina.garcia@example.net,+1-975-832-8890x89740,8337 Tech Blvd,Miami,FL,33101,United States,66,empower enterprise e-markets,Looking to replace their current data warehouse with a more scalable solution.,2025-04-13T23:55:51.613328,BOOTH-174
3eee3d71-3d7a-4c13-a01a-df4e6cd5d5cf,a6f1f934-752d-40f8-bee0-d46832e7ac2f,Karen,Perez,UX/UI Designer,"Maxwell, Mcintosh and Morris",karen.perez@example.net,001-527-584-8500,9737 Tech Blvd,Seattle,WA,98109,United States,10,streamline magnetic convergence,Evaluating our platform against AWS and Azure alternatives.,2025-03-25T14:24:29.894003,BOOTH-174
486d6ddb-142e-4e8a-9f04-e54a0241c247,3b0d5550-f4f5-4468-8081-6029794b0dda,Julie,Warner,UX/UI Designer,Miranda Group,julie.warner@example.com,498.212.9397,5358 Innovation Way,Vancouver,BC,V6B 1P1,Canada,17,deploy front-end ROI,Asked about our uptime SLAs and incident response times.,2025-05-16T23:55:39.189336,BOOTH-174
c3242566-6c4f-4890-9e0f-96c48dfa4f15,6a4b2891-470a-43c5-9617-a5bc75728642,Zachary,Davis,AI Researcher,Foster-Gomez,zachary.davis@example.net,+1-521-566-8967x823,5355 Tech Blvd,Melbourne,VIC,3000,Australia,98,extend open-source relationships,Encountered friction with the SSO setup; needs technical support.,2025-01-15T09:41:50.412657,BOOTH-174
b2157c7d-4cd6-4085-a19b-71eadb156282,7f4c7d09-2e57-4d95-b83f-70e1f10521a6,Diane,Smith,Technical Writer,"Carter, Jones and Jones",diane.smith@example.com,001-732-405-9167x9923,137 Innovation Way,Monterrey,NL,64000,Mexico,93,orchestrate global niches,Needs better documentation for the Python SDK.,2025-06-15T14:45:15.709065,BOOTH-174
db7e9bb8-620a-451e-a049-530a0da87a4b,5eb875f0-2c68-4ab8-8e2a-a3db5e7315ab,Jackie,Mejia,UX/UI Designer,"Brown, Vega and Carr",jackie.mejia@example.com,599.586.4071x28916,310 Broadway,Boston,MA,02110,United States,65,disintermediate bricks-and-clicks action-items,Discussed the benefits of Rust over C++ for their new engine.,2025-09-10T11:46:10.890642,BOOTH-174
f55ac43f-c3c6-4ef0-98b1-8cedfd3178a1,9960ed30-e094-412d-a177-4e1ef130d41d,Rachel,Carter,Mobile Developer,Baker-Garcia,rachel.carter@example.org,(545)412-6952,7902 Oak St,New York,NY,10001,United States,4,unleash extensible communities,Discussed the benefits of Rust over C++ for their new engine.,2025-04-12T09:15:19.604158,BOOTH-174
2c479b5b-c1b6-4e69-9742-cd218e91c0a1,8c025ffe-9475-408f-8b44-12c57d8be77e,Kimberly,Durham,Security Engineer,Nelson-Johnson,kimberly.durham@example.org,492-452-5105x5539,2148 Maple Ave,Boston,MA,02110,United States,76,redefine back-end deliverables,Encountered friction with the SSO setup; needs technical support.,2025-03-24T07:37:17.003854,BOOTH-174
b4272168-9a4e-4f41-a6bb-555205e06fcf,01cb91b8-93be-49ed-bb52-1654df1a4580,Laura,Ward,CTO,Mason Group,laura.ward@example.org,001-837-754-2681x413,1199 Main St,Boston,MA,02110,United States,25,mesh out-of-the-box interfaces,Exploring options for edge computing and low-latency delivery.,2025-09-14T06:59:59.663854,BOOTH-174
de421952-45ab-45be-9200-26e75bb02542,5bb9556e-96ce-4fae-af33-4c21b65ea864,Laura,Morrison,CTO,"Anderson, Stewart and Waters",laura.morrison@example.net,(700)915-0525x68217,5970 Main St,New York,NY,10001,United States,85,cultivate innovative channels,Wants to schedule a deep-dive demo of the new security features.,2025-02-14T09:56:42.254512,BOOTH-174
4f12a748-81ec-4983-a61c-398abb586eca,00cfcea5-1d13-4dc1-848c-ff9f1b83cc95,Mark,Joseph,Software Engineer,King and Sons,mark.joseph@example.com,437-949-5505x1622,282 Main St,Monterrey,NL,64000,Mexico,61,empower front-end paradigms,Asked about our uptime SLAs and incident response times.,2025-01-05T12:38:47.431198,BOOTH-174
dfedd9d7-ecea-4816-87fa-54e1cac41082,3ff670bb-4c5d-4804-b012-5994b2149310,Ethan,Mcgee,VP of Engineering,Williams LLC,ethan.mcgee@example.net,632.209.9364,7931 Market St,New York,NY,10001,United States,36,drive cross-media synergies,Wants to integrate our widget into their React Native application.,2025-05-01T22:38:15.994966,BOOTH-174
39c1d961-1702-4ad3-8a0d-eca26186b0fe,a759a40f-84d3-4f17-8c85-c48439cd47f0,John,Ferguson,Developer Advocate,"Becker, Hicks and Blankenship",john.ferguson@example.net,852.606.7231x04853,5855 Main St,Paris,Île-de-France,75001,France,52,transition e-business e-business,Exploring options for edge computing and low-latency delivery.,2025-02-22T01:11:55.934328,BOOTH-174
8c22ed57-4615-4cf4-9c94-be0d62aa4977,acd6de4c-1aa8-47b7-9f27-b65a05a3c592,Alison,Rollins,Machine Learning Engineer,Alvarez-Moreno,alison.rollins@example.com,518.738.2281,9216 Market St,Chicago,IL,60601,United States,7,implement viral info-mediaries,Interested in automated testing strategies for their mobile app.,2025-06-04T14:07:36.698268,BOOTH-174
b033d480-0593-4a73-bc73-589d24940b7b,8aed6b03-5b92-457e-8551-0b491667596e,Donald,Nichols,Android Developer,Smith Group,donald.nichols@example.com,7565230453,7645 Broadway,Berlin,Berlin,10115,Germany,79,engage end-to-end architectures,Looking for a partner to help with a large-scale cloud migration.,2025-07-03T00:54:24.191899,BOOTH-174
76cdacaa-8c1c-40b6-8986-a19e0a57854d,9703c94c-e059-4d98-b16b-c286de6976f1,Tammy,Gibson,Data Scientist,Lopez Group,tammy.gibson@example.org,+1-489-965-9581x72370,8787 Main St,San Francisco,CA,94105,United States,87,scale cross-platform schemas,Excited about the roadmap for serverless function support.,2025-01-01T09:32:33.316093,BOOTH-174
493afa2a-7d4a-4bc3-8bdb-8fabbb22e48f,17d77c19-ed89-448c-9517-44b8d111e0b1,Stanley,Ochoa,Backend Developer,Alexander PLC,stanley.ochoa@example.net,(235)822-2234x08311,7691 Broadway,Atlanta,GA,30303,United States,14,unleash efficient bandwidth,Evaluating the feasibility of a multi-tenant architecture.,2025-09-21T23:34:45.202084,BOOTH-174
8fd6e69a-0afd-4a40-8de9-7c9d4d3c588b,8d5d4890-23a2-4f0d-8291-a2faeeaffbe7,Carmen,Ruiz,QA Engineer,Murray-Williams,carmen.ruiz@example.com,(310)544-4676x896,5650 Main St,Austin,TX,73301,United States,76,iterate cross-platform models,Discussed the benefits of Rust over C++ for their new engine.,2025-04-25T03:02:52.242603,BOOTH-174
92fdb892-1d18-4b87-a874-26b478100b07,06b2eb6a-994d-498f-80d0-b2384e34d153,Raymond,Cowan,Database Administrator,Reed Ltd,raymond.cowan@example.net,963-863-2258x805,3768 Oak St,Sydney,NSW,2000,Australia,34,syndicate killer solutions,Mentioned a need for real-time analytics and dashboarding.,2025-10-01T04:00:58.375669,BOOTH-174
dccff6dc-1822-4d02-a1b7-37c18ac1b7c5,a73cf2d7-a1a3-4293-8d1a-e9ddea1afe7e,Melissa,Curry,Frontend Developer,Robinson-Harrington,melissa.curry@example.com,+1-442-462-1701x7866,9170 Innovation Way,Singapore,SG,049318,Singapore,60,deploy impactful infrastructures,Looking to replace their current data warehouse with a more scalable solution.,2025-10-07T12:47:28.756540,BOOTH-174
eb6c4773-4829-4c1f-bee6-19770b2e166e,0c205deb-7b33-4436-9223-4fe90b58be28,Leslie,Jackson,CTO,Gomez-Franklin,leslie.jackson@example.com,(627)227-5956,209 Maple Ave,Montreal,QC,H3B 1A7,Canada,97,facilitate frictionless supply-chains,Interested in migrating legacy systems to a microservices architecture.,2025-09-17T16:08:42.448996,BOOTH-174
8f414cc2-44e8-4357-b3b7-25b5741d7b65,b477ed42-d0f4-4a2d-99da-1bc278986951,Scott,York,Data Engineer,Wood and Sons,scott.york@example.com,610.788.2528,4582 Maple Ave,New York,NY,10001,United States,55,optimize plug-and-play e-commerce,Concerned about data sovereignty and GDPR compliance in the EU region.,2025-07-26T20:39:39.027903,BOOTH-174
9a71ce3d-5339-43cf-9f87-74657ad13d38,17d60c2e-5798-4a85-b13e-e465079f66f2,Crystal,Marshall,Technical Product Manager,Wise Inc,crystal.marshall@example.org,(204)311-9019x0855,1609 Washington St,Chicago,IL,60601,United States,50,aggregate leading-edge synergies,Encountered friction with the SSO setup; needs technical support.,2025-02-22T18:22:49.866344,BOOTH-174
d57cb792-e2fc-4851-9f53-2a5c856216cb,66807edf-98c6-4b09-8b41-b7591bc17988,Jessica,Oneal,Site Reliability Engineer (SRE),"Turner, Clarke and Moore",jessica.oneal@example.net,001-715-789-6449x69866,618 Broadway,Sydney,NSW,2000,Australia,52,target end-to-end e-business,Discussed potential integration with their existing Kubernetes cluster.,2025-02-20T19:57:21.774248,BOOTH-174
1aec28ef-2506-4228-a9ab-abf27192e667,2beec412-fc0f-497c-b847-57f78499cab6,Nicholas,Boyd,Full Stack Developer,Davis and Sons,nicholas.boyd@example.net,273.305.3905x051,1933 Oak St,São Paulo,SP,01000-000,Brazil,58,visualize bricks-and-clicks paradigms,Wants to know more about our machine learning model training capabilities.,2025-06-11T17:19:58.289085,BOOTH-174
f42902a9-dfdb-49b4-8f60-79ee9f17823d,f8fde830-090a-42e6-9abe-ea3e64b1e1f2,Paul,Kennedy,Engineering Manager,Chambers LLC,paul.kennedy@example.com,759-728-4114x96536,2008 Washington St,Ottawa,ON,K1P 1J1,Canada,18,unleash clicks-and-mortar e-services,Asked if we support Terraform providers for infrastructure as code.,2025-04-30T22:41:21.927140,BOOTH-174
5fc55af6-fd88-4cab-a1ac-78d84a6260be,974fae2b-538a-4f9e-a678-da0a0b47b248,Michael,Becker,CTO,Graham LLC,michael.becker@example.com,+1-952-675-5190x8678,4309 Maple Ave,Austin,TX,73301,United States,75,grow cross-media communities,Needs a solution for log aggregation and anomaly detection.,2025-05-27T12:12:27.378693,BOOTH-174
29379461-2473-4312-8bac-bffcd627d369,9bbed8ce-1ed7-4e21-b25d-6be9c88867a6,Catherine,Smith,Engineering Manager,Bartlett-Hill,catherine.smith@example.com,613-795-9765x902,8220 Oak St,Guadalajara,JAL,44100,Mexico,14,redefine plug-and-play partnerships,Asked detailed questions about our GraphQL API rate limits.,2025-04-15T00:50:54.361071,BOOTH-174
b05519c1-7326-419e-bb62-a7e8b788331a,f9258933-5e45-4d18-b816-e84ee34c9d51,David,Gonzalez,Machine Learning Engineer,"Mitchell, Wilson and Black",david.gonzalez@example.org,916.737.5131,6545 Tech Blvd,Montreal,QC,H3B 1A7,Canada,63,empower turn-key paradigms,Discussed potential integration with their existing Kubernetes cluster.,2025-01-04T09:19:08.473426,BOOTH-174
32b69747-a005-4e4a-8813-febf02ad1b6c,9acb3785-89a9-4240-9b1e-ab82d55e6868,Barbara,Griffin,Backend Developer,"Rodriguez, Williams and Perez",barbara.griffin@example.net,955-696-3894x61183,4671 Main St,Munich,Bavaria,80331,Germany,38,embrace user-centric web services,Asked detailed questions about our GraphQL API rate limits.,2025-10-01T21:44:02.181115,BOOTH-174
