Scan ID,Attendee ID,First Name,Last Name,Title,Company,Email,Phone,Address,City,State,Postal Code,Country,Lead Score,Qualifiers,Notes,Timestamp,Session ID
8b2d773f-ede6-47f3-91b0-98fb3812413e,a8fc6422-08e5-48a3-8576-9b92dbba6064,Sarah,Griffin,Software Engineer,Jackson Group,sarah.griffin@example.org,337.457.7228x33255,1869 Market St,Chicago,IL,60601,United States,10,reinvent end-to-end niches,Wants to integrate our widget into their React Native application.,2025-07-10T00:02:29.821081,BOOTH-174
27b80d6e-e30a-416c-82cc-c83ba9ada902,8f3279fd-8587-4e54-9f9c-1b29ced6a7a1,Samuel,Walker,QA Engineer,"Harris, Harrison and Perez",samuel.walker@example.net,(464)252-4626x0459,8650 Innovation Way,Mexico City,CDMX,01000,Mexico,50,optimize bricks-and-clicks schemas,Needs better documentation for the Python SDK.,2025-03-08T20:05:27.950225,BOOTH-174
fb4466ac-8d25-4d96-a4d7-e36680957988,e5520565-88f3-4734-95ee-bc0df54f2691,Ryan,Ruiz,Data Scientist,Lewis Group,ryan.ruiz@example.org,+1-378-682-3685x2723,8274 Maple Ave,Miami,FL,33101,United States,73,empower revolutionary models,Asked about our uptime SLAs and incident response times.,2025-07-21T19:07:16.228941,BOOTH-174
406b9fe2-efd3-4b68-bdc2-16ff48c03a59,0e26abd8-cafe-48f9-bfd9-65ea7d1bc20e,Leroy,Barnes,Cloud Architect,Neal-Mitchell,leroy.barnes@example.net,(823)286-7975x32187,5281 Innovation Way,Seattle,WA,98109,United States,41,enhance innovative schemas,Evaluating our platform against AWS and Azure alternatives.,2025-01-16T03:05:20.802851,BOOTH-174
51a316d2-110a-4970-9449-7c2c8128c59c,178684c8-c32a-42bc-9659-a0c17507d329,Andrea,Butler,Backend Developer,Wall LLC,andrea.butler@example.org,(323)379-3490x1885,8640 Tech Blvd,Rio de Janeiro,RJ,20000-000,Brazil,21,reinvent back-end vortals,Looking to replace their current data warehouse with a more scalable solution.,2025-06-07T20:13:32.767533,BOOTH-174
7cda92cf-8288-4b1f-a008-8fa161d1ba32,771c525d-fe88-4bc7-99d7-73e27d76296c,Billy,Cooper,Frontend Developer,"Riley, Moses and Rosario",billy.cooper@example.com,+1-397-360-4444,4597 Innovation Way,New York,NY,10001,United States,79,utilize customized content,Discussed potential integration with their existing Kubernetes cluster.,2025-03-20T16:58:02.265167,BOOTH-174
c7823f89-75d1-4d4e-b1ea-b5a8f934245d,bf3e0d1b-a7b1-4b28-bc53-1ca4cca28c7c,Lisa,Lee,AI Researcher,"Singleton, Hernandez and Baker",lisa.lee@example.org,001-977-880-4795x1724,9502 Maple Ave,New York,NY,10001,United States,83,whiteboard impactful supply-chains,Wants to integrate our widget into their React Native application.,2025-09-16T21:40:29.562577,BOOTH-174
c751f1ea-b979-457c-b344-143f8ed4fba9,e1acd226-0176-41bd-99cd-9b75b052e5be,Margaret,Phillips,Network Engineer,Medina Group,margaret.phillips@example.net,001-774-639-8423x257,7415 Broadway,Seattle,WA,98109,United States,77,embrace 24/365 systems,Concerned about data sovereignty and GDPR compliance in the EU region.,2025-08-24T05:33:02.372493,BOOTH-174
ece1915e-07a7-4728-9a54-9020742310bd,eef3cdbe-3136-484f-8f8d-e4d1ba5a7805,Scott,Moore,Cloud Architect,Wheeler Ltd,scott.moore@example.com,293.833.9659,1754 Maple Ave,Berlin,Berlin,10115,Germany,83,iterate collaborative partnerships,Wants to schedule a deep-dive demo of the new security features.,2025-01-25T09:44:09.821476,BOOTH-174
0befa36d-b637-48d8-9c1e-1648ccdc03ff,479220e6-24c9-48fd-b59b-34c26e64fdb0,Corey,Gordon,Cybersecurity Analyst,Tate-Moore,corey.gordon@example.net,(830)534-8003x5183,3540 Market St,New York,NY,10001,United States,93,evolve next-generation partnerships,Looking for a partner to help with a large-scale cloud migration.,2025-07-29T19:29:14.723726,BOOTH-174
b958432f-7f70-475c-929a-3c5be2987cc0,1a5c03a3-4bef-40cc-87b4-06ee743fce7b,Linda,Stanley,Data Engineer,Rodriguez Inc,linda.stanley@example.net,818-412-1294x7266,7727 Maple Ave,San Francisco,CA,94105,United States,4,e-enable granular models,Asked detailed questions about our GraphQL API rate limits.,2025-01-09T02:12:14.277322,BOOTH-174
f1e5d182-3cda-4f86-9e4f-e89dcabfc6a5,10e3b103-a4d9-4def-af0f-1fbfdeaf7392,Angela,Barrett,Test Automation Engineer,Mcguire and Sons,angela.barrett@example.com,(280)749-3066,6129 Washington St,Melbourne,VIC,3000,Australia,24,syndicate next-generation info-mediaries,Looking to replace their current data warehouse with a more scalable solution.,2025-01-31T07:37:45.786168,BOOTH-174
b5dbeb54-a8bd-44b0-9e73-55f3b6ff1a7e,5524a74c-ec2f-4dd7-82e4-eec21ec677b8,Anna,Braun,DevOps Engineer,Berger LLC,anna.braun@example.com,+1-540-647-7971,156 Tech Blvd,Ottawa,ON,K1P 1J1,Canada,1,implement leading-edge web-readiness,Encountered friction with the SSO setup; needs technical support.,2025-02-25T03:42:12.386697,BOOTH-174
05943c0d-837b-4f1e-acce-7cf7e28d96fb,87781002-0edd-4fc4-84c9-4f7dc7c88ec6,Aaron,Avila,Solutions Architect,"Torres, Schmidt and Mata",aaron.avila@example.com,(489)312-4141x02487,8173 Oak St,Toronto,ON,M5H 2N2,Canada,7,incubate customized vortals,Discussed the benefits of Rust over C++ for their new engine.,2025-04-18T03:01:32.240926,BOOTH-174
6d29948f-a633-487e-9f37-b0b1d8a91568,571c3add-4e81-44df-a07a-3f2f47f185be,Michael,Morales,Cloud Architect,Palmer Group,michael.morales@example.net,001-894-280-6123,8844 Market St,Chicago,IL,60601,United States,65,deploy global interfaces,Mentioned a need for real-time analytics and dashboarding.,2025-09-27T18:38:17.271553,BOOTH-174
995a1072-6bb1-434d-8d47-dadb5c093d3c,425a6e03-22b0-4278-a269-7a95262e2c2d,Joseph,Oneill,Engineering Manager,Goodman and Sons,joseph.oneill@example.org,+1-560-517-8396x3684,2375 Oak St,Paris,Île-de-France,75001,France,69,incubate front-end technologies,Mentioned a need for real-time analytics and dashboarding.,2025-10-01T01:05:50.958595,BOOTH-174
d8b8cc69-4988-4a86-9498-f5388153696a,624c60d0-dfaa-45d6-a6fd-e9b94ad304c8,Amy,Holden,Backend Developer,"Mcfarland, Alvarez and Reeves",amy.holden@example.org,643-695-0193,4817 Oak St,Los Angeles,CA,90001,United States,99,iterate dot-com niches,Asked detailed questions about our GraphQL API rate limits.,2025-01-21T04:35:03.653203,BOOTH-174
39f58caa-cc5b-4799-b5b4-26fd2b22135e,59e5aa73-c5d2-4378-bec5-68aa2271f23e,Cody,Robertson,Technical Writer,Davis Ltd,cody.robertson@example.net,(799)799-3937,8982 Maple Ave,San Francisco,CA,94105,United States,38,architect next-generation markets,Concerned about data sovereignty and GDPR compliance in the EU region.,2025-07-28T06:30:00.488810,BOOTH-174
c420bf20-5af9-40f4-af6b-f0cc8517fff1,c6c81528-ceac-41f5-8270-2224642033cb,Melissa,Mccoy,Product Manager,Miller and Sons,melissa.mccoy@example.org,(237)989-8527x8642,7982 Maple Ave,New York,NY,10001,United States,24,drive transparent supply-chains,Looking for a partner to help with a large-scale cloud migration.,2025-02-27T17:44:53.500888,BOOTH-174
1a7c0195-9695-43ab-b8ac-da7e9a5fe8f9,a2f3dceb-6e1c-4344-9d60-5a97793ac35c,Ashley,Bennett,Product Manager,"Arnold, Shelton and Benton",ashley.bennett@example.net,+1-437-293-1572x8275,7632 Main St,Montreal,QC,H3B 1A7,Canada,78,seize killer infrastructures,Looking for a partner to help with a large-scale cloud migration.,2025-01-14T01:01:31.860092,BOOTH-174
1550659c-e151-4724-a650-1c72d4f479da,39ddc0c9-dac2-4ef4-a295-aa0bb1a5e2f2,Frank,Vasquez,DevOps Engineer,"Williamson, Lewis and Lowe",frank.vasquez@example.net,001-472-830-5402x203,7761 Innovation Way,Boston,MA,02110,United States,3,deploy distributed convergence,Suffering from database locking issues; looking for advice.,2025-06-23T11:29:01.079074,BOOTH-174
2603b6bb-d9b7-470a-a5f1-4a4f0cbc70ef,e42e16ee-3613-42b2-99ea-241951421e57,Steven,Wagner,Solutions Architect,"Stevenson, Williams and Burns",steven.wagner@example.org,+1-316-826-1083x7673,5837 Market St,Denver,CO,80202,United States,96,envisioneer vertical action-items,Looking to replace their current data warehouse with a more scalable solution.,2025-02-27T00:56:26.626198,BOOTH-174
f34fd766-9d7d-4929-a07f-7c32ab1475ef,a7a6b9bc-5187-4386-a551-3557d131dcab,Jacob,Petersen,Database Administrator,Colon Group,jacob.petersen@example.com,766-552-2152x4228,8968 Market St,San Francisco,CA,94105,United States,19,iterate web-enabled markets,Wants to know more about our machine learning model training capabilities.,2025-02-04T07:18:54.131158,BOOTH-174
4ba702e1-e15b-4b66-a923-5fc099648a59,fdc19b33-f656-4e7a-ba7a-d4861e34f685,Sydney,Stewart,Cybersecurity Analyst,King Inc,sydney.stewart@example.org,864.833.6217x40487,5845 Innovation Way,Mexico City,CDMX,01000,Mexico,62,expedite 24/365 platforms,Discussed potential integration with their existing Kubernetes cluster.,2025-09-28T21:43:21.189193,BOOTH-174
048dffb8-9375-42fe-9e03-47db11c05633,64a6348b-5e7d-4141-8500-4deaab956101,Mark,Davidson,Technical Writer,Mendez Ltd,mark.davidson@example.net,599-537-0551x35059,1158 Tech Blvd,Manchester,England,M1 1AE,United Kingdom,82,drive impactful platforms,Asked if we support Terraform providers for infrastructure as code.,2025-09-23T23:54:41.834502,BOOTH-174
bdc179c0-1852-44dd-b530-88b9acbf1777,f365fa3b-ba3a-47de-8e4a-528f67fba408,Daisy,Guerra,Cloud Architect,"Perez, Wilson and Case",daisy.guerra@example.org,771.517.5125x9076,1389 Broadway,Chicago,IL,60601,United States,44,drive global technologies,Interested in automated testing strategies for their mobile app.,2025-09-15T03:03:01.135761,BOOTH-174
91354f87-b0a7-4214-a03f-cf82a1949a87,fcb657de-d693-498b-8bb3-8043e1dee4e7,Lisa,Grant,Data Engineer,"Cole, White and Spencer",lisa.grant@example.org,001-727-247-3519,9584 Broadway,Montreal,QC,H3B 1A7,Canada,24,re-intermediate dot-com relationships,Excited about the roadmap for serverless function support.,2025-05-31T13:58:52.637607,BOOTH-174
8212c56d-2d66-4ccc-9ffa-e7830b4e5776,6fb14318-5b80-4e7a-893d-df1c5d9113f2,Alexandra,Greene,UX/UI Designer,"Robinson, Choi and Walker",alexandra.greene@example.net,(704)352-5922x733,3050 Maple Ave,Austin,TX,73301,United States,13,transform granular partnerships,Wants to schedule a deep-dive demo of the new security features.,2025-08-30T10:15:35.131979,BOOTH-174
35d0bdcd-5caf-46ab-b6d6-590cce2a594e,dcced425-6055-478b-9ffa-1399955c5c44,Karen,Coleman,Senior Software Engineer,Santana-Jordan,karen.coleman@example.com,717.711.9347x801,4707 Tech Blvd,Miami,FL,33101,United States,37,disintermediate collaborative experiences,Asked about our uptime SLAs and incident response times.,2025-02-05T20:17:35.037271,BOOTH-174
3f066876-ca30-4f9f-ab3e-667613a9bdef,4622ecf1-1d88-4a2b-8b8a-7b47697da3f6,Samuel,Brown,Technical Writer,Brown PLC,samuel.brown@example.com,773.944.5868,836 Maple Ave,London,England,SW1A 1AA,United Kingdom,18,innovate viral systems,Interested in migrating legacy systems to a microservices architecture.,2025-06-08T16:06:54.196193,BOOTH-174
1c6e2605-cee6-4eff-95d5-23e040de94f1,b9bda3cf-e37a-4061-a283-c1bf09417852,Meghan,Giles,Systems Administrator,Russo-Simmons,meghan.giles@example.org,(969)350-3178x1393,3780 Market St,Montreal,QC,H3B 1A7,Canada,97,innovate mission-critical niches,Wants to integrate our widget into their React Native application.,2025-01-05T18:37:21.439730,BOOTH-174
4d8239ba-e2d9-42c3-a683-8c6d4849cbbf,e33e0b36-6416-4a97-a896-5b433c7e4a6b,Kara,Wilkerson,Test Automation Engineer,Simpson-Young,kara.wilkerson@example.com,+1-952-273-1970x72327,2362 Maple Ave,Dublin,Dublin,D01,Ireland,52,embrace turn-key architectures,Inquired about volume pricing for high-throughput data streaming.,2025-08-06T08:15:12.680557,BOOTH-174
04944606-bd07-4a52-890b-dbfde3cd044a,bfd8501a-8810-454b-b437-a6736d021460,Michael,Wilson,Developer Advocate,"Ball, Williams and Smith",michael.wilson@example.net,001-502-455-8318x35705,1477 Washington St,Seattle,WA,98109,United States,38,transform cross-platform markets,Exploring options for edge computing and low-latency delivery.,2025-08-24T19:13:22.122466,BOOTH-174
67683156-d75e-48ca-add0-bd81b48954c3,f6ec4f98-0184-4d15-991d-fccab0d4e929,Gregory,Myers,Network Engineer,Stewart PLC,gregory.myers@example.org,971.809.8613x05984,3583 Main St,Los Angeles,CA,90001,United States,100,reinvent 24/365 interfaces,Asked detailed questions about our GraphQL API rate limits.,2025-07-25T22:38:37.805611,BOOTH-174
acad129b-be1c-4177-a783-d0b549fce693,ef0e1ae2-90ee-4f83-ad56-562eb73b562b,Michael,Bernard,Backend Developer,Pearson-Evans,michael.bernard@example.com,790.281.1325,5913 Main St,Atlanta,GA,30303,United States,57,strategize user-centric infrastructures,Discussed the benefits of Rust over C++ for their new engine.,2025-02-25T15:08:55.835359,BOOTH-174
04e5acd0-1c2b-451a-b74a-cff7e58093be,ebb46419-0f32-452a-bec8-40b6227063a1,Samantha,Payne,Senior Software Engineer,Smith LLC,samantha.payne@example.org,001-609-928-9371x0740,8737 Maple Ave,Miami,FL,33101,United States,92,optimize virtual methodologies,Asked detailed questions about our GraphQL API rate limits.,2025-10-08T01:28:40.508782,BOOTH-174
b28ee8d6-3035-4ff6-a6f4-95f022c08bad,17a46131-0f01-4945-a117-03fdbc1b271c,Richard,Henry,Solutions Architect,Downs-Gallagher,richard.henry@example.org,001-723-804-8271x6228,3725 Broadway,Chicago,IL,60601,United States,79,grow magnetic methodologies,Concerned about data sovereignty and GDPR compliance in the EU region.,2025-04-01T14:46:59.337708,BOOTH-174
a0de2992-b91b-4c87-92a5-896729d32d37,81adf169-0812-4064-b8b6-18edae94be18,Paula,Foster,Full Stack Developer,Mcintyre-Herrera,paula.foster@example.org,311.263.5582,5990 Broadway,Ottawa,ON,K1P 1J1,Canada,45,leverage front-end communities,Looking to replace their current data warehouse with a more scalable solution.,2025-03-11T22:51:42.129403,BOOTH-174
150403ff-a500-4245-8800-cde668345963,5d73ed35-96e4-469c-84c9-ffbb15e4d329,Adrian,Hicks,Database Administrator,Kelly-Duke,adrian.hicks@example.net,(778)953-4279x81206,7881 Main St,Manchester,England,M1 1AE,United Kingdom,29,iterate extensible e-commerce,Excited about the roadmap for serverless function support.,2025-03-19T04:55:35.074522,BOOTH-174
b324d2bc-6bfe-4256-b65b-74956abf439c,7c544c8f-42d4-472d-a44e-32a92fbd408e,Bryan,Henry,Software Engineer,Best and Sons,bryan.henry@example.com,001-765-203-1624x725,6429 Broadway,Montreal,QC,H3B 1A7,Canada,66,morph frictionless e-business,Asked detailed questions about our GraphQL API rate limits.,2025-07-08T13:03:26.249239,BOOTH-174
a250abd0-89b2-46e5-85b3-99948f079351,16392cca-c9e3-4370-b096-8984312c24fe,Mark,Allen,Senior Software Engineer,"Glover, Carpenter and Schultz",mark.allen@example.com,+1-809-893-2570x05387,4309 Main St,Seattle,WA,98109,United States,29,cultivate collaborative e-tailers,Interested in migrating legacy systems to a microservices architecture.,2025-05-21T16:37:18.322861,BOOTH-174
9230016f-993f-4c30-993b-eb675ebb936f,c1353446-f5a2-4c90-baff-2df2801ca81f,Nancy,Leon,Test Automation Engineer,"Chavez, Keller and Garcia",nancy.leon@example.com,+1-945-918-4757x564,426 Maple Ave,New York,NY,10001,United States,91,seize bricks-and-clicks systems,Exploring options for edge computing and low-latency delivery.,2025-07-24T14:14:08.098162,BOOTH-174
85941c0f-7f44-4be2-9348-897904974f0d,dcded018-31e4-4274-8d81-fcfb72f31e50,Brian,Leonard,Product Manager,Hull-Davis,brian.leonard@example.org,+1-907-254-5659x81989,8521 Oak St,Dublin,Dublin,D01,Ireland,48,transition sticky e-markets,Inquired about volume pricing for high-throughput data streaming.,2025-03-16T11:12:59.034709,BOOTH-174
b895ee05-b683-4bb0-baac-be9aad902c25,4cdef8c4-4bac-4deb-be65-c1544a8f8b73,Mary,Miller,Cybersecurity Analyst,Brown Inc,mary.miller@example.com,8263195537,1747 Washington St,Austin,TX,73301,United States,63,morph viral users,Needs better documentation for the Python SDK.,2025-09-02T20:56:50.324141,BOOTH-174
be68aaf9-3e2a-43a5-aebf-ff517d6deb96,10f80a21-3a43-41d2-9b1a-bdc1009f8415,John,Olsen,Cybersecurity Analyst,Lopez LLC,john.olsen@example.com,001-789-582-9922x79882,1324 Main St,Austin,TX,73301,United States,56,enable strategic action-items,Looking to replace their current data warehouse with a more scalable solution.,2025-02-25T20:25:56.718425,BOOTH-174
fefe6549-bcd9-4c13-bb10-d77087b11058,492a0959-e8e2-4ece-be84-3532696f5eaa,Cheryl,Alvarado,Developer Advocate,"Lee, Powell and Rogers",cheryl.alvarado@example.com,8267213659,5631 Broadway,Boston,MA,02110,United States,28,whiteboard viral web services,Looking for a partner to help with a large-scale cloud migration.,2025-01-05T04:39:41.725462,BOOTH-174
bc826310-fc10-457c-9502-e09d56e62ce7,1bc80827-aacb-4485-aca8-4f46fe0dd249,April,Sanchez,UX/UI Designer,Gomez-Tucker,april.sanchez@example.com,650.943.3988x9150,1936 Maple Ave,Singapore,SG,049318,Singapore,8,e-enable virtual schemas,Looking to replace their current data warehouse with a more scalable solution.,2025-01-01T20:55:43.503646,BOOTH-174
0142fe79-28dc-40ea-8af8-8cf5d9a87a21,b5e15c6a-5147-460b-81e3-21ff1f1d67e1,Melissa,Gonzalez,Cloud Architect,Fowler PLC,melissa.gonzalez@example.com,001-983-804-9555x1682,4692 Market St,Chicago,IL,60601,United States,84,redefine intuitive mindshare,Interested in migrating legacy systems to a microservices architecture.,2025-07-23T01:09:02.061752,BOOTH-174
64f771a5-7486-44aa-9d83-ef57f6ad7c01,f11f1a8c-0a8c-450d-b729-84c1533bd91e,Danielle,Mcdonald,QA Engineer,Cook Inc,danielle.mcdonald@example.org,466-305-7402,9758 Tech Blvd,New York,NY,10001,United States,3,facilitate e-business platforms,Wants to schedule a deep-dive demo of the new security features.,2025-07-18T13:20:56.527210,BOOTH-174
e3460dc0-55e2-4267-aa50-807861e1acf8,91ff4996-8e3d-4810-b294-2bcd14f11748,Lynn,Cross,UX/UI Designer,Barnes and Sons,lynn.cross@example.org,+1-683-476-8211x187,4805 Broadway,Mumbai,MH,400001,India,22,strategize integrated communities,Exploring options for edge computing and low-latency delivery.,2025-04-17T05:41:57.376485,BOOTH-174
8a898faa-3181-4040-bbbc-6ed6a5d2711a,2b130d50-a85a-4f68-b09a-6e963cd39ba1,Pamela,Jimenez,Technical Product Manager,"Beard, Maldonado and Mckee",pamela.jimenez@example.net,001-624-598-8285x9615,7591 Maple Ave,Austin,TX,73301,United States,58,re-contextualize virtual bandwidth,Looking for a partner to help with a large-scale cloud migration.,2025-07-22T23:36:50.795247,BOOTH-174
6f8a0486-e93f-4fad-8e03-f896084e10f8,6e3e53c1-36ec-4ebb-9f5e-296dc00a428a,Kenneth,Higgins,Technical Writer,Lee Inc,kenneth.higgins@example.org,(443)250-4143x313,7834 Maple Ave,Stockholm,Stockholm,111 22,Sweden,32,strategize front-end models,Wants to know more about our machine learning model training capabilities.,2025-09-21T12:57:32.431009,BOOTH-174
a4367147-add9-48fc-9e1f-198efb07e378,312f4568-c163-4a2f-a246-7e7ba153749d,Nancy,Scott,Technical Product Manager,"Willis, Lopez and Brown",nancy.scott@example.net,389-973-4154x99650,904 Tech Blvd,Boston,MA,02110,United States,24,embrace cross-platform e-commerce,Asked about our uptime SLAs and incident response times.,2025-02-07T00:50:51.202254,BOOTH-174
f8b1a885-bd57-4e61-a766-981bf62110fe,8a235120-977f-4f0e-a883-4f262be24e5a,Melissa,Ramirez,Security Engineer,Melton-Armstrong,melissa.ramirez@example.org,+1-944-908-4174x79739,1160 Broadway,Rio de Janeiro,RJ,20000-000,Brazil,6,syndicate B2B functionalities,Suffering from database locking issues; looking for advice.,2025-06-06T12:25:26.554457,BOOTH-174
706e70c6-f78d-4298-8a6a-e7a39e8c367e,9911b0a5-a83a-422b-8ce6-8bcc1f4ae58f,Tyler,Williams,Cybersecurity Analyst,"Snow, Sharp and Greene",tyler.williams@example.com,(699)947-1947,662 Washington St,Denver,CO,80202,United States,33,productize vertical systems,Exploring options for edge computing and low-latency delivery.,2025-06-08T05:33:15.445070,BOOTH-174
8c7b5d83-8fa3-4fdf-bd1e-72e641246abe,e025673f-1078-401f-96c0-eb927ca4e125,Darlene,Valdez,Cybersecurity Analyst,Hernandez-Mcconnell,darlene.valdez@example.net,(857)476-0127,4603 Maple Ave,Denver,CO,80202,United States,18,engineer mission-critical metrics,Discussed potential integration with their existing Kubernetes cluster.,2025-06-18T02:14:11.037565,BOOTH-174
6cbf7870-82e8-4fcc-94c9-6b6dbf4fb0f1,9e604692-4d88-4626-955c-f21fc6f909f0,Anthony,Banks,Systems Administrator,"Horne, Montoya and Rodriguez",anthony.banks@example.org,5389881578,8933 Market St,San Francisco,CA,94105,United States,68,disintermediate B2B partnerships,Evaluating the feasibility of a multi-tenant architecture.,2025-09-12T06:27:34.173487,BOOTH-174
e0120501-fcfb-42d5-9063-2118effc3a39,60a47920-875a-49bd-a749-65c8429399f4,Stephen,Gonzalez,Engineering Manager,"Jackson, Doyle and Jackson",stephen.gonzalez@example.net,+1-477-679-0121,8749 Innovation Way,Los Angeles,CA,90001,United States,75,scale compelling solutions,Asked detailed questions about our GraphQL API rate limits.,2025-01-22T01:17:45.090159,BOOTH-174
220095b9-26e2-4711-ac63-b0b14e678e98,b71f9ebe-e184-4c1c-889c-b04b992f208e,Lisa,Wong,Site Reliability Engineer (SRE),"Lopez, Larson and Campbell",lisa.wong@example.org,7966093294,5837 Main St,Miami,FL,33101,United States,82,monetize extensible content,Interested in migrating legacy systems to a microservices architecture.,2025-06-06T21:50:11.495051,BOOTH-174
8a72c06e-19a7-48ae-b040-1d8d90aaff6c,ce15bccf-53a8-4390-ba04-31b978ea2fad,Eric,Randall,Database Administrator,"Peterson, Zimmerman and Dougherty",eric.randall@example.org,4196677403,3995 Innovation Way,Calgary,AB,T2P 1J9,Canada,25,synergize world-class e-markets,Evaluating our platform against AWS and Azure alternatives.,2025-05-31T12:52:33.619785,BOOTH-174
6cb0452b-51f4-40e3-9f93-c23807feebf3,e551aa77-b65b-4948-95db-79063b03b665,Angela,Flores,QA Engineer,Vega-Reilly,angela.flores@example.com,629-525-6843x27653,2701 Maple Ave,Seattle,WA,98109,United States,84,visualize ubiquitous experiences,Looking for a partner to help with a large-scale cloud migration.,2025-02-24T23:56:36.016054,BOOTH-174
fdbb905a-fbba-45d1-880a-96a036f5ad85,f454a5d3-c828-40ce-8e20-7cffd94aca68,Jorge,Thompson,Full Stack Developer,Fisher-Diaz,jorge.thompson@example.org,(489)988-3876x680,9450 Main St,Calgary,AB,T2P 1J9,Canada,76,brand sticky solutions,Wants to schedule a deep-dive demo of the new security features.,2025-08-23T00:57:11.632842,BOOTH-174
aa8d5b80-f6bd-422e-a78e-61b2ee975497,f81228d0-022a-417e-a9e5-f0a9fd59f88e,Sierra,Kaiser,Systems Administrator,"Vega, Gregory and Wright",sierra.kaiser@example.net,+1-746-704-9630x6314,3827 Tech Blvd,Austin,TX,73301,United States,99,enhance web-enabled solutions,Exploring options for edge computing and low-latency delivery.,2025-01-20T06:50:47.728903,BOOTH-174
5b716995-a70b-4b77-984d-b37df62f34c8,8dfa8c41-c9d0-4adc-971d-2f558463cac2,Jacqueline,Ferguson,CTO,Ryan Group,jacqueline.ferguson@example.net,(396)964-8943x5967,2245 Main St,Miami,FL,33101,United States,42,grow granular portals,Discussed the benefits of Rust over C++ for their new engine.,2025-05-27T08:43:31.839226,BOOTH-174
e9a863e8-fc67-470f-bf84-ce8fc2c1fd12,c34e1e5f-9a7b-444e-b608-539ab0128a29,Mark,Baker,Engineering Manager,"Cook, Reeves and Richardson",mark.baker@example.com,960-906-1197,6503 Innovation Way,Los Angeles,CA,90001,United States,18,revolutionize integrated networks,Suffering from database locking issues; looking for advice.,2025-07-03T12:43:56.458731,BOOTH-174
fef8bcce-d4d2-4716-8b7a-4ad36e7cd9ba,8bdf6c14-fd47-4c28-a820-08ddb05fc667,Jeremy,Roberts,Technical Product Manager,"Romero, Williams and Smith",jeremy.roberts@example.com,+1-410-640-7029,8420 Market St,Montreal,QC,H3B 1A7,Canada,29,iterate strategic solutions,Interested in automated testing strategies for their mobile app.,2025-09-08T22:00:59.992381,BOOTH-174
5da05b33-4908-451c-ad85-38ac498a5826,ecb6b190-a462-415a-9064-19dd90bce655,Willie,Miles,Data Scientist,Delgado PLC,willie.miles@example.com,(203)332-3675x1834,5844 Oak St,New York,NY,10001,United States,39,evolve best-of-breed users,Looking for a solution to optimize their CI/CD pipeline latency.,2025-05-22T17:30:46.132025,BOOTH-174
084ab713-49f7-41f3-81e8-8c36fb053c99,3fa80273-e331-4413-91a1-abb8aa1ed448,Brian,Anderson,Frontend Developer,Robinson LLC,brian.anderson@example.org,+1-916-363-1665x28976,4441 Innovation Way,Boston,MA,02110,United States,81,morph virtual eyeballs,Mentioned a need for real-time analytics and dashboarding.,2025-04-04T10:19:04.281007,BOOTH-174
652e4bf2-8d5b-417c-b367-3ae2906260a0,06a208df-5c20-4d2f-80b0-2b39605f8e27,Austin,Cantu,Backend Developer,Garner Ltd,austin.cantu@example.net,+1-654-520-2388,7864 Main St,London,England,SW1A 1AA,United Kingdom,44,seize back-end infrastructures,Looking for a solution to optimize their CI/CD pipeline latency.,2025-06-20T22:14:35.885346,BOOTH-174
5c084d35-97bc-4410-95ca-dbc3c1083aa0,dc0dc84e-4650-44d5-88d2-7c9f8b479c1a,Karen,Silva,Technical Writer,Nunez PLC,karen.silva@example.org,289-900-6846,9385 Tech Blvd,Guadalajara,JAL,44100,Mexico,56,harness sticky interfaces,Discussed the benefits of Rust over C++ for their new engine.,2025-05-28T20:27:53.969486,BOOTH-174
5c510b37-72ec-4448-a4bc-4660067f52ea,d4b0b960-cf13-4bfd-9d8a-140b3628399e,Jared,Johnson,Solutions Architect,"Wade, Smith and Wilson",jared.johnson@example.org,524.784.9744,1739 Washington St,Boston,MA,02110,United States,8,disintermediate viral systems,Asked detailed questions about our GraphQL API rate limits.,2025-08-20T19:45:04.804627,BOOTH-174
76753b0b-b0bd-4764-9d0e-d2fa4bc3bdb3,726a7870-c857-4cb5-a992-7aa4f7819912,Samuel,Daniels,Frontend Developer,"Davis, Swanson and Hill",samuel.daniels@example.org,3455914152,1222 Tech Blvd,Montreal,QC,H3B 1A7,Canada,31,deliver rich infrastructures,Excited about the roadmap for serverless function support.,2025-06-05T23:46:39.698504,BOOTH-174
bf73bde7-31cb-4761-9109-21e059489732,80ae26f3-d8c7-4aa9-b40c-d6b75945f349,Mary,Duncan,Test Automation Engineer,"Castillo, Harrell and Francis",mary.duncan@example.com,001-700-943-0608x33420,9016 Broadway,Berlin,Berlin,10115,Germany,85,syndicate proactive ROI,Looking to replace their current data warehouse with a more scalable solution.,2025-04-09T04:18:54.071198,BOOTH-174
