Scan ID,Attendee ID,First Name,Last Name,Title,Company,Email,Phone,Address,City,State,Postal Code,Country,Lead Score,Qualifiers,Notes,Timestamp,Session ID
e3c8bc4c-8c29-4c35-a947-b91b2e66444c,8517e185-40f0-4897-b9a2-067a6b6582d7,James,Serrano,Full Stack Developer,"Pope, Mcdonald and Sellers",james.serrano@example.com,001-698-348-6377x015,9998 Market St,Chicago,IL,60601,United States,68,brand 24/7 synergies,Curious about our websocket support for real-time chat.,2025-05-29T14:14:17.569477,BOOTH-174
820e9297-bc8e-4236-adaa-6de63cabe532,9945655e-d367-445e-a6b3-61eec760572d,Gabrielle,Green,CTO,Lee-Williams,gabrielle.green@example.com,(502)684-9641,8239 Washington St,Toronto,ON,M5H 2N2,Canada,19,optimize granular relationships,Looking for a solution to optimize their CI/CD pipeline latency.,2025-03-24T19:52:56.005774,BOOTH-174
d4163290-aab1-4a0d-8b2f-e8c668eb1593,addefc64-edc4-4f32-a849-c25c6ca5ba8c,Paula,Munoz,Senior Software Engineer,Arnold-Campbell,paula.munoz@example.com,574.237.5610,2371 Market St,Miami,FL,33101,United States,41,extend frictionless models,Concerned about data sovereignty and GDPR compliance in the EU region.,2025-09-05T00:01:22.094288,BOOTH-174
0ea6acac-ae6e-49eb-b9f3-067c3ebfd06e,15d1e91b-ab07-425c-93e0-a75af060df42,Frank,Liu,Mobile Developer,Hawkins Group,frank.liu@example.org,+1-805-250-7787x709,7023 Broadway,Atlanta,GA,30303,United States,11,transform viral bandwidth,Suffering from database locking issues; looking for advice.,2025-08-22T13:04:12.017887,BOOTH-174
8ab033be-a92b-47bb-bbc9-147fe71417aa,fae973ce-04a6-4642-b9f0-8ab27cae8b95,Amy,Walker,Machine Learning Engineer,"Wall, Baker and Fuller",amy.walker@example.org,+1-803-365-1954,7126 Washington St,Rio de Janeiro,RJ,20000-000,Brazil,77,maximize web-enabled niches,Wants to integrate our widget into their React Native application.,2025-03-02T01:30:56.997208,BOOTH-174
a82ba650-722e-43b1-93a6-8dc7ad8d85a2,34d175af-2b0b-4de6-b3c3-f4cbfae2226e,Ronnie,Barnes,Cloud Architect,Ferguson PLC,ronnie.barnes@example.org,531.489.9667x60313,5711 Maple Ave,San Francisco,CA,94105,United States,1,extend customized initiatives,Curious about our websocket support for real-time chat.,2025-03-04T18:13:20.972190,BOOTH-174
36ee2501-916f-4f32-9922-d95d65ae7d87,ff7f68b2-5827-4102-ba9d-cec19df99284,Melanie,Schmidt,Data Engineer,Carlson LLC,melanie.schmidt@example.net,+1-985-758-7557x715,1801 Innovation Way,Calgary,AB,T2P 1J9,Canada,8,extend clicks-and-mortar eyeballs,Interested in migrating legacy systems to a microservices architecture.,2025-05-13T11:36:44.577191,BOOTH-174
bc434f62-f016-4907-a130-70604ad3da98,c35f3dfb-5ae7-4908-aef5-a015f3bc752f,Christine,Johnson,Database Administrator,"Brooks, Braun and Macias",christine.johnson@example.org,451-721-6949x182,4690 Washington St,San Francisco,CA,94105,United States,44,maximize mission-critical vortals,Looking for a partner to help with a large-scale cloud migration.,2025-04-27T02:37:00.308773,BOOTH-174
61020811-3c2b-4cf9-8d2c-f4109afaff58,76f5f06e-a9b3-4961-9204-551433083d95,Kevin,Stephenson,Full Stack Developer,Taylor Ltd,kevin.stephenson@example.net,(649)892-2329x00090,8927 Market St,Atlanta,GA,30303,United States,42,strategize intuitive partnerships,Looking for a solution to optimize their CI/CD pipeline latency.,2025-09-05T22:00:19.576624,BOOTH-174
87855543-4da7-4a78-89fb-20b756427a11,8cd093af-a7fe-412e-adf0-b02918342407,Gilbert,Brown,Security Engineer,Williams LLC,gilbert.brown@example.com,533-678-6216x9683,163 Tech Blvd,Austin,TX,73301,United States,87,syndicate granular e-business,Encountered friction with the SSO setup; needs technical support.,2025-01-18T03:24:04.890370,BOOTH-174
132da8b3-b093-40bf-a49b-0f050517668d,f8391532-a180-4d01-9829-141e16bf462b,Kimberly,Clements,Solutions Architect,"Phillips, Wolfe and Banks",kimberly.clements@example.net,994-995-8633,4684 Washington St,Atlanta,GA,30303,United States,96,target scalable bandwidth,Wants to know more about our machine learning model training capabilities.,2025-03-20T00:58:14.061328,BOOTH-174
fac5a9c2-fe01-4799-851b-69bc40829eaf,93c5ae8c-6b2e-4366-8d2c-3647b0820e94,Amy,Simon,Network Engineer,Baird-Delgado,amy.simon@example.com,001-836-643-9543x39156,6711 Innovation Way,Seattle,WA,98109,United States,10,facilitate compelling systems,Wants to know more about our machine learning model training capabilities.,2025-01-23T13:19:26.955824,BOOTH-174
149008a9-104d-459d-9eb4-466a5c37e1d3,e099a4f1-168d-47d8-b00f-55e71a9238fb,Sandra,Ortiz,Senior Software Engineer,Gross-Gomez,sandra.ortiz@example.com,001-359-920-2007x236,1073 Oak St,Singapore,SG,049318,Singapore,81,streamline mission-critical solutions,Exploring options for edge computing and low-latency delivery.,2025-05-22T10:33:04.505168,BOOTH-174
eba92fc9-d703-4548-976f-09ccf72c7ce8,fab07274-77f4-4ba7-a7c9-cfd63f79ab52,Keith,Wilson,Software Engineer,Smith-Thomas,keith.wilson@example.net,001-466-707-2723x90449,5643 Innovation Way,Los Angeles,CA,90001,United States,76,seize dot-com schemas,Needs better documentation for the Python SDK.,2025-04-20T00:15:52.820441,BOOTH-174
b8bf2505-b051-40e4-9a06-0015e5bd45fd,5d18eaa6-2d5d-46b9-ae8f-be626d925c54,Stephen,Rowe,Engineering Manager,"Lewis, Allen and Chambers",stephen.rowe@example.org,(771)599-5116,6869 Market St,Los Angeles,CA,90001,United States,72,extend killer synergies,Needs better documentation for the Python SDK.,2025-05-26T14:59:02.185338,BOOTH-174
603c0e7a-1f8b-466f-b64f-a6e6375c8764,6e355713-d739-4695-96d3-bf937e3a6d36,Jennifer,Henry,Developer Advocate,Collins Group,jennifer.henry@example.org,856-907-1884,1101 Broadway,Seattle,WA,98109,United States,38,empower clicks-and-mortar channels,Looking to replace their current data warehouse with a more scalable solution.,2025-06-05T07:50:10.908074,BOOTH-174
c7c0f451-349e-4bcd-b579-70ce7f1863d3,ace7b82b-73e5-4c81-8a9e-70088b70492d,Courtney,Jones,Engineering Manager,"Hall, Perez and Andrade",courtney.jones@example.com,001-362-969-2007,6945 Broadway,San Francisco,CA,94105,United States,21,mesh proactive users,Curious about our websocket support for real-time chat.,2025-08-22T08:16:09.883723,BOOTH-174
c1cf6393-bec6-4b17-948a-c857151e1341,2a53feeb-7c2e-491a-bc86-fb643703a3eb,Judith,Garner,Security Engineer,"Cole, Harris and Adams",judith.garner@example.net,(538)922-1019,6867 Market St,Atlanta,GA,30303,United States,65,empower seamless experiences,Curious about our websocket support for real-time chat.,2025-07-30T22:56:01.796966,BOOTH-174
071f921a-ee99-4993-be0b-e475458cff82,469687d3-0015-4b62-8c71-b40152900091,Tony,Frederick,Database Administrator,"Davis, Myers and Adams",tony.frederick@example.net,796-457-4971x2578,7004 Maple Ave,Sydney,NSW,2000,Australia,20,streamline dot-com e-markets,Evaluating our platform against AWS and Azure alternatives.,2025-01-06T03:01:41.490422,BOOTH-174
a2c8d285-4d6f-4307-9d8f-32d1bce90fa3,13b57603-650d-46b2-afd5-cbdbe89c8b62,Kathleen,Mcclure,Android Developer,Jensen-Whitaker,kathleen.mcclure@example.com,(765)932-2980,5216 Tech Blvd,Miami,FL,33101,United States,43,envisioneer proactive users,Interested in migrating legacy systems to a microservices architecture.,2025-04-12T23:25:20.990433,BOOTH-174
4b6d3440-bb0b-4ed9-8491-fa3e8b4ea4ad,7be73429-310b-434c-8ad0-1331335d7c09,Kimberly,Valdez,Senior Software Engineer,Reeves-Anderson,kimberly.valdez@example.org,(600)269-3087,3920 Tech Blvd,Denver,CO,80202,United States,95,strategize scalable e-tailers,Encountered friction with the SSO setup; needs technical support.,2025-06-27T18:48:16.059608,BOOTH-174
cec8f2a6-5cce-4b00-b23f-25a349caa52c,4dcf83f1-d6ec-4177-a5ba-ac81e553905d,Blake,Burke,Android Developer,Wolfe-Jones,blake.burke@example.net,782.920.0814x5635,2927 Maple Ave,Manchester,England,M1 1AE,United Kingdom,19,optimize integrated interfaces,Discussed potential integration with their existing Kubernetes cluster.,2025-05-17T16:31:15.533314,BOOTH-174
d54d4ca9-c420-4246-b6e7-7b29ec75b1e0,34294b14-7d02-4281-9e9c-1329d1adbe6e,Barbara,Hahn,Developer Advocate,Jones Group,barbara.hahn@example.org,770.262.8878x8630,5126 Tech Blvd,Los Angeles,CA,90001,United States,62,monetize clicks-and-mortar web services,Wants to integrate our widget into their React Native application.,2025-02-08T21:33:18.148026,BOOTH-174
063d0c3d-04bf-475a-a446-2f393778a80f,c1c58a5f-5b38-4076-93a3-ff31ed12b8a9,Jennifer,Smith,Solutions Architect,Smith PLC,jennifer.smith@example.com,001-920-614-0996x3159,3018 Broadway,Miami,FL,33101,United States,85,harness strategic eyeballs,Looking to replace their current data warehouse with a more scalable solution.,2025-03-21T00:04:05.332789,BOOTH-174
f1b480c8-32a3-4152-a4eb-507900838625,88d76951-0712-4e70-94f0-b0cf1b18fc45,Angela,Good,Network Engineer,Liu LLC,angela.good@example.com,+1-957-907-9025x22333,7810 Innovation Way,Austin,TX,73301,United States,45,exploit world-class experiences,Evaluating our platform against AWS and Azure alternatives.,2025-06-16T10:49:47.303066,BOOTH-174
f1d55f90-0163-413b-aa54-9791fdbbc5f3,59be1862-4667-45fd-b864-ccaaf0621186,Jennifer,Rhodes,VP of Engineering,"Wolf, Caldwell and Morgan",jennifer.rhodes@example.com,966-932-2732x576,1205 Oak St,Miami,FL,33101,United States,25,reinvent cross-platform e-tailers,Asked if we support Terraform providers for infrastructure as code.,2025-09-20T01:15:26.412281,BOOTH-174
dd95f9be-b0e5-4410-839b-cb468052f80e,24687793-a3e3-4427-a550-be7924a1522d,James,Savage,Technical Writer,"Riddle, Burns and Atkinson",james.savage@example.com,683-217-3898x5117,987 Main St,Boston,MA,02110,United States,10,seize compelling eyeballs,Discussed the benefits of Rust over C++ for their new engine.,2025-07-31T10:49:44.085112,BOOTH-174
cd36e95f-c9ac-4be7-b8c2-b76aaa92259c,22698911-04a0-4c3a-bd89-238e75a2067d,Victoria,Cooper,Security Engineer,Thompson-Cox,victoria.cooper@example.net,(970)282-5790x725,7042 Innovation Way,Boston,MA,02110,United States,20,revolutionize collaborative e-markets,Wants to schedule a deep-dive demo of the new security features.,2025-06-07T07:27:48.102365,BOOTH-174
f3eab63b-aebb-4821-8c4a-ff40293887d5,5653e687-b24f-4fc5-8c27-64ecccb34a6f,Jessica,Cooper,Frontend Developer,"Thomas, Boyd and Williams",jessica.cooper@example.net,(535)467-4481x00392,6907 Broadway,Tokyo,Tokyo,100-0001,Japan,52,productize cutting-edge experiences,Wants to integrate our widget into their React Native application.,2025-05-28T15:40:28.610797,BOOTH-174
40a6f885-4600-48bd-9222-f976fe4ac0f1,daa1b4fb-386c-4a74-b9dc-56a07e60315c,Sean,Hernandez,Developer Advocate,"Barr, Williams and Fowler",sean.hernandez@example.org,976.572.8850,4805 Washington St,San Francisco,CA,94105,United States,97,embrace integrated paradigms,Looking for a partner to help with a large-scale cloud migration.,2025-08-10T05:54:48.972230,BOOTH-174
13075f00-22f6-4b3f-84ac-874c01661f74,936a86a5-f9ac-439b-a4c7-86198a68e29a,Adam,Shelton,Full Stack Developer,"Brewer, Valenzuela and Dickerson",adam.shelton@example.com,546.701.3606,7028 Main St,New York,NY,10001,United States,74,deliver revolutionary platforms,Discussed the benefits of Rust over C++ for their new engine.,2025-02-28T23:39:41.743461,BOOTH-174
92175413-671c-4c38-bd0e-184bf728878e,3cb985c4-2a5e-423d-80d5-5475abd3135f,Joy,Reyes,Engineering Manager,Mitchell Inc,joy.reyes@example.org,+1-672-578-3938,2613 Innovation Way,Boston,MA,02110,United States,21,seize visionary partnerships,Needs a solution for log aggregation and anomaly detection.,2025-03-22T23:29:14.395509,BOOTH-174
447d9861-3e5d-4960-9f9c-a4d36aa07d55,ad738e79-af73-463e-8463-137d2ca0a5a2,Margaret,Lewis,Mobile Developer,Mcdonald Inc,margaret.lewis@example.org,001-911-533-7591x04529,3449 Oak St,Toronto,ON,M5H 2N2,Canada,42,enhance compelling partnerships,Evaluating our platform against AWS and Azure alternatives.,2025-06-24T13:23:29.156726,BOOTH-174
e36dd3b8-1f40-47a6-843d-bebe4111f7dc,d5cdaa72-f283-43d3-924b-4ee17dec76ed,Keith,Hardy,Cloud Architect,"Kane, Burns and Cruz",keith.hardy@example.com,001-817-268-9126x63711,9437 Innovation Way,Seattle,WA,98109,United States,93,incentivize proactive e-tailers,Mentioned a need for real-time analytics and dashboarding.,2025-09-01T04:29:20.442417,BOOTH-174
21f90191-432a-413a-b573-9d3026fa4fb1,82dc0cda-73e7-4907-826c-e9e98619e9cc,Nicole,Martinez,Cybersecurity Analyst,"Kelley, Davis and Mcgee",nicole.martinez@example.net,3052521490,6464 Oak St,Montreal,QC,H3B 1A7,Canada,53,maximize customized markets,Interested in automated testing strategies for their mobile app.,2025-02-12T21:25:00.914431,BOOTH-174
d3557d8c-e17f-4567-a0b2-b6b289ea7d1b,4236eb97-a216-4efa-b177-a9531e726585,Benjamin,Bailey,Product Manager,"Abbott, Goodman and Moore",benjamin.bailey@example.net,826.242.2867x01884,6980 Oak St,San Francisco,CA,94105,United States,33,transition web-enabled communities,Wants to schedule a deep-dive demo of the new security features.,2025-06-30T13:08:08.075533,BOOTH-174
a94f06a5-6750-48be-ab67-234b0d86be64,6419d9bf-a20a-4c81-afb9-11c672e2f046,Joseph,Ortiz,UX/UI Designer,"Johnson, Murray and Buckley",joseph.ortiz@example.org,(404)534-7399x665,8270 Main St,Denver,CO,80202,United States,82,streamline scalable synergies,Discussed the benefits of Rust over C++ for their new engine.,2025-09-26T02:37:54.512455,BOOTH-174
f911a442-8e33-41a3-8f7e-0a864c5a1578,5f8a6d16-a11a-48a2-95a6-f8726eb9719f,Sherri,Stanley,UX/UI Designer,Carson LLC,sherri.stanley@example.net,001-447-648-6777,1157 Market St,Los Angeles,CA,90001,United States,55,leverage collaborative systems,Evaluating the feasibility of a multi-tenant architecture.,2025-05-19T09:42:27.929439,BOOTH-174
4b58bb84-8548-426e-99ab-a591ebbe6f9c,7722d9f4-3986-4bfb-85e9-310742095827,Joshua,Davis,Backend Developer,Harper Group,joshua.davis@example.com,869-339-8493x5571,866 Innovation Way,Ottawa,ON,K1P 1J1,Canada,24,empower plug-and-play e-markets,Suffering from database locking issues; looking for advice.,2025-08-31T08:11:35.758222,BOOTH-174
62a2488b-311c-4777-b90c-99a57231dc06,832335db-fca8-404e-9b56-90f39cd93f1c,Jason,Jones,VP of Engineering,"Simmons, Miller and Robinson",jason.jones@example.com,562-563-6577x876,7209 Main St,Austin,TX,73301,United States,33,extend mission-critical bandwidth,Looking for a solution to optimize their CI/CD pipeline latency.,2025-07-27T08:55:13.369292,BOOTH-174
1921ab37-f83d-409b-810e-c7cdcfc6c21f,9e489615-2850-4ce9-9dce-4d20cc7bccbb,Danielle,Yates,Backend Developer,Herrera Ltd,danielle.yates@example.net,001-836-519-3159x316,8727 Oak St,Dublin,Dublin,D01,Ireland,24,extend B2B action-items,Asked about our uptime SLAs and incident response times.,2025-08-08T06:59:35.591088,BOOTH-174
7e2b23ad-8608-4a72-8037-df0f0069b58c,26d1bd5a-07d9-49b7-96c7-c0e367637cf1,Sandra,Salazar,Network Engineer,Burke-Crawford,sandra.salazar@example.com,(973)746-2508,8730 Tech Blvd,Los Angeles,CA,90001,United States,90,iterate bricks-and-clicks ROI,Wants to integrate our widget into their React Native application.,2025-02-21T00:05:35.688818,BOOTH-174
0d91e69d-443a-4147-9a3e-e0027fd75cb1,06c83d06-9698-44bb-99e3-d112366a67bd,Whitney,Smith,CTO,Moses-Gaines,whitney.smith@example.com,(581)496-3649x8584,6675 Innovation Way,New York,NY,10001,United States,46,innovate cross-platform metrics,Curious about our websocket support for real-time chat.,2025-09-29T00:41:14.653982,BOOTH-174
4d59330d-4c63-47af-a42e-5cd22b99965b,1bad6456-4f0b-4da8-87a4-e7c206af32cf,Deborah,Roberts,Data Scientist,Love-Patel,deborah.roberts@example.org,001-623-314-7616x14853,8998 Washington St,Chicago,IL,60601,United States,18,harness cutting-edge users,Asked detailed questions about our GraphQL API rate limits.,2025-05-16T08:21:36.977953,BOOTH-174
94199249-c6a4-49bf-a5bc-18091f858ecb,1c279d92-7794-4e0e-9599-2a918b7644e0,Jeanne,Kelly,Developer Advocate,Young Inc,jeanne.kelly@example.net,657.602.8734,2923 Broadway,Vancouver,BC,V6B 1P1,Canada,52,innovate next-generation technologies,Looking for a solution to optimize their CI/CD pipeline latency.,2025-05-06T03:26:19.262920,BOOTH-174
78af2027-431b-4fe2-ad5e-a0c9fc280064,bf8fa285-fe3e-4bad-8e72-b2db8b6afce1,Cole,Shaw,Network Engineer,Jones-Brown,cole.shaw@example.org,397-727-9865,8811 Maple Ave,São Paulo,SP,01000-000,Brazil,31,synthesize killer infrastructures,Inquired about volume pricing for high-throughput data streaming.,2025-04-06T00:52:14.035740,BOOTH-174
f342f991-00e6-41f3-8688-ec85be55aa47,9eca6079-c421-4a73-8b7e-a849b40546cf,Erika,Frey,iOS Developer,Rasmussen PLC,erika.frey@example.com,789.592.2308x988,7757 Innovation Way,Guadalajara,JAL,44100,Mexico,50,deliver proactive partnerships,Evaluating the feasibility of a multi-tenant architecture.,2025-08-30T04:11:51.086004,BOOTH-174
85554b3f-4d21-447d-b918-587a1fbdd7db,75aa1513-72d8-4c3f-bef8-363ec86e9f6f,Devin,Stevenson,Machine Learning Engineer,Carroll LLC,devin.stevenson@example.org,2987715961,5027 Washington St,Chicago,IL,60601,United States,50,deliver vertical channels,Encountered friction with the SSO setup; needs technical support.,2025-03-04T21:33:01.750488,BOOTH-174
8f1039b5-98ef-4f54-9402-86cef18421ec,0d43f6ef-eab5-48d3-81a7-baf898938f38,David,Marshall,Technical Product Manager,Gordon-Ward,david.marshall@example.net,940-216-5151x98026,1500 Broadway,Sydney,NSW,2000,Australia,57,maximize 24/7 info-mediaries,Encountered friction with the SSO setup; needs technical support.,2025-03-11T05:37:22.316806,BOOTH-174
b054c028-e19e-4060-a468-46f53c0c948b,eb4b39e4-9e1f-4ea3-9b24-f219be9cb535,Kimberly,James,Android Developer,Kelly-Anderson,kimberly.james@example.net,001-210-706-1448,932 Washington St,Los Angeles,CA,90001,United States,39,enhance cutting-edge initiatives,Looking for a partner to help with a large-scale cloud migration.,2025-03-28T09:49:10.333982,BOOTH-174
be83c2a3-889e-4538-9060-f0b87f21091b,230bd32b-e521-4afb-89e0-a6b996e7ecb1,Whitney,Mitchell,Android Developer,"Norris, Scott and Oneal",whitney.mitchell@example.org,734.676.9796,2217 Washington St,New York,NY,10001,United States,80,transition dot-com eyeballs,Asked detailed questions about our GraphQL API rate limits.,2025-01-25T08:34:01.752093,BOOTH-174
c8fe175c-435c-4ee1-83e9-503b2621d84c,86cc74ac-2135-42b2-8257-b901da99ff38,Christopher,Ferguson,Backend Developer,Garcia Inc,christopher.ferguson@example.net,001-225-250-9696x76216,6469 Maple Ave,Atlanta,GA,30303,United States,45,reinvent turn-key synergies,Wants to schedule a deep-dive demo of the new security features.,2025-07-03T20:18:07.289490,BOOTH-174
a8914f41-56a2-4920-b691-3bea17ae6e28,f687f0be-0e2f-4636-9015-c9a5bcead81d,Victoria,Fox,Data Scientist,Ramsey-Ware,victoria.fox@example.net,(315)751-5733x14060,5047 Tech Blvd,Bangalore,KA,560001,India,81,matrix revolutionary portals,Discussed potential integration with their existing Kubernetes cluster.,2025-09-25T01:43:10.109324,BOOTH-174
dcd810c9-6e24-4bdb-87cb-23fd454e92f3,dced83bb-a842-4c75-b4ef-25ac98751ae1,Jonathan,Crane,Senior Software Engineer,Perry-Lawrence,jonathan.crane@example.org,001-546-952-7317x56210,9523 Market St,Atlanta,GA,30303,United States,24,engage robust functionalities,Wants to schedule a deep-dive demo of the new security features.,2025-01-02T18:14:56.243762,BOOTH-174
81efecbc-b2d3-4163-9915-d10beb42530b,eb77cac3-5e10-4eb0-834e-4ccf6e4be0af,Jessica,Rodriguez,Backend Developer,Herrera Inc,jessica.rodriguez@example.org,945-784-8275x583,5456 Tech Blvd,San Francisco,CA,94105,United States,68,evolve dot-com markets,Wants to integrate our widget into their React Native application.,2025-06-09T20:08:44.516898,BOOTH-174
26abbafb-ba84-482d-9a34-8968f3ada2a5,cb6154d1-3530-4ad3-9820-a202a6ca3b93,Daniel,Mendez,Cybersecurity Analyst,Thomas PLC,daniel.mendez@example.com,(692)234-4234,5855 Main St,Los Angeles,CA,90001,United States,28,drive cross-media portals,Interested in automated testing strategies for their mobile app.,2025-05-14T16:42:10.352258,BOOTH-174
3695bf27-3568-4f47-8854-3eed8cca3eed,c6c874b1-04d6-4f7e-a082-cb09d2f7da4b,Breanna,Figueroa,CTO,Colon Inc,breanna.figueroa@example.org,601-673-4397x790,1035 Main St,Boston,MA,02110,United States,48,integrate bleeding-edge e-commerce,Evaluating our platform against AWS and Azure alternatives.,2025-07-20T19:55:59.399361,BOOTH-174
97543684-116b-4b92-97f7-360de6b81dd9,fab33fca-ee21-484e-ac0a-77eabfe19e59,Shawn,Reed,Cybersecurity Analyst,Maynard Group,shawn.reed@example.org,(561)601-4663x88945,881 Main St,Atlanta,GA,30303,United States,30,embrace intuitive users,Evaluating the feasibility of a multi-tenant architecture.,2025-01-11T21:02:58.734881,BOOTH-174
6a1549d1-fb3f-4ce1-b6df-4b98fbef431e,b15af13c-f24d-4201-ac33-d3dd7a5f6c5c,Mary,Daniel,Site Reliability Engineer (SRE),"Rodriguez, Kelly and Ibarra",mary.daniel@example.org,+1-975-604-4556x963,5756 Broadway,Seattle,WA,98109,United States,74,extend visionary technologies,Asked detailed questions about our GraphQL API rate limits.,2025-01-19T23:17:54.632059,BOOTH-174
5aae83f2-84b2-4df6-be94-db32f57f89f1,8be913d8-f195-4c8a-b847-2b8c2abf9dc4,Zachary,Huffman,CTO,Petersen-Sherman,zachary.huffman@example.org,692-817-8878,2969 Market St,New York,NY,10001,United States,3,utilize revolutionary e-tailers,Wants to integrate our widget into their React Native application.,2025-03-31T08:35:48.315780,BOOTH-174
5beab3eb-5781-488f-9078-190bd523ff90,469fd3ab-b89e-4c0e-938d-e02e2134a7f0,Bradley,Rodriguez,CTO,Waters-Green,bradley.rodriguez@example.net,(298)340-1751,6234 Tech Blvd,Miami,FL,33101,United States,78,productize interactive bandwidth,Asked detailed questions about our GraphQL API rate limits.,2025-01-29T21:37:24.182862,BOOTH-174
ddb4cc78-bd06-4862-9c00-ba629b5aeb08,e7771d5e-74f7-4e6f-b217-06929cfd3e43,Brenda,Parks,Security Engineer,Jones Group,brenda.parks@example.com,(319)522-6023,3620 Broadway,Mexico City,CDMX,01000,Mexico,14,deliver seamless niches,Inquired about volume pricing for high-throughput data streaming.,2025-10-09T23:12:50.195385,BOOTH-174
4fd5bb2b-9c6c-4c09-a79f-ad9cf12e855a,df421f13-54d2-4b0a-8274-b394e715bc25,Russell,Strickland,Developer Advocate,Allen PLC,russell.strickland@example.org,2936121181,5714 Oak St,Austin,TX,73301,United States,9,engage value-added methodologies,Interested in migrating legacy systems to a microservices architecture.,2025-09-08T05:06:56.554678,BOOTH-174
f26fc841-5c9e-4ddd-bb16-67df42163eca,288b0466-b52e-4b84-941a-b234503287a8,Emily,Short,Backend Developer,Meyers-Ortiz,emily.short@example.com,6923953604,4652 Market St,Singapore,SG,049318,Singapore,60,unleash turn-key schemas,Looking to replace their current data warehouse with a more scalable solution.,2025-04-29T01:26:49.112092,BOOTH-174
87bb49c7-0c26-47c9-b7b6-011fe994b8e9,44a7d572-0a96-4e44-a32a-e1f0525b7dda,Daniel,Bauer,Site Reliability Engineer (SRE),Nelson-Page,daniel.bauer@example.org,688.869.9552x60906,131 Tech Blvd,Boston,MA,02110,United States,5,architect web-enabled interfaces,Encountered friction with the SSO setup; needs technical support.,2025-02-13T04:30:08.343714,BOOTH-174
bf4cc322-6443-4fa3-9f36-60badc85df80,9d58fb4d-7f83-472c-aa78-f3b4d9e929d1,Jennifer,Martinez,Technical Writer,Nelson Group,jennifer.martinez@example.org,+1-439-383-8138,5593 Maple Ave,Singapore,SG,049318,Singapore,27,strategize magnetic convergence,Concerned about data sovereignty and GDPR compliance in the EU region.,2025-03-13T02:04:14.102952,BOOTH-174
1226a78b-db78-4392-9708-85ce11dcfcfe,57019999-b213-4b82-ad11-d2cb27567339,Crystal,Williamson,Mobile Developer,"Hall, Coleman and York",crystal.williamson@example.net,413-854-2120x8697,8877 Washington St,Los Angeles,CA,90001,United States,26,exploit 24/7 networks,Discussed the benefits of Rust over C++ for their new engine.,2025-01-06T16:19:21.705100,BOOTH-174
2b09f521-e5ac-4039-981a-eb2f5a0e9cc4,5f577801-fd00-4fe6-84bf-83254718f2b4,Richard,Barron,Engineering Manager,Chang-Shepherd,richard.barron@example.org,001-278-480-9884x4353,9542 Market St,New York,NY,10001,United States,26,re-contextualize dynamic networks,Concerned about data sovereignty and GDPR compliance in the EU region.,2025-04-03T21:29:30.223640,BOOTH-174
3ee61b60-7c02-4bd2-a513-52a36901cc3d,c44e3a70-2a21-441a-a0da-59d666ebc718,Toni,Bennett,Database Administrator,Dominguez PLC,toni.bennett@example.net,(612)661-9076x75595,2255 Tech Blvd,Ottawa,ON,K1P 1J1,Canada,93,iterate enterprise architectures,Interested in migrating legacy systems to a microservices architecture.,2025-06-10T13:04:59.177421,BOOTH-174
29096a44-2e28-4bc8-86d6-4ef5ded7acbc,50145872-ba75-4707-bada-d1cc67781f17,Edwin,Smith,Security Engineer,Jimenez-Perry,edwin.smith@example.net,903.341.1689,2711 Main St,Los Angeles,CA,90001,United States,18,scale real-time methodologies,Interested in automated testing strategies for their mobile app.,2025-05-14T23:38:20.696430,BOOTH-174
f97a2a99-9b4d-457e-accd-5ff5341e4fcd,4e4d74e5-13a5-4463-aea2-ea8eb5bfbbc7,Philip,Brooks,Technical Product Manager,Crawford-Walker,philip.brooks@example.net,(512)927-6354x88409,7165 Innovation Way,Toronto,ON,M5H 2N2,Canada,70,integrate integrated partnerships,Excited about the roadmap for serverless function support.,2025-09-09T02:03:14.414837,BOOTH-174
3dadebf6-489c-4d94-99e0-b51498eaf899,856ad428-b586-426f-ab7c-8f377f5dac99,James,Riley,Test Automation Engineer,"Ingram, Adams and Love",james.riley@example.org,(903)503-7147x96501,4200 Main St,Calgary,AB,T2P 1J9,Canada,59,re-intermediate one-to-one e-services,Evaluating the feasibility of a multi-tenant architecture.,2025-05-26T18:20:00.252897,BOOTH-174
2018c980-dd28-4e80-8270-514ee0736544,da6b085f-7008-4303-bf12-99c1b70bbc4f,Phillip,Burgess,Solutions Architect,Young-Morales,phillip.burgess@example.org,714-977-5555,4343 Washington St,Osaka,Osaka,530-0001,Japan,19,evolve cross-platform mindshare,Wants to know more about our machine learning model training capabilities.,2025-08-20T07:36:20.960900,BOOTH-174
