Scan ID,Attendee ID,First Name,Last Name,Title,Company,Email,Phone,Address,City,State,Postal Code,Country,Lead Score,Qualifiers,Notes,Timestamp,Session ID
2623bfff-9de3-4079-ab48-e0903ccad546,3f01e3ac-6a97-4561-a955-dcdeb0cf8809,Nicole,Ryan,iOS Developer,Woods-Craig,nicole.ryan@example.net,001-262-338-8876x070,729 Broadway,Denver,CO,80202,United States,96,engineer distributed metrics,Inquired about volume pricing for high-throughput data streaming.,2025-05-06T21:20:05.532987,LRN512
3f8de27f-cb0b-40bc-b66b-418179430c4e,6726be9b-3386-4247-a7ae-7fd2b4de892f,Clayton,Hunter,Developer Advocate,Baker Inc,clayton.hunter@example.net,001-641-267-3773x5648,2895 Washington St,Seattle,WA,98109,United States,76,empower out-of-the-box ROI,Suffering from database locking issues; looking for advice.,2025-04-16T14:17:44.321686,LRN512
e54928f3-dae0-4b05-83dd-d4194ba8153d,989bba21-d2e4-48d5-8d14-e21c883ddbc0,Christopher,Clark,Developer Advocate,Johnson Ltd,christopher.clark@example.net,+1-314-685-7842x0169,8276 Market St,Austin,TX,73301,United States,73,utilize real-time vortals,Wants to know more about our machine learning model training capabilities.,2025-05-10T08:16:44.061651,LRN512
fec5836f-161f-4c9e-bef5-5297377949db,a4802a2d-a34c-4d9e-9361-ffc79cc2d0e1,Peter,Fox,Software Engineer,"Barber, Johnson and Johnson",peter.fox@example.net,801-883-7954x26295,258 Market St,Seattle,WA,98109,United States,3,repurpose cross-media portals,Interested in migrating legacy systems to a microservices architecture.,2025-02-02T17:19:02.326303,LRN512
6e9fcadf-ac24-4018-b4db-325fc67d91f5,c1692490-40f0-4a77-a5ef-3ceafdb39d09,Michael,Davidson,Machine Learning Engineer,"Carr, Simon and Hernandez",michael.davidson@example.com,621.917.7127x169,592 Broadway,Chicago,IL,60601,United States,10,deploy extensible content,Looking for a partner to help with a large-scale cloud migration.,2025-09-01T03:38:18.845949,LRN512
49065995-15b4-40d0-b928-fa5725dfd209,e33e0b36-6416-4a97-a896-5b433c7e4a6b,Kara,Wilkerson,Network Engineer,Simpson-Young,kara.wilkerson@example.com,+1-952-273-1970x72327,7028 Market St,Seattle,WA,98109,United States,81,enhance rich vortals,Excited about the roadmap for serverless function support.,2025-02-22T23:56:07.870041,LRN512
757a37e3-daba-4840-9f2d-1aadcb5fb1ae,2251c9b2-947c-4e8f-9777-e8330f6bb4f0,Warren,Stephens,CTO,"Stone, Foster and Wong",warren.stephens@example.net,(622)792-3503,6346 Innovation Way,San Francisco,CA,94105,United States,62,monetize mission-critical content,Curious about our websocket support for real-time chat.,2025-10-01T14:43:02.777612,LRN512
2f959296-48b6-41fb-bb11-b899f4c1362e,62d332e9-e8e3-4726-b70c-1495c3f9c8d3,Alexandra,Allison,UX/UI Designer,Myers-Beck,alexandra.allison@example.com,254.583.3199x856,5593 Broadway,Toronto,ON,M5H 2N2,Canada,84,enhance holistic deliverables,Excited about the roadmap for serverless function support.,2025-07-26T21:25:32.097135,LRN512
7940c433-3340-4bd7-a2b2-c8bd3c0a35b0,46f6f4e6-aee6-4957-bdda-cea3114bbe46,Danny,Peterson,Site Reliability Engineer (SRE),"Gutierrez, Powell and Boone",danny.peterson@example.org,4372952299,1246 Market St,San Francisco,CA,94105,United States,83,harness sticky relationships,Wants to integrate our widget into their React Native application.,2025-06-20T14:12:32.534267,LRN512
e4577099-7910-4b77-a2b1-e63beb883874,a9d04ab2-0d5a-4483-9d31-c6dde72fae60,Brian,Peterson,Cloud Architect,Brown-Lara,brian.peterson@example.net,641.829.1136x570,4406 Main St,Monterrey,NL,64000,Mexico,55,matrix rich e-markets,Evaluating our platform against AWS and Azure alternatives.,2025-03-29T00:20:16.140103,LRN512
2b9b4860-a2db-429e-bda0-102c092dfa43,cd88e77f-9518-4e1e-a24b-d2fb62b255ce,George,Morgan,Technical Writer,Ramos and Sons,george.morgan@example.net,343.289.3817x617,6364 Tech Blvd,New York,NY,10001,United States,91,transform back-end ROI,Looking to replace their current data warehouse with a more scalable solution.,2025-03-01T07:16:59.034263,LRN512
fc53c2c9-8381-4877-b38e-ef745c2629f3,79981be9-7494-4470-ad47-4da2870983a5,Janet,Young,VP of Engineering,"Hogan, Figueroa and Cross",janet.young@example.net,8075400571,7212 Maple Ave,Chicago,IL,60601,United States,72,iterate holistic relationships,Curious about our websocket support for real-time chat.,2025-08-14T00:15:36.627400,LRN512
cb0ffb5d-2667-4326-9c7c-543a5510408b,963de7e6-135a-4ef4-b2ee-a32612a81bb0,Nancy,Peterson,Backend Developer,Gonzalez PLC,nancy.peterson@example.com,722-935-7396,8988 Maple Ave,Chicago,IL,60601,United States,84,implement back-end action-items,Needs a solution for log aggregation and anomaly detection.,2025-05-04T09:19:48.787071,LRN512
79b4f8ab-872e-4047-b190-7362be0b2227,8a97b8c1-a5e8-4d7d-8c3c-8c60f284a131,Christopher,Ramirez,AI Researcher,Curtis-Campbell,christopher.ramirez@example.com,001-896-302-9783x917,3711 Main St,Los Angeles,CA,90001,United States,31,streamline integrated e-commerce,Encountered friction with the SSO setup; needs technical support.,2025-08-16T01:29:17.297913,LRN512
6977bbc5-600d-485f-bd39-b2d155781373,c478b729-a9bf-401d-b086-137408d519e5,Ryan,Dickerson,Data Scientist,"Miller, Alvarez and Serrano",ryan.dickerson@example.net,001-807-251-4933x59116,831 Market St,Shanghai,Shanghai,200000,China,17,re-intermediate turn-key technologies,Asked detailed questions about our GraphQL API rate limits.,2025-05-24T12:30:02.305320,LRN512
cb9ef6bb-9673-4bb4-9c9d-a5da930dc96b,11d5f8c1-116f-4707-9844-2da709ba7ab7,Eric,Wolf,Developer Advocate,Cunningham PLC,eric.wolf@example.org,815-814-1233,7137 Broadway,Los Angeles,CA,90001,United States,43,leverage wireless mindshare,Needs a solution for log aggregation and anomaly detection.,2025-08-13T14:23:14.399521,LRN512
7d8e4e71-4d68-426f-bafe-f254df3682e3,359cca18-a8d0-4bca-a112-fc7fbfd37d7a,Angela,Love,Full Stack Developer,Guzman-Ochoa,angela.love@example.org,+1-596-726-3246,4616 Main St,Denver,CO,80202,United States,9,incubate robust networks,Evaluating our platform against AWS and Azure alternatives.,2025-05-28T17:46:43.491507,LRN512
2da24bdd-9385-45cb-b194-998fbe9bb991,ff8a2858-b31b-4d88-874f-28a88fe97b05,Gabriel,Phillips,Cloud Architect,Weaver-Sanders,gabriel.phillips@example.net,001-912-594-4106,687 Innovation Way,Toronto,ON,M5H 2N2,Canada,51,envisioneer robust functionalities,Wants to know more about our machine learning model training capabilities.,2025-03-06T03:18:39.719076,LRN512
4ef8c501-a4fd-4f02-a23e-ed7352a85211,8c03630d-7a9e-491c-9220-53bea41a67ab,Amber,Ortiz,iOS Developer,"Stokes, Friedman and Phelps",amber.ortiz@example.net,875-518-5957,283 Maple Ave,Tokyo,Tokyo,100-0001,Japan,53,repurpose scalable schemas,Exploring options for edge computing and low-latency delivery.,2025-06-28T21:41:41.406779,LRN512
2d05ed87-743a-4659-8d73-53a533a515de,602d935e-1e20-486b-b2e0-ee9308757fb1,Charles,Mcdonald,Site Reliability Engineer (SRE),"Reynolds, Jones and Cabrera",charles.mcdonald@example.com,235-377-3992x8757,6701 Washington St,Vancouver,BC,V6B 1P1,Canada,95,revolutionize user-centric models,Looking for a partner to help with a large-scale cloud migration.,2025-02-25T08:34:07.873703,LRN512
a749b539-c5fc-4eca-af01-96b9414d7f60,e48d84ee-eeba-47b2-916c-5015352f9327,Jessica,Smith,Mobile Developer,Crawford Group,jessica.smith@example.net,745-325-6950,1854 Oak St,Los Angeles,CA,90001,United States,3,drive end-to-end architectures,Interested in migrating legacy systems to a microservices architecture.,2025-03-19T00:26:39.824358,LRN512
8360dfeb-22c9-4305-a01c-ac1be5c40d71,e6f54862-f017-4bea-a2cd-49ff0816274e,Valerie,Hodge,QA Engineer,Patton-Aguilar,valerie.hodge@example.net,+1-274-477-9732x60466,5348 Market St,Manchester,England,M1 1AE,United Kingdom,81,implement scalable schemas,Wants to integrate our widget into their React Native application.,2025-06-21T00:35:38.034785,LRN512
aebfd617-232f-47d4-8b90-d69d1c103614,d1b4caf4-34c5-42f1-8e97-138a460f5879,Sergio,Oconnor,AI Researcher,"Brown, James and Guzman",sergio.oconnor@example.net,705.679.9053x74976,2788 Main St,Ottawa,ON,K1P 1J1,Canada,47,deliver sticky technologies,Evaluating the feasibility of a multi-tenant architecture.,2025-09-25T04:25:48.472881,LRN512
16b4a751-94af-4430-b9da-03328d678d19,9c9bf986-1208-461c-a689-9af5e2ef5248,Ryan,Pacheco,Machine Learning Engineer,Lindsey Inc,ryan.pacheco@example.org,(585)306-1253x21501,6332 Broadway,Monterrey,NL,64000,Mexico,13,syndicate intuitive deliverables,Exploring options for edge computing and low-latency delivery.,2025-08-03T00:57:03.027549,LRN512
8f5cb30a-9c1c-4c68-8db3-918215af7db4,386f6acf-8a02-4ea3-a8af-25b07cb6f32c,Meghan,Liu,UX/UI Designer,"Roberts, Baker and Tate",meghan.liu@example.org,558-588-2494x78818,3568 Innovation Way,Los Angeles,CA,90001,United States,4,target B2C e-business,Looking for a solution to optimize their CI/CD pipeline latency.,2025-02-23T14:46:58.472164,LRN512
2ddd84a4-ea90-4039-a40e-dd2c1354a126,e502c792-d939-461c-be54-db34722702e5,Sheri,Thompson,CTO,"Ferguson, Miller and Mccoy",sheri.thompson@example.net,001-267-401-1781x294,4394 Market St,Denver,CO,80202,United States,62,e-enable proactive supply-chains,Looking for a solution to optimize their CI/CD pipeline latency.,2025-10-04T01:48:47.679293,LRN512
8266a480-da11-44b9-80ce-ad1f845a6ce5,2b6ac44a-d622-4c52-8b98-a372bb4f6588,Juan,Meadows,Cybersecurity Analyst,Thomas-Holmes,juan.meadows@example.com,666.504.6077x21511,1191 Oak St,Chicago,IL,60601,United States,41,morph visionary eyeballs,Asked detailed questions about our GraphQL API rate limits.,2025-01-01T15:00:28.325311,LRN512
2b3f2414-6822-4897-b7eb-9cd15c123e1c,60bcd2d6-307a-471b-9416-2f8e1fa326c0,Isabella,Neal,DevOps Engineer,"Richards, Hoffman and Huber",isabella.neal@example.org,(304)956-7239,2142 Main St,Lyon,Auvergne-Rhône-Alpes,69001,France,18,transform holistic experiences,Asked about our uptime SLAs and incident response times.,2025-08-09T14:56:39.143404,LRN512
291f1a81-820d-41ca-b7b9-9de69bad0a33,67c88e4a-5004-40ce-8249-7dde13c1572a,Benjamin,Powell,Security Engineer,"Bates, Bond and Nelson",benjamin.powell@example.org,628-999-3895x2694,3264 Maple Ave,New York,NY,10001,United States,52,incentivize visionary eyeballs,Mentioned a need for real-time analytics and dashboarding.,2025-07-30T14:34:40.452320,LRN512
a0f2d7f6-aa15-466e-8a56-5e2f5031c735,a8cb72a3-4306-40ea-8cc9-03335ce6fd47,Amy,Robinson,Database Administrator,"Williams, Jackson and Dennis",amy.robinson@example.net,+1-955-779-6225x41939,1824 Innovation Way,Miami,FL,33101,United States,62,implement customized vortals,Wants to know more about our machine learning model training capabilities.,2025-01-26T03:43:40.761825,LRN512
a9ba0149-a96d-453a-802b-d5ee73ba1d15,c11d3ac9-38c4-461a-b449-e3d60553262c,Dennis,Wilson,Database Administrator,"Sanchez, Oconnor and Sanders",dennis.wilson@example.net,001-427-326-8661x086,3434 Tech Blvd,Montreal,QC,H3B 1A7,Canada,29,facilitate robust markets,Inquired about volume pricing for high-throughput data streaming.,2025-08-07T06:36:07.184961,LRN512
39b7bb6b-691c-4d31-bc08-4e629674bc2e,f48600e7-3411-45b6-a406-a4f0d914d276,John,Stewart,Database Administrator,Nichols LLC,john.stewart@example.org,8246766456,6722 Maple Ave,Boston,MA,02110,United States,70,harness e-business technologies,Concerned about data sovereignty and GDPR compliance in the EU region.,2025-02-13T13:14:28.767347,LRN512
0f68023c-5e42-43b0-b92e-edf813db7543,b3c0fe59-ea51-430b-a4e5-db8555522c4c,Pamela,Little,Frontend Developer,Davis-Wang,pamela.little@example.net,(878)967-1526x540,141 Main St,São Paulo,SP,01000-000,Brazil,51,generate best-of-breed initiatives,Encountered friction with the SSO setup; needs technical support.,2025-06-25T01:20:37.416786,LRN512
a93d4017-814e-40a8-b2f9-13f1ef3dbef0,24cadd9e-3f03-4f92-b216-ff7051ea3cb0,Douglas,Nguyen,Technical Product Manager,Johnston-Wilkerson,douglas.nguyen@example.net,+1-355-862-3707x58958,6663 Main St,Atlanta,GA,30303,United States,57,empower leading-edge info-mediaries,Curious about our websocket support for real-time chat.,2025-08-18T20:07:55.065051,LRN512
24cac72a-7142-4085-8a17-58a63ae2683f,785e9d58-a590-4efb-8099-bb7508362e9d,Crystal,Huffman,Mobile Developer,Sheppard and Sons,crystal.huffman@example.net,(595)394-4382,2749 Tech Blvd,Seattle,WA,98109,United States,90,utilize customized experiences,Wants to schedule a deep-dive demo of the new security features.,2025-08-25T11:20:59.957450,LRN512
5180a750-345e-490b-9361-b1d0639d06a0,59411761-cb62-4d3c-a3bd-c41f5b481ce5,Dennis,Johnson,AI Researcher,Heath Group,dennis.johnson@example.net,988-826-8782x30616,6916 Main St,Atlanta,GA,30303,United States,89,utilize proactive portals,Exploring options for edge computing and low-latency delivery.,2025-08-29T06:31:42.537504,LRN512
5d2fbae0-5644-4bbf-99b5-ff747d4d422f,81823e9b-5342-4ec1-87cf-bdc04ab0ff99,Lindsay,Becker,Solutions Architect,Gordon-Ray,lindsay.becker@example.com,500-539-5641x805,3169 Broadway,Stockholm,Stockholm,111 22,Sweden,98,cultivate proactive models,Discussed potential integration with their existing Kubernetes cluster.,2025-09-07T12:51:27.672466,LRN512
b61474b8-a9a9-40c1-a069-423171a160fa,347c3b5d-b581-4b3d-a3e5-8a882bce6343,Jack,Garcia,Product Manager,Deleon LLC,jack.garcia@example.com,392.484.5083x33149,1509 Tech Blvd,Monterrey,NL,64000,Mexico,9,syndicate extensible e-business,Exploring options for edge computing and low-latency delivery.,2025-02-05T06:21:00.714509,LRN512
57afee89-4b77-4b2f-b410-2e5c50040e8d,f7743c29-e700-4add-a629-c3c3faf20a49,Amber,Phillips,Engineering Manager,"Hernandez, Martinez and Franklin",amber.phillips@example.org,646-429-7855x89119,5154 Broadway,Denver,CO,80202,United States,43,deliver back-end supply-chains,Wants to know more about our machine learning model training capabilities.,2025-06-29T13:31:53.676850,LRN512
b17df5b1-60ba-46ab-bce1-eb4c636934b2,ae9f1655-4d76-43d1-9bef-ff855a0c569f,Danielle,White,Senior Software Engineer,"West, Tran and Howell",danielle.white@example.net,+1-476-831-2059,9011 Innovation Way,New York,NY,10001,United States,4,streamline 24/7 relationships,Looking to replace their current data warehouse with a more scalable solution.,2025-08-11T16:54:50.878924,LRN512
983fb51f-1137-4f53-bf36-92594fc4af36,81c827d4-f1f7-4466-b8f6-e4961540d739,Christy,Randolph,Data Scientist,Powers PLC,christy.randolph@example.com,(768)783-0536x7979,8799 Broadway,Mexico City,CDMX,01000,Mexico,11,optimize value-added schemas,Looking for a partner to help with a large-scale cloud migration.,2025-07-06T11:26:22.997037,LRN512
21bd3367-9a60-480f-9078-46fab629c6f7,2d203c15-508b-458c-b05d-202a2901d614,Ryan,Rodgers,Android Developer,Schwartz PLC,ryan.rodgers@example.org,9943606338,2314 Innovation Way,Manchester,England,M1 1AE,United Kingdom,54,integrate 24/7 users,Interested in automated testing strategies for their mobile app.,2025-07-24T05:41:25.540926,LRN512
19f56bd0-1afd-4cf6-a2ea-044034e79842,ae7da5f4-cef8-4516-9ca7-2c1ce548e3c5,Eric,Taylor,iOS Developer,"Todd, Fox and Reeves",eric.taylor@example.net,(957)818-6750,5181 Broadway,Seattle,WA,98109,United States,75,re-intermediate compelling web-readiness,Excited about the roadmap for serverless function support.,2025-08-01T11:55:42.064178,LRN512
64cb2500-7242-439d-a258-ab0df6dc34dd,51a88c66-f1a8-4c3f-9ba1-31e9784875e3,Felicia,Craig,Solutions Architect,Marshall LLC,felicia.craig@example.org,686-420-6326x27464,8894 Tech Blvd,Paris,Île-de-France,75001,France,92,seize intuitive communities,Wants to integrate our widget into their React Native application.,2025-04-22T09:58:02.687407,LRN512
935012d9-6b4f-413a-ab30-437d29f00f09,97c3e59a-12a9-4cdd-88a5-5003ec322ead,Kelly,Callahan,Software Engineer,Pacheco LLC,kelly.callahan@example.org,+1-498-431-5724,1517 Innovation Way,Vancouver,BC,V6B 1P1,Canada,17,facilitate innovative infrastructures,Looking for a partner to help with a large-scale cloud migration.,2025-03-25T03:33:29.099248,LRN512
089ae242-b202-494a-ae05-c6b3c0d913d2,a4d6aa10-857e-4a45-996e-3c5fccd21641,Christine,Roman,Mobile Developer,"Miller, Chapman and Stanley",christine.roman@example.com,+1-242-422-0583x204,1013 Tech Blvd,Seattle,WA,98109,United States,89,incentivize sticky methodologies,Discussed potential integration with their existing Kubernetes cluster.,2025-08-01T23:59:19.452209,LRN512
9cee31ba-b07b-461f-8fa6-45ac1c2f8767,8b7f4176-a4b2-444d-a42f-7330c28a8511,Christopher,Mckinney,Technical Writer,"Hodges, Coleman and Chavez",christopher.mckinney@example.net,842.808.9388x31768,4894 Broadway,Melbourne,VIC,3000,Australia,34,harness sticky synergies,Asked detailed questions about our GraphQL API rate limits.,2025-08-19T11:55:49.437194,LRN512
f047200f-eab0-421d-a21f-cee97998fe37,c1b7eef2-f0a8-49d3-b05f-ba1b88e228ce,Christopher,Johnson,UX/UI Designer,Pacheco Group,christopher.johnson@example.net,001-332-639-2958x956,1858 Tech Blvd,Seattle,WA,98109,United States,83,re-contextualize robust partnerships,Needs a solution for log aggregation and anomaly detection.,2025-07-09T17:28:17.143465,LRN512
38c1bf10-5efa-4bf8-941a-b036196052a5,7060d50c-9b69-4642-84bc-7a9c16a2ae4b,Zachary,Baker,Machine Learning Engineer,"Kirk, Lopez and Watkins",zachary.baker@example.com,+1-444-287-5774x340,266 Market St,Montreal,QC,H3B 1A7,Canada,43,scale next-generation systems,Interested in migrating legacy systems to a microservices architecture.,2025-03-13T10:09:42.709324,LRN512
1a1adc34-63b1-461e-aaa9-b7ad58a3fd1f,085bb428-aaab-4182-8651-95e9938cec63,Gary,Shaw,Cybersecurity Analyst,Johnson-Pruitt,gary.shaw@example.org,2709264588,3006 Broadway,New York,NY,10001,United States,18,engineer 24/365 mindshare,Asked detailed questions about our GraphQL API rate limits.,2025-03-04T13:44:48.519474,LRN512
a4aad24f-4683-4413-b0b9-a9692b0f012a,707cc22f-c3e5-4cc9-9ea1-928fb8f28ffa,John,Fitzgerald,Data Engineer,Turner-Combs,john.fitzgerald@example.net,5705252733,6136 Broadway,Berlin,Berlin,10115,Germany,78,target next-generation vortals,Evaluating our platform against AWS and Azure alternatives.,2025-02-24T19:50:30.538948,LRN512
eefbc576-a957-4759-920a-736c307c548f,5d0bc182-8cdc-4f73-8bbd-7b60599f4c5b,Robert,Barr,Software Engineer,Porter-Anderson,robert.barr@example.net,9349509387,7238 Broadway,London,England,SW1A 1AA,United Kingdom,3,enhance customized e-commerce,Mentioned a need for real-time analytics and dashboarding.,2025-09-23T03:21:34.553685,LRN512
97e5e343-99f9-46d3-90d4-818907c693be,d50f0e74-fd1e-4c4e-9cae-46e203615f12,Amy,Morris,iOS Developer,"Richards, Mathis and Mckee",amy.morris@example.com,(869)544-8329,1582 Main St,Chicago,IL,60601,United States,84,strategize revolutionary systems,Asked if we support Terraform providers for infrastructure as code.,2025-10-01T11:56:54.789040,LRN512
e0ed952e-5197-4efe-9fdc-1e47f548e30a,7c10d6b0-f05b-4f21-9ae2-ebd8a63e6a16,Madison,Glenn,DevOps Engineer,"Ross, Fuentes and Perkins",madison.glenn@example.com,+1-906-657-3315,1025 Oak St,Atlanta,GA,30303,United States,6,harness visionary platforms,Discussed the benefits of Rust over C++ for their new engine.,2025-07-02T19:32:11.297340,LRN512
5aba301a-df14-42e8-b411-c839ccd81667,0298be29-9a48-4126-a6d4-5136cdc1846f,Thomas,Manning,Test Automation Engineer,James-Russell,thomas.manning@example.org,2362497091,3969 Market St,Toronto,ON,M5H 2N2,Canada,83,redefine mission-critical convergence,Excited about the roadmap for serverless function support.,2025-09-27T20:47:39.401022,LRN512
67b3ba1b-c62d-439f-b62b-279545eec731,2ff7be72-57d6-442e-a629-6104e14a81a5,Antonio,Johnson,Engineering Manager,Smith-Allen,antonio.johnson@example.org,(680)975-6349x809,7411 Washington St,Miami,FL,33101,United States,63,utilize visionary ROI,Asked about our uptime SLAs and incident response times.,2025-02-13T12:50:11.349014,LRN512
9b6feda9-5a4e-41fc-8d2e-e91877b419ae,ecf45ea5-ebbe-4017-bd3a-bdb647162024,Sandra,Olson,iOS Developer,Rivera-Ramirez,sandra.olson@example.org,(576)738-3713,9891 Washington St,Atlanta,GA,30303,United States,41,synthesize magnetic content,Encountered friction with the SSO setup; needs technical support.,2025-01-23T12:09:15.550904,LRN512
48687532-b810-4c55-bfd4-4dc004823afa,6d945f00-4b97-4318-86ec-3dcf330ea56c,Brandi,Andrade,Technical Writer,"King, Hobbs and Ward",brandi.andrade@example.org,(384)463-0232x858,9964 Main St,New York,NY,10001,United States,76,reinvent integrated supply-chains,Exploring options for edge computing and low-latency delivery.,2025-01-27T04:37:17.768398,LRN512
bdc69265-96b4-4a17-a5d1-8bb41475f9e7,871650d9-807b-48f4-89bc-29665b154d39,Ronald,Manning,iOS Developer,Powell Inc,ronald.manning@example.net,934-406-7200x5911,8650 Broadway,Los Angeles,CA,90001,United States,1,incentivize collaborative e-services,Interested in migrating legacy systems to a microservices architecture.,2025-07-18T19:43:25.967249,LRN512
9c55aa75-6da0-456c-9a8d-a7e2a01b8cef,9010ae16-2004-443d-b8c3-6e1ccf0ef121,Barbara,Blair,Network Engineer,Peterson-Duncan,barbara.blair@example.net,001-335-379-2506x31597,5307 Washington St,Chicago,IL,60601,United States,55,syndicate bleeding-edge web services,Curious about our websocket support for real-time chat.,2025-07-14T14:39:57.804596,LRN512
f65abe12-8a98-4e44-99cd-3599622836e0,47f0601b-d0ff-441b-87fa-652ccc8f594a,Jenna,Sherman,Data Engineer,Miller-Lyons,jenna.sherman@example.org,+1-224-400-7709x1045,8096 Innovation Way,San Francisco,CA,94105,United States,20,synergize dot-com systems,Needs a solution for log aggregation and anomaly detection.,2025-07-02T23:16:21.645370,LRN512
a5a9db32-4cd9-4529-b819-71a4e888c8d7,1bc42ca3-052d-40df-8172-a8df32337440,Daniel,James,Technical Writer,"Ramirez, Parker and Moore",daniel.james@example.net,+1-869-639-8761x664,1734 Main St,Dublin,Dublin,D01,Ireland,17,visualize vertical channels,Needs better documentation for the Python SDK.,2025-02-19T15:38:18.660301,LRN512
8d299344-0ba1-41eb-889c-8cce99ef46cb,a2209f6c-41d2-4632-a846-41c5d91d4b7c,Michael,Wood,Full Stack Developer,Oconnor and Sons,michael.wood@example.com,624.579.6592,6805 Main St,Boston,MA,02110,United States,59,matrix front-end eyeballs,Evaluating the feasibility of a multi-tenant architecture.,2025-03-21T08:46:16.832572,LRN512
6442ffa5-c604-4cf0-969e-f4d4499feac2,3de216dc-59de-4f64-a6dc-58e59cf4f156,Phillip,Contreras,Full Stack Developer,Schneider LLC,phillip.contreras@example.net,(965)617-6858x09839,8358 Tech Blvd,Vancouver,BC,V6B 1P1,Canada,18,target strategic platforms,Looking for a partner to help with a large-scale cloud migration.,2025-09-18T12:57:30.379935,LRN512
6d8ddd78-a2e1-4271-b820-d570525dc059,971c8cd3-fa1c-4346-874f-e1347b49b594,Benjamin,Carr,Data Engineer,House-Hopkins,benjamin.carr@example.org,5566783321,2959 Tech Blvd,Vancouver,BC,V6B 1P1,Canada,67,aggregate web-enabled metrics,Exploring options for edge computing and low-latency delivery.,2025-01-08T14:22:09.304748,LRN512
85d43289-e148-4f38-b2ec-a9bce160d46b,4e84e294-20a0-4128-9959-e5cadb5891a3,Chelsea,Butler,Network Engineer,Wu-Gomez,chelsea.butler@example.org,272.681.5126x5733,6779 Washington St,Monterrey,NL,64000,Mexico,74,scale out-of-the-box platforms,Asked if we support Terraform providers for infrastructure as code.,2025-09-03T15:19:45.052281,LRN512
7decaeb5-20d9-44de-bba4-568a5e4f89ac,bdbaf6ac-3211-4a1c-9e84-cfa14bb3b674,Lisa,Rose,Technical Product Manager,Fields Ltd,lisa.rose@example.net,+1-639-373-7577x06188,4394 Tech Blvd,Singapore,SG,049318,Singapore,81,empower cutting-edge paradigms,Evaluating the feasibility of a multi-tenant architecture.,2025-09-26T02:57:20.370777,LRN512
03175f3b-a692-4dd3-bec6-196eb0a28095,22182e12-a4c4-4636-b935-6afdd4b60e8d,Eric,Oliver,Technical Product Manager,Arias Ltd,eric.oliver@example.org,203-577-9955,8120 Maple Ave,Osaka,Osaka,530-0001,Japan,10,deliver B2C users,Encountered friction with the SSO setup; needs technical support.,2025-03-31T09:54:06.842866,LRN512
46dfe489-ab66-49bf-b981-8b996d4d4eeb,e4251317-4649-437e-be06-c06808f73661,Bradley,Banks,Android Developer,Wilson-Hayes,bradley.banks@example.net,247-439-3678x014,6844 Maple Ave,Ottawa,ON,K1P 1J1,Canada,31,facilitate turn-key e-markets,Wants to know more about our machine learning model training capabilities.,2025-07-30T06:32:54.306746,LRN512
72a234f2-a8a5-400d-8dee-f67b8dcc12d4,b3018a25-16e3-47b6-8ac4-b8278612cac6,Henry,Johnson,Engineering Manager,Arnold Group,henry.johnson@example.org,(756)740-2486x261,2097 Tech Blvd,Melbourne,VIC,3000,Australia,53,morph granular schemas,Looking for a solution to optimize their CI/CD pipeline latency.,2025-08-21T17:43:43.902386,LRN512
ebaee458-ed31-4021-93ca-5121e16c5a21,d4f225d8-59dc-46be-a5e8-52730b76ef34,Brian,Zimmerman,Backend Developer,"Moss, Harrington and Perry",brian.zimmerman@example.com,001-838-927-1698x04983,7190 Market St,Guadalajara,JAL,44100,Mexico,44,facilitate value-added technologies,Needs a solution for log aggregation and anomaly detection.,2025-07-12T16:12:58.349512,LRN512
a2311d06-1eab-43af-94be-e6ac9d38b161,38bc7ada-882f-4ed5-bae5-0122c18a2e47,Briana,Nelson,Solutions Architect,Morton Inc,briana.nelson@example.com,634-254-4731,1170 Oak St,Calgary,AB,T2P 1J9,Canada,16,utilize plug-and-play infrastructures,Looking for a solution to optimize their CI/CD pipeline latency.,2025-04-14T14:30:41.568982,LRN512
77e4460f-d309-4647-9117-88dd25df914f,bcf1123d-0861-4b68-9b7d-e708f28b98f5,James,James,Test Automation Engineer,Brown Inc,james.james@example.com,7714476220,9655 Oak St,Osaka,Osaka,530-0001,Japan,86,transition next-generation users,Suffering from database locking issues; looking for advice.,2025-03-08T08:53:26.961877,LRN512
70b9379c-3b16-439b-9ed7-6e67f2ffffe7,ec457ea5-7921-4c24-8a27-f874321f6f18,Peter,Evans,DevOps Engineer,"Rice, Powers and Porter",peter.evans@example.org,(692)826-0703,1943 Main St,Monterrey,NL,64000,Mexico,87,scale granular relationships,Asked detailed questions about our GraphQL API rate limits.,2025-03-20T05:30:14.402493,LRN512
