Scan ID,Attendee ID,First Name,Last Name,Title,Company,Email,Phone,Address,City,State,Postal Code,Country,Lead Score,Qualifiers,Notes,Timestamp,Session ID
c772c3bf-93d6-4f87-b1b4-8f4c24e02da8,f5c7f4cb-c40f-4b62-ab9c-09968b108709,Christina,Olson,Data Scientist,"James, Martinez and Ross",christina.olson@example.com,(359)404-1912x6251,2906 Washington St,Denver,CO,80202,United States,13,transform intuitive e-services,Looking to replace their current data warehouse with a more scalable solution.,2025-05-16T21:13:33.330858,LRN512
80db843b-3b7f-49bf-9151-0413a54e3db6,d8b71f82-8209-487d-bcc5-1994f1c22122,Rachel,Clarke,CTO,"Cox, Collins and Hoover",rachel.clarke@example.org,663-426-6214x345,486 Market St,Montreal,QC,H3B 1A7,Canada,94,transition leading-edge methodologies,Needs a solution for log aggregation and anomaly detection.,2025-07-16T06:11:39.327639,LRN512
c68f1810-ed04-4af4-985f-a5fdd4b08634,9f741168-fac5-4445-b62c-5d1df30258fe,Adam,Parker,Cloud Architect,"Ball, Cruz and Lynch",adam.parker@example.com,467.962.7345x5602,9378 Broadway,Mexico City,CDMX,01000,Mexico,97,grow cutting-edge networks,Wants to schedule a deep-dive demo of the new security features.,2025-03-16T03:09:50.019083,LRN512
0e4eba12-5c78-43f9-8229-ffc0c3275901,5b94449f-d552-4b15-b41b-87f4c619a763,Miranda,Ruiz,Backend Developer,"Pollard, Fitzgerald and Taylor",miranda.ruiz@example.org,730-515-7706x152,7237 Innovation Way,Seattle,WA,98109,United States,47,orchestrate best-of-breed synergies,Discussed potential integration with their existing Kubernetes cluster.,2025-07-15T23:53:30.929720,LRN512
a8b9f897-e749-4a5d-bcb5-cc6e87d0ae48,f687f0be-0e2f-4636-9015-c9a5bcead81d,Victoria,Fox,VP of Engineering,Ramsey-Ware,victoria.fox@example.net,(315)751-5733x14060,4373 Oak St,Vancouver,BC,V6B 1P1,Canada,100,syndicate magnetic action-items,Exploring options for edge computing and low-latency delivery.,2025-05-19T04:50:36.741235,LRN512
db47c13a-8ac7-4cd9-a505-5b085ca3a3c5,3cab5117-553b-4207-903b-8b4e4ec0eb7b,Gabrielle,Johnson,Database Administrator,Roberts-Schultz,gabrielle.johnson@example.net,(718)715-0411x56746,8724 Oak St,Austin,TX,73301,United States,82,orchestrate one-to-one solutions,Evaluating the feasibility of a multi-tenant architecture.,2025-01-16T21:55:42.541206,LRN512
5cd9c6e2-02e1-41f3-ac8d-332263fb507c,1b005818-b532-4b01-bbf3-b18d17b5b488,Carl,Bell,Solutions Architect,Jones-Rose,carl.bell@example.org,754-806-1667x8339,8189 Innovation Way,New York,NY,10001,United States,63,morph 24/365 convergence,Suffering from database locking issues; looking for advice.,2025-04-30T08:05:39.203239,LRN512
a2979357-84db-4dbb-9080-db86ba040f49,e9efaee0-840d-4644-bb86-8c7554a5f9e2,Rick,Cook,Database Administrator,Larson and Sons,rick.cook@example.com,001-610-391-9613x528,6330 Maple Ave,Miami,FL,33101,United States,3,empower e-business interfaces,Asked detailed questions about our GraphQL API rate limits.,2025-04-14T14:51:46.430968,LRN512
e85baeb1-db57-456a-959a-ce27e1a6cfab,5707bb21-4609-4c44-b445-60cab18859a2,Ricky,Smith,Site Reliability Engineer (SRE),"Holder, Clark and Mckee",ricky.smith@example.com,328.845.9187x7741,6338 Main St,Sydney,NSW,2000,Australia,79,facilitate plug-and-play deliverables,Evaluating the feasibility of a multi-tenant architecture.,2025-04-23T20:02:34.745966,LRN512
e040a42d-360e-49c8-b6f3-d00e926b6ef1,08f0d45d-7615-441e-85cc-118895b1b404,Jeremy,Deleon,QA Engineer,Roberts-Romero,jeremy.deleon@example.com,699-907-0904x2705,149 Broadway,Chicago,IL,60601,United States,47,evolve enterprise functionalities,Needs better documentation for the Python SDK.,2025-05-13T13:49:43.535844,LRN512
6389e7cf-580f-4e48-baea-c7368c20317a,d2c94601-68cb-4656-a6b1-6faad7b7256f,Samuel,Obrien,Android Developer,Ryan-Stewart,samuel.obrien@example.net,7913601799,4442 Oak St,Boston,MA,02110,United States,10,cultivate dot-com convergence,Exploring options for edge computing and low-latency delivery.,2025-02-08T08:53:01.250812,LRN512
4241c41b-c30c-41df-8525-af97f5e18a20,091aaec7-6696-49b2-9838-d0eca7184170,Kevin,Smith,AI Researcher,Harrell-Baker,kevin.smith@example.org,+1-947-670-0372x05070,5844 Market St,Chicago,IL,60601,United States,88,leverage holistic markets,Asked about our uptime SLAs and incident response times.,2025-03-27T20:37:13.552948,LRN512
809b9bad-e4cc-42d9-a286-66e9b8f6b5fd,91450ea5-9d03-4f88-8075-b0d722341a93,Ellen,Jacobs,Product Manager,"Ross, Hayes and Rivera",ellen.jacobs@example.net,545.613.6740,8186 Main St,Calgary,AB,T2P 1J9,Canada,73,harness vertical models,Asked detailed questions about our GraphQL API rate limits.,2025-08-09T08:25:24.041830,LRN512
4887ed89-d890-49f3-b76c-32dcc984c2bc,a2ce06d5-df3d-4e6c-af49-f9a9c26359b9,Heidi,Ross,DevOps Engineer,Russell-Campbell,heidi.ross@example.net,911.566.6373x9541,5688 Maple Ave,Montreal,QC,H3B 1A7,Canada,5,orchestrate open-source functionalities,Needs a solution for log aggregation and anomaly detection.,2025-08-01T03:41:04.607337,LRN512
2905ca35-b28b-4dfe-89ee-3c4267b66124,baafdfb8-a5c4-4f10-854b-44804a7dac64,Katrina,Garcia,Technical Writer,"Anthony, Powers and Carpenter",katrina.garcia@example.org,355-275-7865x997,2890 Innovation Way,Miami,FL,33101,United States,36,streamline B2C applications,Mentioned a need for real-time analytics and dashboarding.,2025-04-29T06:21:13.188985,LRN512
fa03d788-d311-46af-b047-770bb1a55a94,0c240fed-9a67-431e-a7dc-8d31bbbb3f55,James,Lowe,Technical Product Manager,"Chambers, Christensen and Gutierrez",james.lowe@example.net,495-522-7092,2423 Oak St,New York,NY,10001,United States,61,cultivate enterprise ROI,Looking for a partner to help with a large-scale cloud migration.,2025-10-05T18:26:49.660968,LRN512
7b682773-893f-40e5-a7a8-7fae1a33c6f6,459ed7e4-81e0-40af-a799-0cc73dfbaa5a,Matthew,Murray,Machine Learning Engineer,Ramsey-Ball,matthew.murray@example.org,307.502.7804,2095 Broadway,Calgary,AB,T2P 1J9,Canada,54,synergize synergistic partnerships,Looking to replace their current data warehouse with a more scalable solution.,2025-08-09T14:36:48.769387,LRN512
872642ee-4899-4db7-ab4b-3f41394dd382,af192f86-52a8-4ac2-8034-ae47101f4943,Timothy,Smith,iOS Developer,Freeman and Sons,timothy.smith@example.com,001-232-488-8747x55984,8727 Tech Blvd,San Francisco,CA,94105,United States,8,iterate visionary initiatives,Wants to know more about our machine learning model training capabilities.,2025-07-11T08:42:19.308792,LRN512
7b3125e9-cee7-4128-98e1-aa728141b824,a75dbc55-bd1d-4870-bfb7-1c92882d7e8e,Joseph,West,Developer Advocate,Jackson Group,joseph.west@example.net,+1-693-327-2775,8357 Innovation Way,Montreal,QC,H3B 1A7,Canada,64,synthesize dot-com info-mediaries,Asked about our uptime SLAs and incident response times.,2025-02-05T19:24:26.993085,LRN512
a8d71fcb-c295-495b-9699-f1e6e37bad02,7b381b0a-69a7-48ce-af49-abb80733b8e2,Haley,Dougherty,Data Scientist,"Russell, Phillips and Gibbs",haley.dougherty@example.org,(264)969-8277,8563 Broadway,Boston,MA,02110,United States,15,integrate leading-edge partnerships,Curious about our websocket support for real-time chat.,2025-08-17T06:20:42.841802,LRN512
8983304c-19db-4c43-a3c7-5eef78565bc6,e5b1ee2f-9b27-434f-8a5f-11d3ec74d666,Dalton,Sanchez,Data Scientist,Williams LLC,dalton.sanchez@example.net,+1-618-218-1714x9465,7095 Tech Blvd,Austin,TX,73301,United States,35,incubate turn-key applications,Inquired about volume pricing for high-throughput data streaming.,2025-06-26T14:56:21.519003,LRN512
4cfd993f-0204-4e32-9aa4-7a08f39bfc6a,438e17e7-f15b-43eb-8294-062eae3ef04d,Sabrina,Riddle,Network Engineer,Armstrong and Sons,sabrina.riddle@example.com,425-766-0311x811,5091 Oak St,Osaka,Osaka,530-0001,Japan,69,innovate e-business content,Discussed the benefits of Rust over C++ for their new engine.,2025-09-14T01:08:51.356700,LRN512
2eac0bd5-f6a8-441b-be6b-e92a40e9782b,ddd20a29-e4d2-4b20-9716-68b597213a73,Michael,Haynes,Android Developer,"Williams, Cochran and Snyder",michael.haynes@example.net,844-256-6546x54963,3174 Innovation Way,Shanghai,Shanghai,200000,China,33,extend user-centric e-services,Concerned about data sovereignty and GDPR compliance in the EU region.,2025-01-20T20:30:05.494902,LRN512
3a2a7bc9-aa49-4816-9c89-3472a3e91417,e26c5b32-57c9-42e5-a395-79fe73dbde51,Samantha,Ferrell,Senior Software Engineer,"Roth, Sanchez and Richard",samantha.ferrell@example.net,+1-928-832-0420x9698,3761 Washington St,New York,NY,10001,United States,35,extend cutting-edge e-tailers,Interested in migrating legacy systems to a microservices architecture.,2025-06-11T23:11:49.735162,LRN512
b716e6bc-96a3-41d8-9a43-a1080dffe642,e551aa77-b65b-4948-95db-79063b03b665,Angela,Flores,Developer Advocate,Vega-Reilly,angela.flores@example.com,629-525-6843x27653,2249 Main St,Mexico City,CDMX,01000,Mexico,56,implement impactful applications,Interested in automated testing strategies for their mobile app.,2025-07-16T23:47:24.287634,LRN512
39745574-a590-4c71-974e-2175c02510a1,45990c23-677b-42dd-aff5-85a1a2f3183e,Lee,Walker,Data Scientist,"Hicks, Robbins and Weaver",lee.walker@example.org,276.818.9684x17595,8858 Market St,Vancouver,BC,V6B 1P1,Canada,24,benchmark back-end initiatives,Exploring options for edge computing and low-latency delivery.,2025-09-11T20:57:00.957908,LRN512
d8c47525-7e43-4a97-9bc1-f3a9dc1680cc,cdd460d6-e77b-4924-8a9f-21effb858b62,Elizabeth,Pitts,Security Engineer,Cohen-Warner,elizabeth.pitts@example.com,(450)510-4000x94574,5564 Innovation Way,Paris,Île-de-France,75001,France,60,synergize collaborative niches,Looking for a partner to help with a large-scale cloud migration.,2025-02-14T14:11:27.154912,LRN512
26ef8fb3-e6f2-4d73-9167-ccd24a51faef,e07c514a-6568-4bbd-9793-048c1da6f67a,Krystal,Warren,Cloud Architect,Guzman-Davis,krystal.warren@example.org,9466929155,7086 Maple Ave,Amsterdam,NH,1012,Netherlands,52,re-intermediate world-class architectures,Asked about our uptime SLAs and incident response times.,2025-08-18T06:20:03.556061,LRN512
9105354d-ddfd-4fd3-807e-39c8c9322076,2492dcdc-a972-4c12-abdf-763282ecba6f,Robert,Roberts,Frontend Developer,Briggs-Gardner,robert.roberts@example.org,001-664-750-2372x2892,5370 Tech Blvd,Seattle,WA,98109,United States,98,orchestrate compelling supply-chains,Needs better documentation for the Python SDK.,2025-03-31T11:12:24.138817,LRN512
7c074db9-8735-4e1a-8481-25314b26f4cc,1093feca-aab9-4c9e-b866-0904781ba714,Kimberly,Miranda,AI Researcher,Caldwell Inc,kimberly.miranda@example.com,419.867.1611x735,3010 Oak St,Montreal,QC,H3B 1A7,Canada,64,re-intermediate mission-critical action-items,Interested in automated testing strategies for their mobile app.,2025-07-07T06:51:00.621808,LRN512
116fa5be-2a97-4152-b82a-e2e1ee423ffa,2be9a29f-8d1d-4799-8c50-711e753fede7,Rachel,Moore,Solutions Architect,"Goodman, Burch and Roberts",rachel.moore@example.org,(572)509-7171x808,1275 Washington St,Calgary,AB,T2P 1J9,Canada,24,matrix transparent web-readiness,Mentioned a need for real-time analytics and dashboarding.,2025-06-12T07:30:16.164573,LRN512
68f28665-9453-4cc6-b10e-7e7392424473,646a4e1f-fd9e-45ab-b2d4-4baf0120bf86,Jasmine,Perry,iOS Developer,"Taylor, Mcdonald and Jones",jasmine.perry@example.net,510.338.4424,8332 Broadway,Denver,CO,80202,United States,35,embrace ubiquitous partnerships,Looking for a partner to help with a large-scale cloud migration.,2025-02-17T04:53:28.105396,LRN512
e7721df4-2869-42ca-a76b-56e5f3ad4112,c8500b82-3817-447f-aec2-cec2123597b5,Beth,Chan,Network Engineer,Morrow-Lara,beth.chan@example.com,431.739.0704,6514 Innovation Way,San Francisco,CA,94105,United States,24,whiteboard compelling metrics,Discussed potential integration with their existing Kubernetes cluster.,2025-02-16T13:35:33.367723,LRN512
7e2d4b6c-3bbb-4227-8540-97d446439a50,4b63ccd5-973a-4d5e-9786-d6c2302494a7,Nicholas,Bass,Software Engineer,Griffin-Collins,nicholas.bass@example.org,+1-932-487-9016,5554 Broadway,Stockholm,Stockholm,111 22,Sweden,80,unleash user-centric experiences,Inquired about volume pricing for high-throughput data streaming.,2025-07-13T10:10:05.520527,LRN512
b4bf34fd-245f-46d6-92ac-7d9dc9004e34,bde230bf-74f5-4f61-a8dc-e4db270b6b43,Melanie,Johnson,Site Reliability Engineer (SRE),"Turner, Weiss and Price",melanie.johnson@example.com,(867)692-7661,2064 Washington St,Amsterdam,NH,1012,Netherlands,100,redefine transparent relationships,Evaluating our platform against AWS and Azure alternatives.,2025-02-23T22:30:43.119970,LRN512
2da9f5ea-6db6-47a8-9a7c-751c849f59d6,eca04709-a1e8-4c71-9c20-2455707f2442,Jesus,Charles,Android Developer,Dixon-Haynes,jesus.charles@example.com,418-519-1775,3895 Main St,San Francisco,CA,94105,United States,32,synergize best-of-breed models,Evaluating the feasibility of a multi-tenant architecture.,2025-06-19T03:25:10.581598,LRN512
23d12769-cc94-4e06-b045-a254f644029a,07b031f1-4189-4c6d-9fd5-4fc8ee67fec4,Vincent,Wheeler,CTO,Montoya Group,vincent.wheeler@example.com,+1-680-942-3954x3454,5969 Maple Ave,Austin,TX,73301,United States,56,strategize collaborative channels,Discussed the benefits of Rust over C++ for their new engine.,2025-09-07T17:45:48.601515,LRN512
00c507ff-262f-4746-b095-18480dd7306a,d41f4ebd-1394-4893-80f4-23012e782220,Renee,Vincent,Senior Software Engineer,Stephens-Doyle,renee.vincent@example.org,+1-814-868-5196x6521,2490 Broadway,Denver,CO,80202,United States,77,cultivate strategic e-tailers,Evaluating our platform against AWS and Azure alternatives.,2025-03-28T12:58:25.667748,LRN512
862b7c41-d856-4a82-9ea7-47a2071b5b38,14e4a0c4-6793-41d0-b17e-eaa2a0078251,Jennifer,Underwood,Network Engineer,Shannon-Armstrong,jennifer.underwood@example.net,+1-982-908-2597,9864 Market St,Montreal,QC,H3B 1A7,Canada,18,monetize real-time bandwidth,Wants to schedule a deep-dive demo of the new security features.,2025-09-12T21:58:03.699596,LRN512
4093c57a-2451-4bf6-a11d-136f467c5291,68e69971-22dc-428d-aadc-228006648e95,Daniel,Alvarez,DevOps Engineer,Miles-Wells,daniel.alvarez@example.org,557-675-8140x8985,9055 Washington St,Seattle,WA,98109,United States,45,productize frictionless interfaces,Looking for a solution to optimize their CI/CD pipeline latency.,2025-08-15T16:30:24.353927,LRN512
a138fba7-1406-420b-be9e-db19b91162d3,3a31acba-e13a-4721-95b7-e2c826c457a5,Sarah,Bailey,Engineering Manager,"Blair, White and Martinez",sarah.bailey@example.org,001-843-242-5776,4990 Innovation Way,Ottawa,ON,K1P 1J1,Canada,95,mesh extensible methodologies,Exploring options for edge computing and low-latency delivery.,2025-03-15T13:18:16.464918,LRN512
b1ee229c-570d-4357-a553-5f315b16b989,8fda995c-b4d1-45cf-b0db-7b3c337ec651,Kimberly,Chavez,UX/UI Designer,Brown PLC,kimberly.chavez@example.net,(529)313-0618,9820 Maple Ave,Shanghai,Shanghai,200000,China,8,brand user-centric interfaces,Discussed potential integration with their existing Kubernetes cluster.,2025-08-15T15:20:00.216063,LRN512
dc30730b-248a-4e6c-b80f-dfc5da961c60,0f25b20f-cb1a-4d99-a4ff-48b9a09ddc3d,Megan,Oconnor,Android Developer,Kennedy LLC,megan.oconnor@example.com,965.605.5646x11720,6008 Market St,San Francisco,CA,94105,United States,17,re-intermediate synergistic eyeballs,Asked if we support Terraform providers for infrastructure as code.,2025-03-30T22:01:33.310540,LRN512
2e3cd31c-a5c4-4a25-9ba9-1b8df35b733d,2520a2fe-c9d6-484b-af08-876066e93dba,Michael,Allen,Engineering Manager,"Lewis, Patton and Brown",michael.allen@example.org,001-983-992-3026x20146,4148 Innovation Way,Miami,FL,33101,United States,7,incentivize efficient infrastructures,Wants to integrate our widget into their React Native application.,2025-03-17T17:32:33.087491,LRN512
f066455d-4f26-40f1-a492-22825a1ad073,57a48df2-7cf7-49f1-91f8-ce8da7db0427,Sierra,Stone,Cloud Architect,Jordan and Sons,sierra.stone@example.net,(894)503-0280,9183 Maple Ave,Lyon,Auvergne-Rhône-Alpes,69001,France,86,incentivize scalable portals,Wants to schedule a deep-dive demo of the new security features.,2025-09-23T08:22:09.138021,LRN512
15b8daca-0e92-4b2d-abab-ae1e2e65d117,36b8689f-5079-48e5-8e9d-b0c8cab018e9,Lisa,Evans,Mobile Developer,"Mann, Donovan and Carlson",lisa.evans@example.org,230-569-5718x0976,3053 Broadway,Los Angeles,CA,90001,United States,61,seize granular networks,Looking for a solution to optimize their CI/CD pipeline latency.,2025-10-05T18:40:43.818796,LRN512
acb3c160-ff2b-4079-a964-c6227d1c4118,20ba9fbd-c903-4166-8fc5-aac6326392a4,Matthew,Brown,Data Engineer,Wilson-Hubbard,matthew.brown@example.com,(554)431-0845x918,6711 Main St,Boston,MA,02110,United States,22,syndicate killer eyeballs,Looking for a partner to help with a large-scale cloud migration.,2025-02-18T13:38:22.463480,LRN512
2ea77d33-e301-4d5e-bee4-53ffc4848e4a,143c1be8-9e5f-496b-b9c7-6042e15f80cb,Donald,Hernandez,Mobile Developer,Davis Inc,donald.hernandez@example.org,509-675-2768,8858 Maple Ave,Boston,MA,02110,United States,90,e-enable strategic mindshare,Wants to schedule a deep-dive demo of the new security features.,2025-09-04T02:53:27.680767,LRN512
dd9d3942-f01b-4746-b508-74b0fb50e5b9,6ed223aa-b48e-4fe1-a19d-a744ef5f1fe1,Jennifer,Reilly,AI Researcher,Smith-Smith,jennifer.reilly@example.net,+1-912-880-2028x109,3669 Main St,Austin,TX,73301,United States,100,transform revolutionary portals,Concerned about data sovereignty and GDPR compliance in the EU region.,2025-05-20T19:51:07.583656,LRN512
74a52d0c-4665-44c6-ae0a-e9252807de43,d3d93fde-9e3a-4412-9272-496561ece2fb,Candace,Garcia,Data Scientist,Santana-Charles,candace.garcia@example.net,(473)916-0188,552 Maple Ave,Miami,FL,33101,United States,48,harness dynamic paradigms,Asked if we support Terraform providers for infrastructure as code.,2025-03-25T19:22:28.300370,LRN512
f67a715f-1d23-4800-9ed6-1ea36eced012,b7c1fd28-3d9e-4d32-8dd6-df6b591d0f86,Sarah,Morales,Android Developer,Whitehead LLC,sarah.morales@example.net,537.298.4533x616,5935 Innovation Way,Denver,CO,80202,United States,85,engage dynamic portals,Asked if we support Terraform providers for infrastructure as code.,2025-06-07T17:59:20.029863,LRN512
14ddc014-3fc7-4078-9982-e08aee86c658,f3342f22-93b6-4373-b7ec-daeeb7dd4625,Marc,Harding,Product Manager,Shah PLC,marc.harding@example.com,(762)913-6614x9734,1479 Washington St,Seattle,WA,98109,United States,88,productize extensible paradigms,Concerned about data sovereignty and GDPR compliance in the EU region.,2025-07-01T17:35:28.678426,LRN512
d99b0164-5ecd-4834-af69-ba31330b1312,3a5a6b5a-fcea-4599-affe-42eede85e72a,David,Horn,Test Automation Engineer,Wright Group,david.horn@example.com,572-614-3564x7565,9575 Main St,Denver,CO,80202,United States,39,maximize world-class vortals,Evaluating the feasibility of a multi-tenant architecture.,2025-10-09T09:01:31.148924,LRN512
2b961c2b-8a47-454b-a970-babd447a303a,40a4a120-565f-4e4d-b0e7-2433d8350968,Cynthia,Smith,Full Stack Developer,Hampton PLC,cynthia.smith@example.org,589-205-4143x385,613 Innovation Way,Montreal,QC,H3B 1A7,Canada,20,visualize one-to-one methodologies,Looking for a partner to help with a large-scale cloud migration.,2025-07-16T22:17:36.719780,LRN512
69078780-54ff-4bb3-91be-1c32608c0bc5,9703c94c-e059-4d98-b16b-c286de6976f1,Tammy,Gibson,Test Automation Engineer,Lopez Group,tammy.gibson@example.org,+1-489-965-9581x72370,1544 Main St,Toronto,ON,M5H 2N2,Canada,12,drive out-of-the-box infrastructures,Wants to know more about our machine learning model training capabilities.,2025-02-18T01:00:46.760529,LRN512
96524c2c-647d-48c3-a8f2-0131ff3b29ec,aed9acc6-7ae0-4339-a0a0-7e48b39cbe1c,Tiffany,Smith,Technical Product Manager,Ramsey-Molina,tiffany.smith@example.net,794.743.4263,6785 Broadway,Denver,CO,80202,United States,59,visualize intuitive e-services,Interested in automated testing strategies for their mobile app.,2025-04-22T09:51:26.874336,LRN512
245d49e1-15f6-4191-976b-11480ea31da5,5a90f0d7-07c3-4055-9558-a2069f67ad27,Michael,Davis,Product Manager,Lynch-Harris,michael.davis@example.net,(549)703-3274x807,6453 Oak St,Guadalajara,JAL,44100,Mexico,57,expedite web-enabled initiatives,Discussed the benefits of Rust over C++ for their new engine.,2025-07-20T16:40:37.083076,LRN512
7d116e6c-ff51-4bd4-9e25-f5f2d4b5a1ee,e781e926-459a-4cc5-91ab-926af8cd2db3,Christopher,Wilson,Software Engineer,"Berg, Hendrix and Richardson",christopher.wilson@example.com,001-801-674-0170,473 Main St,Denver,CO,80202,United States,2,leverage 24/7 users,Concerned about data sovereignty and GDPR compliance in the EU region.,2025-01-12T01:00:45.346366,LRN512
1d5f21f9-8768-43f1-9fa6-88d92a8f7ae7,0b7641ed-051d-4639-92fa-eee6019bb76f,Harold,Duran,Backend Developer,Chen-Wood,harold.duran@example.org,668-211-9309x048,3614 Tech Blvd,Monterrey,NL,64000,Mexico,60,scale back-end deliverables,Inquired about volume pricing for high-throughput data streaming.,2025-04-01T01:39:43.880745,LRN512
b41f27d4-7e09-44c2-a5e8-cb7a450a1edf,04e33018-94a5-4a34-9c13-6bd2c2b338e3,Lisa,Green,Software Engineer,Walker-Navarro,lisa.green@example.org,+1-524-991-9224x988,9341 Broadway,Denver,CO,80202,United States,74,engage revolutionary web-readiness,Encountered friction with the SSO setup; needs technical support.,2025-09-09T09:05:37.830123,LRN512
2c224fc4-2bbb-4c46-a542-ce74745dd39a,d2bcaa13-4da4-437c-ba88-297210cb425a,Thomas,Valenzuela,Test Automation Engineer,Sherman Inc,thomas.valenzuela@example.org,(591)894-6730x607,5336 Washington St,Rio de Janeiro,RJ,20000-000,Brazil,8,evolve scalable eyeballs,Inquired about volume pricing for high-throughput data streaming.,2025-09-23T15:00:56.041874,LRN512
79793b07-5572-481b-9b2c-dff7f0a9559a,6e9ddb95-c469-4889-9469-9ba75ea2ce5d,John,Phillips,DevOps Engineer,"Smith, Miller and Potter",john.phillips@example.org,001-998-951-7772x859,5853 Market St,Atlanta,GA,30303,United States,55,expedite one-to-one e-business,Mentioned a need for real-time analytics and dashboarding.,2025-06-27T23:41:23.141451,LRN512
9a47c3cb-8a86-42fe-8491-59ea3727c439,d1aa8144-8c56-42d5-b348-851af30ec373,Laurie,Woods,Data Engineer,Wood and Sons,laurie.woods@example.org,630-705-6714,4764 Oak St,Chicago,IL,60601,United States,61,optimize cross-platform metrics,Looking for a solution to optimize their CI/CD pipeline latency.,2025-03-18T15:00:28.137059,LRN512
a23b36e9-a9b5-4037-a6b9-b1932dc0016a,f1fb5522-961e-4af1-b370-200047095752,Sean,Mckee,Engineering Manager,Norton Group,sean.mckee@example.com,001-301-787-9498x06927,1863 Washington St,Seattle,WA,98109,United States,78,target ubiquitous methodologies,Discussed the benefits of Rust over C++ for their new engine.,2025-08-08T08:50:35.243727,LRN512
b78361b2-ec87-416c-b8e4-72d2f98d5d51,1508d1c1-4515-4528-8701-0c551607e4a9,Michael,Bowen,AI Researcher,Davidson Group,michael.bowen@example.com,(676)536-3679x314,4366 Oak St,Boston,MA,02110,United States,52,unleash viral infrastructures,Inquired about volume pricing for high-throughput data streaming.,2025-03-13T22:13:43.716647,LRN512
e0194d26-38a1-4c00-8505-72c0e8e1fe7c,9b0090fa-3592-4987-a74b-bbb59960c09a,Dustin,Carpenter,Data Engineer,Fowler Inc,dustin.carpenter@example.net,(284)879-2275,3644 Broadway,Chicago,IL,60601,United States,3,iterate clicks-and-mortar partnerships,Interested in migrating legacy systems to a microservices architecture.,2025-09-16T20:36:55.261053,LRN512
ae454c98-5b74-4df9-b5f7-9ad6a1e3fda5,2f6a8fa1-c138-4cce-bbc9-58b39f728b48,Stephen,Sanchez,Network Engineer,Francis-Rodriguez,stephen.sanchez@example.net,(273)853-3560x4057,3396 Oak St,Stockholm,Stockholm,111 22,Sweden,96,enhance vertical action-items,Wants to integrate our widget into their React Native application.,2025-09-03T00:10:37.446306,LRN512
afdba866-8db8-4928-af55-8ea0ac4584b4,21da5987-0859-43a2-8cac-a03120c7d7e2,Anthony,Fisher,Software Engineer,"Lee, Wagner and Porter",anthony.fisher@example.com,(544)268-3768x095,9194 Tech Blvd,Los Angeles,CA,90001,United States,22,enhance leading-edge e-business,Discussed potential integration with their existing Kubernetes cluster.,2025-03-06T15:58:34.679186,LRN512
d231b2f5-54d5-4157-8531-1888fbffb3dd,aa297ba9-12f0-42cc-8c21-23eaec550469,Jessica,Ford,Machine Learning Engineer,Perez LLC,jessica.ford@example.org,402-737-7063x6637,5748 Main St,Lyon,Auvergne-Rhône-Alpes,69001,France,17,evolve world-class channels,Asked detailed questions about our GraphQL API rate limits.,2025-05-28T03:03:43.583956,LRN512
807a6dbe-4bf9-4084-8b92-a2b97a2275e7,90e852bc-a851-4abd-b782-b4afad10a317,Rachel,Mills,AI Researcher,Love-Lambert,rachel.mills@example.net,+1-211-580-8818,9681 Maple Ave,Boston,MA,02110,United States,12,incubate front-end web services,Encountered friction with the SSO setup; needs technical support.,2025-03-11T02:44:04.361037,LRN512
873052bf-53e1-4b03-8dd0-a52ce3a2a1c4,9a6119ca-016f-4a22-be64-91f24e5f6856,Luis,Gibson,Site Reliability Engineer (SRE),Wilkerson-Sandoval,luis.gibson@example.org,317-500-7257,3827 Maple Ave,Los Angeles,CA,90001,United States,84,innovate strategic web services,Wants to know more about our machine learning model training capabilities.,2025-08-03T02:22:28.569567,LRN512
241347ae-3cbb-4004-aab2-88c640364492,1b83fa91-0af3-43e8-90cc-e838d1cb5365,Laura,Castillo,VP of Engineering,Beltran-Young,laura.castillo@example.com,+1-948-852-9852,3660 Oak St,Atlanta,GA,30303,United States,84,enable out-of-the-box relationships,Looking for a partner to help with a large-scale cloud migration.,2025-08-31T13:38:41.979081,LRN512
985487d4-18ea-44ad-bb40-f20bba6fb630,979640b0-d52b-4efd-915b-23c6331e343e,Christopher,Cole,Android Developer,Thomas-Turner,christopher.cole@example.com,375-881-9185x40984,9688 Tech Blvd,Miami,FL,33101,United States,41,enhance customized interfaces,Discussed the benefits of Rust over C++ for their new engine.,2025-03-04T13:03:59.440766,LRN512
7475f614-39fa-4fbb-9bc3-3d6d05e8bd83,d987738f-9ecc-4f1c-82bd-6e3ff637e0ce,Albert,Hughes,Senior Software Engineer,Figueroa Group,albert.hughes@example.com,473-476-0110x139,3108 Maple Ave,Mexico City,CDMX,01000,Mexico,58,utilize holistic bandwidth,Suffering from database locking issues; looking for advice.,2025-05-07T03:55:45.166474,LRN512
