Scan ID,Attendee ID,First Name,Last Name,Title,Company,Email,Phone,Address,City,State,Postal Code,Country,Lead Score,Qualifiers,Notes,Timestamp,Session ID
4d6c08ab-df8f-4d73-a565-bb8ec359a358,7b155957-859c-43cf-ae09-3689d921d117,Sherry,Morgan,Security Engineer,Davis Inc,sherry.morgan@example.org,+1-295-250-2233x543,6118 Washington St,Montreal,QC,H3B 1A7,Canada,24,engage sticky content,Looking for a partner to help with a large-scale cloud migration.,2025-06-22T17:15:28.414123,LRN512
22c27d32-20a6-4bbb-bed4-dcd458a29414,e2786fdc-5280-4965-9d88-06ad04060291,Brenda,Pierce,Frontend Developer,Franklin LLC,brenda.pierce@example.net,709.238.6057,7970 Washington St,Bangalore,KA,560001,India,32,engineer best-of-breed bandwidth,Discussed potential integration with their existing Kubernetes cluster.,2025-04-05T05:01:49.786638,LRN512
5316917f-62bc-4760-8db7-2c116071753e,c6269235-99ea-4ea6-b08a-177ae1ab9fbc,Charles,Glenn,Developer Advocate,Miller-Garner,charles.glenn@example.org,304.558.1153x54018,6838 Broadway,Ottawa,ON,K1P 1J1,Canada,93,synergize scalable metrics,Concerned about data sovereignty and GDPR compliance in the EU region.,2025-01-11T22:54:23.070704,LRN512
e01681a2-9d1f-4ee2-8542-97ca66e1df43,c5fbe244-0823-4177-b08a-52da6bcf70f5,Jorge,Hunt,iOS Developer,Murray-Walker,jorge.hunt@example.net,9926715431,6158 Market St,Guadalajara,JAL,44100,Mexico,39,redefine value-added functionalities,Looking for a solution to optimize their CI/CD pipeline latency.,2025-07-02T15:43:55.876765,LRN512
57445b55-d5f4-4824-a01d-df313aa931a9,e02d1fec-42a5-40ae-835e-19ee148b9f19,Luis,Mays,Software Engineer,Johnson LLC,luis.mays@example.com,001-771-989-4224x628,745 Oak St,Montreal,QC,H3B 1A7,Canada,32,target holistic supply-chains,Mentioned a need for real-time analytics and dashboarding.,2025-02-19T13:30:50.444868,LRN512
e172aef6-c0af-4c34-bf95-fb3aa92e6243,f9258933-5e45-4d18-b816-e84ee34c9d51,David,Gonzalez,Android Developer,"Mitchell, Wilson and Black",david.gonzalez@example.org,916.737.5131,6702 Broadway,Austin,TX,73301,United States,42,revolutionize efficient channels,Interested in migrating legacy systems to a microservices architecture.,2025-05-03T06:17:03.635516,LRN512
15221436-72da-4678-8a5e-775fc66147df,89802739-5be4-48ce-8299-d9fb4759c1a8,Michelle,Holt,Database Administrator,Barker and Sons,michelle.holt@example.net,956-386-8751x484,6433 Maple Ave,Montreal,QC,H3B 1A7,Canada,4,morph wireless vortals,Curious about our websocket support for real-time chat.,2025-01-05T22:25:32.972538,LRN512
aa075955-2cbe-474f-8f52-c9a617246166,c687aa6f-0bc1-420d-a624-762a3eea9522,Gary,Lewis,Software Engineer,"Jenkins, Shaffer and Medina",gary.lewis@example.net,(529)827-8685,5112 Innovation Way,Los Angeles,CA,90001,United States,68,visualize synergistic interfaces,Suffering from database locking issues; looking for advice.,2025-05-08T07:33:11.463341,LRN512
47e10a1e-f16f-4ef9-a505-01de859217cc,aebacb01-c2cf-450a-9327-ef625871802c,Thomas,Howell,Developer Advocate,"Lowe, Ortega and Ortiz",thomas.howell@example.org,(482)955-7100,4002 Maple Ave,Shanghai,Shanghai,200000,China,53,harness killer channels,Curious about our websocket support for real-time chat.,2025-02-09T03:24:22.891895,LRN512
c398d39e-6071-47ee-b249-1db1121e5446,2923b812-f78a-471f-b1d4-bb86d0c6da5b,Randy,Warner,Data Scientist,"Foster, Curry and Miller",randy.warner@example.org,001-980-370-0139x6331,2080 Oak St,Miami,FL,33101,United States,47,deploy strategic models,Exploring options for edge computing and low-latency delivery.,2025-07-05T05:48:59.691570,LRN512
cfa0e910-eaa3-4816-af25-266ae28d1ab2,01689e7f-4f3b-40f4-8c53-ec301d603e2b,Brenda,Mcguire,DevOps Engineer,Pineda Ltd,brenda.mcguire@example.net,856.413.1534,8747 Washington St,Munich,Bavaria,80331,Germany,38,scale granular platforms,Excited about the roadmap for serverless function support.,2025-10-09T15:28:10.231607,LRN512
94e245a8-2279-4735-8697-62c21ee2a9b5,c4fa48b9-bfdb-4a02-96fd-f489a67055d6,Judith,Carpenter,Network Engineer,Goodman-Sandoval,judith.carpenter@example.com,001-292-807-7692x927,834 Maple Ave,Los Angeles,CA,90001,United States,70,drive frictionless technologies,Discussed the benefits of Rust over C++ for their new engine.,2025-03-31T19:31:12.177271,LRN512
d628eff4-e9b6-4c57-bed1-cc53bbfd6d94,78ea7e11-365e-45ae-9fdc-c1a628a5f34a,April,Stokes,Frontend Developer,Hinton-Ball,april.stokes@example.net,001-262-620-0926x721,3232 Tech Blvd,Melbourne,VIC,3000,Australia,37,leverage turn-key markets,Interested in automated testing strategies for their mobile app.,2025-06-02T08:23:02.472318,LRN512
7b5e4ce8-a86a-40fd-8df1-9540e54a0277,a1c72310-f678-4f8e-b48d-02e645d29cd4,Brenda,Owens,Full Stack Developer,Good Inc,brenda.owens@example.org,001-795-809-4121x537,4244 Broadway,Austin,TX,73301,United States,15,empower 24/365 e-commerce,Concerned about data sovereignty and GDPR compliance in the EU region.,2025-05-14T02:38:41.708104,LRN512
20bb756a-1f40-4509-936e-7c2b4f030f69,9b2203cf-af90-45ad-b8c4-b053cd0621bf,Joseph,Garrett,Backend Developer,Schmitt Group,joseph.garrett@example.org,001-395-496-6055x16090,4304 Innovation Way,Austin,TX,73301,United States,34,extend intuitive platforms,Wants to schedule a deep-dive demo of the new security features.,2025-09-08T03:50:41.640761,LRN512
ea8d994b-c2a4-49e7-b88e-23793af5c2fa,30608595-1842-4a4b-8c24-32a83516225e,Jordan,Cook,Security Engineer,Wagner PLC,jordan.cook@example.net,001-859-291-7826x1871,1417 Innovation Way,Atlanta,GA,30303,United States,2,streamline virtual communities,Mentioned a need for real-time analytics and dashboarding.,2025-07-22T09:33:55.157960,LRN512
d25b134e-67a1-4b79-942d-cc7704b0bc29,c175a3e4-150c-417f-a551-a5590439a73a,Jason,Moore,Mobile Developer,Shaw and Sons,jason.moore@example.org,(631)625-9138,2980 Maple Ave,Atlanta,GA,30303,United States,93,benchmark open-source niches,Asked if we support Terraform providers for infrastructure as code.,2025-02-11T12:26:55.478542,LRN512
8ed8f3b6-ce8e-4820-8ad7-97dc791ab7fb,7b54db99-82fd-41c8-8e5f-c670df1b1339,Tiffany,Morse,UX/UI Designer,"Kelley, Wright and Cook",tiffany.morse@example.org,850.346.8816,4850 Washington St,Beijing,Beijing,100000,China,49,repurpose frictionless paradigms,Looking for a solution to optimize their CI/CD pipeline latency.,2025-03-14T23:14:12.095288,LRN512
fff446d0-cf74-410c-986d-1d9fdd987b8a,0650f7a3-88d7-4c46-bfdb-b826e22b8517,Amanda,Drake,Engineering Manager,Rodriguez-Walton,amanda.drake@example.net,361.828.4510x487,5558 Main St,Boston,MA,02110,United States,93,transform B2C functionalities,Exploring options for edge computing and low-latency delivery.,2025-08-13T06:01:46.967548,LRN512
a440544d-3841-4cfa-ba2e-9a7c9f646a8d,ad04b55d-956c-4db2-b5b2-b526f43b0073,Kristen,Wiley,Mobile Developer,Livingston-Reyes,kristen.wiley@example.org,(418)261-7930,8493 Innovation Way,San Francisco,CA,94105,United States,18,transform impactful users,Curious about our websocket support for real-time chat.,2025-02-12T07:20:49.162483,LRN512
5164d1a3-b6e6-4e7c-8eda-8cad84f59afa,640817b2-1a8c-4599-8601-b13c02aebec3,Elizabeth,Carlson,Senior Software Engineer,"Strong, Avery and Hobbs",elizabeth.carlson@example.net,738-894-9895,2903 Washington St,Calgary,AB,T2P 1J9,Canada,41,aggregate frictionless e-tailers,Interested in migrating legacy systems to a microservices architecture.,2025-08-12T02:23:13.806712,LRN512
6f153712-179c-4bb8-932d-7f00df58189e,5ded2c23-f9a7-4985-8db3-1608c2c473fe,Christina,Dunn,Technical Writer,Thomas Ltd,christina.dunn@example.org,(517)613-4171x5683,503 Main St,Chicago,IL,60601,United States,27,disintermediate integrated e-commerce,Mentioned a need for real-time analytics and dashboarding.,2025-05-05T11:42:29.492838,LRN512
eb014ead-3b6c-4f8e-bd3f-948df98a35a4,fc09a7da-6dcf-4706-ae92-b5d741e46840,Judy,Shaw,Test Automation Engineer,"Pratt, Pruitt and Lester",judy.shaw@example.net,626-343-8698x71774,7970 Oak St,Amsterdam,NH,1012,Netherlands,23,deploy vertical solutions,Encountered friction with the SSO setup; needs technical support.,2025-06-10T21:43:25.506918,LRN512
496df821-990d-4593-9058-5523bfe7a9f6,bd221222-e235-49c4-a99f-f6ccc5fc18f1,Robert,Jenkins,Developer Advocate,Stephens-Jones,robert.jenkins@example.com,387-447-2417x49020,5633 Washington St,Berlin,Berlin,10115,Germany,44,productize 24/7 bandwidth,Discussed the benefits of Rust over C++ for their new engine.,2025-07-25T09:17:10.414822,LRN512
b1b21e59-57a3-4886-b766-22361c6b9240,d87a4ed0-fc01-49a2-9b99-2c91ce5f6b9c,Mark,Peters,Frontend Developer,Miller-Sims,mark.peters@example.org,+1-853-799-2176x680,4744 Washington St,Miami,FL,33101,United States,91,leverage out-of-the-box action-items,Evaluating the feasibility of a multi-tenant architecture.,2025-04-21T20:04:59.386025,LRN512
0ddf83c9-cf89-464e-8aaf-9b5ce33fc7f7,0b297466-aa3a-4068-95ff-a642e6e2b503,Steven,Hernandez,Security Engineer,"Moore, Wells and Moore",steven.hernandez@example.net,676.512.4521,2846 Main St,Denver,CO,80202,United States,93,extend world-class supply-chains,Evaluating our platform against AWS and Azure alternatives.,2025-07-01T00:49:35.158745,LRN512
7921d4ec-e7df-483b-85d5-67b59c642bd7,68f2744a-d7b1-4e2f-8960-88b7abd223a1,Sherry,Fields,Security Engineer,Burke-Goodwin,sherry.fields@example.com,(325)684-7029,7359 Maple Ave,Denver,CO,80202,United States,31,repurpose viral deliverables,Looking for a partner to help with a large-scale cloud migration.,2025-08-21T10:59:48.850090,LRN512
14e0708b-56f4-4681-9a71-002582b38b6a,88f6987c-c538-4d69-832c-cfcda850a4af,Sheryl,Cochran,Backend Developer,Mendez Inc,sheryl.cochran@example.net,614.698.5759x63440,5683 Maple Ave,Seattle,WA,98109,United States,97,brand wireless platforms,Looking for a solution to optimize their CI/CD pipeline latency.,2025-04-26T02:32:13.985103,LRN512
4002f0c5-466c-4682-89bd-1ac11354bb58,c23d5f91-03f1-4d61-a66f-b265c915e021,Melissa,Jones,QA Engineer,Adams LLC,melissa.jones@example.org,001-694-988-2814x6589,4061 Main St,Calgary,AB,T2P 1J9,Canada,14,transform best-of-breed applications,Mentioned a need for real-time analytics and dashboarding.,2025-03-21T02:51:35.788308,LRN512
f2d34fa2-b81d-47da-85ad-f0743ab22cff,ca8e8b84-c7ef-405c-a0b2-e85aff206893,Tiffany,Ward,Mobile Developer,Ortiz LLC,tiffany.ward@example.org,806-528-7695,8426 Innovation Way,Dublin,Dublin,D01,Ireland,16,monetize transparent interfaces,Excited about the roadmap for serverless function support.,2025-09-22T03:06:49.990494,LRN512
12d21f81-578a-4cf9-9a72-a792a488a5f6,3b70fe5b-b04e-48ec-a4da-488b75669179,Richard,Turner,Technical Writer,"Holt, Herring and Gonzalez",richard.turner@example.net,001-414-816-0903,4252 Tech Blvd,Vancouver,BC,V6B 1P1,Canada,39,streamline synergistic web-readiness,Needs a solution for log aggregation and anomaly detection.,2025-07-15T02:57:41.768456,LRN512
b7f1924d-64b0-42c5-86b6-bcd224b3c44a,d12d1075-9e16-418c-aab9-c52d89f5c627,Greg,Russo,Test Automation Engineer,Rivera-Dawson,greg.russo@example.net,839.231.9654,4970 Maple Ave,Miami,FL,33101,United States,3,exploit e-business synergies,Looking for a solution to optimize their CI/CD pipeline latency.,2025-06-11T10:51:07.578317,LRN512
48b93049-0c3f-493d-a6d0-9ccdea094357,f7eceb0b-acc9-450a-a523-8e0dcd3bfaf7,William,Carson,Network Engineer,"Berger, Combs and Stewart",william.carson@example.com,(493)576-8107x024,1367 Market St,Austin,TX,73301,United States,92,deliver open-source partnerships,Suffering from database locking issues; looking for advice.,2025-08-30T15:20:14.163996,LRN512
e582e3f2-52c6-4eed-884f-5f9edc29d9e2,52b1dc95-0f57-4c9a-a088-9c07f8b2981c,Cindy,Archer,Network Engineer,Carroll-Perry,cindy.archer@example.com,(258)464-2103x0636,4132 Washington St,Dublin,Dublin,D01,Ireland,44,engage proactive vortals,Discussed potential integration with their existing Kubernetes cluster.,2025-01-04T14:36:05.019270,LRN512
9b90b136-2236-4f06-a9a1-8d71a2d4de17,27b47a20-6722-4603-9aba-fccb69d113ac,Andrew,Powell,Data Scientist,Gutierrez-Martinez,andrew.powell@example.org,(435)658-1750x51891,5789 Market St,San Francisco,CA,94105,United States,88,aggregate dynamic bandwidth,Mentioned a need for real-time analytics and dashboarding.,2025-08-12T19:59:48.664997,LRN512
eb2be162-3943-47ea-8c38-a4111544ac3f,7a01e617-9155-4bbe-8b33-da5e40338eb1,Samuel,Smith,Cloud Architect,Spears Ltd,samuel.smith@example.org,466-537-2311x08557,1109 Main St,Dublin,Dublin,D01,Ireland,81,seize end-to-end supply-chains,Needs better documentation for the Python SDK.,2025-04-05T23:41:35.281707,LRN512
dbc17e43-7af1-404d-8a1a-8507b8297de3,769ef2d3-8955-4461-8c20-927b8435ca87,Charles,Garcia,Solutions Architect,Lawrence-Ellis,charles.garcia@example.net,688-315-3728x71562,5512 Maple Ave,Mumbai,MH,400001,India,12,embrace sticky schemas,Encountered friction with the SSO setup; needs technical support.,2025-06-13T01:29:58.663992,LRN512
21454e7e-848c-4d94-b0ab-7f72cdb29fe2,7c544c8f-42d4-472d-a44e-32a92fbd408e,Bryan,Henry,Software Engineer,Best and Sons,bryan.henry@example.com,001-765-203-1624x725,8383 Tech Blvd,San Francisco,CA,94105,United States,84,productize sticky infrastructures,Suffering from database locking issues; looking for advice.,2025-04-21T14:37:16.416474,LRN512
4e528a9e-22f3-4f4b-bf7e-5ec03bfccffd,67e0c244-1eb8-4b88-af7f-0279108922c6,Joshua,Vincent,QA Engineer,"Martin, Wright and Ellison",joshua.vincent@example.com,7515308384,6249 Broadway,Singapore,SG,049318,Singapore,85,transform transparent synergies,Inquired about volume pricing for high-throughput data streaming.,2025-02-03T04:21:13.311867,LRN512
a2f234d5-0f73-4900-809b-8a156fd360e1,41e33636-95fb-4c8b-a69e-4375443ebad7,Kimberly,Conner,Solutions Architect,Price-Lee,kimberly.conner@example.org,585-839-9872x0128,1594 Main St,Boston,MA,02110,United States,80,embrace value-added e-services,Looking for a solution to optimize their CI/CD pipeline latency.,2025-01-02T22:52:58.598796,LRN512
808b7dcb-ec59-452c-b96b-4a009e582619,e19119b1-4180-4294-94f2-b0a5ee0d07d9,Olivia,Weber,QA Engineer,Mendoza-Nguyen,olivia.weber@example.net,220.683.1242x9061,1678 Tech Blvd,Chicago,IL,60601,United States,50,envisioneer 24/365 e-services,Discussed potential integration with their existing Kubernetes cluster.,2025-05-27T10:48:51.069831,LRN512
298f4f8f-2755-4a57-b7b4-7bf14abadd57,4b35d797-5375-4003-9a86-8f4fc1908b68,Sean,Brown,VP of Engineering,Holmes-Fitzgerald,sean.brown@example.net,847.370.1406,3425 Innovation Way,San Francisco,CA,94105,United States,56,engage mission-critical web services,Interested in automated testing strategies for their mobile app.,2025-04-10T03:36:15.760266,LRN512
a4d53f65-5323-4d0e-953f-8a7715f18a05,ed1821c5-4ce6-4f42-9ff8-c47a003176f9,Adam,Gonzales,Security Engineer,Evans-Kirby,adam.gonzales@example.net,342-919-1289,1808 Innovation Way,Montreal,QC,H3B 1A7,Canada,13,re-contextualize best-of-breed bandwidth,Looking for a solution to optimize their CI/CD pipeline latency.,2025-02-05T22:45:41.099168,LRN512
406393b7-ff2e-479b-8027-c5ae7d293b83,092c7463-b9e1-472b-a2e9-2163f57e1b30,Ryan,Orr,Site Reliability Engineer (SRE),"Garcia, Brown and Wagner",ryan.orr@example.net,001-835-296-1134,1265 Oak St,Los Angeles,CA,90001,United States,49,evolve robust interfaces,Discussed the benefits of Rust over C++ for their new engine.,2025-08-16T05:43:00.836771,LRN512
1d231702-dbce-4d80-9a61-0ee8bd9b3392,9a2f8171-3e67-4ce7-8d33-35331f223587,Lindsay,Acosta,Developer Advocate,"Ali, Rodriguez and Cooper",lindsay.acosta@example.net,953-368-1874x773,4270 Tech Blvd,New York,NY,10001,United States,78,scale cutting-edge ROI,Looking for a partner to help with a large-scale cloud migration.,2025-10-06T17:05:21.172254,LRN512
ccd2d5f6-f7b8-4cd1-80d6-26407ba9a519,a8693f8b-3ae2-4017-88de-f062fbf3eb3f,David,Mcdaniel,Machine Learning Engineer,Byrd and Sons,david.mcdaniel@example.com,+1-699-991-3876x4144,6178 Main St,Stockholm,Stockholm,111 22,Sweden,17,syndicate leading-edge portals,Encountered friction with the SSO setup; needs technical support.,2025-04-23T06:12:31.235852,LRN512
04e53921-1931-47cc-a59e-7c9707af8197,439d7882-c7fb-40d3-a08b-2574f4795925,Kayla,Clark,Backend Developer,Baker Inc,kayla.clark@example.com,3837259972,9322 Broadway,San Francisco,CA,94105,United States,43,benchmark impactful metrics,Interested in migrating legacy systems to a microservices architecture.,2025-01-11T11:35:00.360084,LRN512
a5b346ee-be20-4e8e-b4ea-b83f5f5c23d5,67965e65-b21d-4cab-8d9e-0a4c3a9fe1ce,Michael,King,DevOps Engineer,Hernandez LLC,michael.king@example.org,+1-635-812-5449x030,8243 Main St,Chicago,IL,60601,United States,72,drive value-added e-commerce,Curious about our websocket support for real-time chat.,2025-05-27T16:23:25.630177,LRN512
85989263-a743-467e-998f-5f3dacdc6db1,d6962b1c-70da-47eb-b08e-be0a45df4dd4,Alexandria,Robertson,Security Engineer,Matthews Inc,alexandria.robertson@example.net,911.543.8598,6631 Maple Ave,San Francisco,CA,94105,United States,62,re-intermediate web-enabled metrics,Discussed potential integration with their existing Kubernetes cluster.,2025-03-22T08:55:49.806883,LRN512
f4eed5dd-85cf-4f25-be9e-0abc49506903,c39e36cd-ce3c-43bb-ab00-34dca45c9ada,Haley,Norman,Security Engineer,Morgan-Lee,haley.norman@example.com,444.404.4343,1181 Washington St,Paris,Île-de-France,75001,France,69,engineer real-time experiences,Inquired about volume pricing for high-throughput data streaming.,2025-08-14T18:03:20.028927,LRN512
18a67108-0712-4733-a366-e44e0deddebd,ad03c320-804e-432b-8ec4-4d09c1bdaa53,Hannah,Rivera,Data Scientist,"Garcia, Dawson and Walker",hannah.rivera@example.org,001-360-252-7712x76107,179 Market St,Seattle,WA,98109,United States,64,harness strategic infrastructures,Wants to schedule a deep-dive demo of the new security features.,2025-07-29T21:03:33.976379,LRN512
e15ba9ad-2dff-449b-9772-912380d24c6e,ba719009-20e2-4d40-b17a-ac8c774f7170,Joseph,Chandler,Cloud Architect,"Lane, Brown and Dennis",joseph.chandler@example.com,(905)792-1476,8072 Innovation Way,Boston,MA,02110,United States,28,whiteboard intuitive vortals,Interested in migrating legacy systems to a microservices architecture.,2025-02-17T06:23:56.055115,LRN512
9f5acd96-58a0-4b59-9d6c-a5cc592d1338,7fc36e69-cbbf-4318-a4d5-0f6bfa36bf83,Jordan,Atkinson,Backend Developer,"Martin, Peters and Martinez",jordan.atkinson@example.net,+1-224-379-8052,5761 Washington St,Amsterdam,NH,1012,Netherlands,74,cultivate open-source architectures,Exploring options for edge computing and low-latency delivery.,2025-08-21T19:39:26.108188,LRN512
d031bb9d-2e25-4119-a812-63959d724e74,5ac514ea-e423-41d3-af58-7475adb9ad0e,Emily,Nguyen,iOS Developer,Davis and Sons,emily.nguyen@example.org,481.852.1604,492 Main St,Vancouver,BC,V6B 1P1,Canada,73,mesh e-business convergence,Excited about the roadmap for serverless function support.,2025-02-02T11:07:55.209646,LRN512
4cfd5f54-40d2-4398-a3c0-1865057ece7c,0d3b22da-71c6-4fda-aa99-8eaeba3f93a2,Kaitlyn,Bowman,Solutions Architect,"Moreno, Johnson and George",kaitlyn.bowman@example.com,+1-633-779-8112x91759,9933 Tech Blvd,Ottawa,ON,K1P 1J1,Canada,97,iterate cross-platform users,Evaluating our platform against AWS and Azure alternatives.,2025-01-27T02:53:38.499363,LRN512
845584f7-ba48-48b7-a00f-23b98934761f,c0eab5c2-826b-41c2-b2e6-573e93a63317,Sherry,Rollins,Test Automation Engineer,"Mendoza, Spears and Bond",sherry.rollins@example.org,(229)426-3655x3242,9544 Main St,São Paulo,SP,01000-000,Brazil,91,engage B2B channels,Wants to schedule a deep-dive demo of the new security features.,2025-03-02T11:05:44.760166,LRN512
d66f159f-0dfe-4a68-b10e-e4df241afb7f,5d66a21a-8820-41a1-b172-49cf3a453ab9,Danielle,Williams,Frontend Developer,"Graham, Thomas and Garrett",danielle.williams@example.net,8972127795,7440 Main St,Atlanta,GA,30303,United States,65,redefine ubiquitous ROI,Wants to schedule a deep-dive demo of the new security features.,2025-03-08T08:13:16.847486,LRN512
75c0e0f4-bf1d-4bc2-a012-720e9769b1de,b91da84b-409b-479c-a049-9867226d4d56,Natasha,Haynes,UX/UI Designer,Rivas-Roth,natasha.haynes@example.com,8954421059,6261 Tech Blvd,Miami,FL,33101,United States,20,seize user-centric ROI,Discussed potential integration with their existing Kubernetes cluster.,2025-06-11T07:04:43.303756,LRN512
c781d567-c4bf-4d1f-992b-5d5b3cd33e55,c9ec41ad-4ed4-47f3-8196-169eb905da45,Thomas,Flores,Data Scientist,King-Aguilar,thomas.flores@example.com,+1-725-249-6260x35226,260 Broadway,Berlin,Berlin,10115,Germany,23,revolutionize e-business platforms,Wants to schedule a deep-dive demo of the new security features.,2025-07-31T07:06:10.224537,LRN512
e5410494-6847-4330-8f5b-990f2acf7eb2,5a39cf84-ae28-41b8-977d-38d376cc277f,Thomas,Garner,Data Scientist,Mcfarland Ltd,thomas.garner@example.net,247-324-6308x6897,7648 Maple Ave,Montreal,QC,H3B 1A7,Canada,59,facilitate front-end communities,Looking to replace their current data warehouse with a more scalable solution.,2025-01-28T02:52:42.163902,LRN512
b4474f16-fb19-4163-b4fd-474234089194,973a5fc7-4436-4c34-b427-5956e69820bc,Steven,Perez,Machine Learning Engineer,Mclaughlin-Barnett,steven.perez@example.net,7752752829,822 Tech Blvd,Boston,MA,02110,United States,74,mesh e-business info-mediaries,Wants to integrate our widget into their React Native application.,2025-02-28T12:39:17.622288,LRN512
7a8ed09c-fe2c-4d50-9668-1a076c051c48,6417af8f-4771-42da-bd9a-8eb87424411d,Lisa,Russo,Solutions Architect,Clements Group,lisa.russo@example.net,350-928-7459x8637,4262 Maple Ave,Osaka,Osaka,530-0001,Japan,58,facilitate B2B systems,Wants to schedule a deep-dive demo of the new security features.,2025-09-04T23:08:49.578047,LRN512
5c62f7ed-8731-451c-9275-78697953feb2,c8cf5d11-766b-4619-87fb-0133c95f15c7,Amy,Frye,Android Developer,Miranda-Hawkins,amy.frye@example.net,480-959-0107,2084 Innovation Way,Bangalore,KA,560001,India,82,streamline global e-services,Wants to schedule a deep-dive demo of the new security features.,2025-06-15T04:02:55.496831,LRN512
177f27e1-db1f-4855-bde5-3da8241636fd,f20deff6-5f32-4c3f-bffd-8355e3a34b17,Donald,Hansen,Site Reliability Engineer (SRE),James and Sons,donald.hansen@example.net,(281)681-3330x41811,4622 Washington St,Austin,TX,73301,United States,36,mesh collaborative e-services,Inquired about volume pricing for high-throughput data streaming.,2025-03-28T07:51:28.172228,LRN512
3cea66c2-480b-4bfc-af62-804477601ca7,5ebec707-ed5b-49bf-a5a1-cbc1f9e1ef51,Alexandra,Green,Senior Software Engineer,Davis PLC,alexandra.green@example.net,001-975-579-6005x2812,9254 Tech Blvd,Denver,CO,80202,United States,46,productize e-business users,Looking to replace their current data warehouse with a more scalable solution.,2025-03-28T20:09:44.405272,LRN512
2a2bbd11-8916-4ff9-a0b6-051b097ae693,d9d5a8d7-bf74-4602-9fc4-5841e3ab665f,Debra,Miller,Full Stack Developer,Ortiz-Townsend,debra.miller@example.com,646-334-0659x7240,4798 Market St,Miami,FL,33101,United States,34,e-enable strategic mindshare,Discussed potential integration with their existing Kubernetes cluster.,2025-05-16T01:37:50.248447,LRN512
45591368-1ea9-4738-8aca-1c531c72ffbc,ba43fd02-27fb-4b4a-9c30-7e4e0f8f3e47,Ann,Cole,Engineering Manager,Ortiz-Green,ann.cole@example.org,001-976-895-9253,9423 Maple Ave,Dublin,Dublin,D01,Ireland,3,benchmark cross-media synergies,Interested in migrating legacy systems to a microservices architecture.,2025-06-27T10:54:51.960033,LRN512
816f0eaa-d624-4151-96d6-18747772545b,5cf940cd-e3a3-43d6-a761-1c7e06f6a1bb,Lisa,Ruiz,Data Scientist,Villa-Smith,lisa.ruiz@example.net,444.943.5648x80860,9929 Main St,Miami,FL,33101,United States,26,drive sticky supply-chains,Evaluating our platform against AWS and Azure alternatives.,2025-07-28T22:42:13.794394,LRN512
a1097e58-9be5-484d-9186-7219a2d8c027,a73ccef6-cc33-4531-a91b-cc5ea573afd8,Heather,Jones,Data Engineer,Molina Ltd,heather.jones@example.net,397.733.4969x894,830 Main St,New York,NY,10001,United States,36,engage collaborative platforms,Looking for a solution to optimize their CI/CD pipeline latency.,2025-09-15T11:51:51.967344,LRN512
00a78a3e-4494-476e-9b23-5890910c84d5,c4392e0a-8f14-4252-9a62-4dab59bd339a,Brad,Watts,Cloud Architect,Williams-Taylor,brad.watts@example.com,(946)849-4595,1076 Maple Ave,New York,NY,10001,United States,86,re-contextualize plug-and-play convergence,Wants to integrate our widget into their React Native application.,2025-09-12T17:16:43.493018,LRN512
2e23fecf-1160-4832-9529-796431db41f3,0866805a-ad20-4aff-ba27-442d43f97f09,Christopher,Alexander,Android Developer,Herrera-Daniel,christopher.alexander@example.com,(795)460-2110x162,3379 Washington St,Vancouver,BC,V6B 1P1,Canada,9,exploit real-time platforms,Wants to know more about our machine learning model training capabilities.,2025-05-28T16:26:49.986181,LRN512
6d83115a-729d-4a2b-ace2-4b94aed39c0e,22989126-5e34-4040-8c55-2909bba16b09,Jessica,Nguyen,Database Administrator,Martin-Parrish,jessica.nguyen@example.org,+1-356-300-7733x14796,4877 Innovation Way,San Francisco,CA,94105,United States,53,exploit rich functionalities,Interested in migrating legacy systems to a microservices architecture.,2025-10-06T09:13:27.915034,LRN512
08a497ad-2e80-475a-8898-75169910e5c4,e9a4c464-b376-4568-a228-18c8d1cbc963,Holly,Garcia,Data Scientist,"Gonzales, James and Delgado",holly.garcia@example.org,(289)572-6691x6137,6718 Tech Blvd,Seattle,WA,98109,United States,31,e-enable value-added deliverables,Looking to replace their current data warehouse with a more scalable solution.,2025-04-24T19:43:58.971439,LRN512
7ba5fb32-16db-462f-b105-5af5f41cc151,fccf6b0d-b88e-44e8-b9bd-7bd3fcce0640,Richard,Robinson,Developer Advocate,"Wallace, Francis and Barrera",richard.robinson@example.org,259-314-0331,4915 Maple Ave,New York,NY,10001,United States,71,expedite dynamic synergies,Concerned about data sovereignty and GDPR compliance in the EU region.,2025-09-17T17:24:28.019607,LRN512
