Scan ID,Attendee ID,First Name,Last Name,Title,Company,Email,Phone,Address,City,State,Postal Code,Country,Lead Score,Qualifiers,Notes,Timestamp,Session ID
373746fe-1b7d-40ed-9da0-131821b0cd2e,9c133bd5-23f9-440d-a549-afb46c4b0d4b,Christopher,Sims,Machine Learning Engineer,Hernandez-Cooper,christopher.sims@example.net,334-217-3898,8835 Washington St,Bangalore,KA,560001,India,75,scale one-to-one markets,Wants to know more about our machine learning model training capabilities.,2025-05-22T00:58:35.595482,LRN512
cd8f8eb7-13ee-4a4c-818e-9ffc55531d74,4550a467-abc3-498d-b835-eb9e4ba48adb,Daniel,Goodwin,Backend Developer,"Villarreal, Nolan and Peterson",daniel.goodwin@example.net,001-278-866-7060,9153 Broadway,Stockholm,Stockholm,111 22,Sweden,53,strategize best-of-breed architectures,Wants to integrate our widget into their React Native application.,2025-03-30T10:52:10.285856,LRN512
5f61b56f-c147-49cd-a4d6-53444c280100,2bf5ab61-daa7-47e5-b563-6d96661a74b9,Danny,Marshall,Software Engineer,Long Inc,danny.marshall@example.com,(482)432-4028x19353,465 Main St,Seattle,WA,98109,United States,25,facilitate intuitive models,Excited about the roadmap for serverless function support.,2025-06-27T09:26:57.770152,LRN512
e4960360-e855-4bd8-b3de-0d47954b4279,cafbc815-7b8b-4601-a059-11f5b3853fe5,Kelsey,Tucker,Data Engineer,Morris-Jackson,kelsey.tucker@example.com,(401)330-9659x67492,2493 Maple Ave,Montreal,QC,H3B 1A7,Canada,97,syndicate front-end functionalities,Wants to know more about our machine learning model training capabilities.,2025-02-26T10:47:39.280674,LRN512
049564f1-1e6a-446a-beeb-2e3a8e2fed12,312f4568-c163-4a2f-a246-7e7ba153749d,Nancy,Scott,Frontend Developer,"Willis, Lopez and Brown",nancy.scott@example.net,389-973-4154x99650,4430 Oak St,Seattle,WA,98109,United States,16,extend magnetic users,Asked about our uptime SLAs and incident response times.,2025-03-23T05:08:02.947059,LRN512
16ae23ae-0cb0-4c1b-83fa-044d6647c60b,11117a40-00f5-4570-9e31-08e3645f7548,James,Rice,Site Reliability Engineer (SRE),"Stokes, Rogers and Hall",james.rice@example.net,367.445.5127,4594 Washington St,Toronto,ON,M5H 2N2,Canada,68,scale interactive solutions,Evaluating the feasibility of a multi-tenant architecture.,2025-02-08T16:23:25.625063,LRN512
665ac590-389f-4939-a9e7-a33e83eeb9eb,aaeddb60-9f8f-4246-a2ba-48f8657805c7,James,Cook,Engineering Manager,"Davis, Robinson and Carpenter",james.cook@example.net,+1-587-862-7156x33903,3126 Broadway,New York,NY,10001,United States,62,utilize bricks-and-clicks platforms,Concerned about data sovereignty and GDPR compliance in the EU region.,2025-06-30T23:50:23.272174,LRN512
87e34fb0-06b2-48d2-83e3-f4d8915c9f54,9a9f8185-2943-41a7-aae2-e0cc37697826,Erika,Berg,Software Engineer,"Graham, Martin and Watson",erika.berg@example.org,(985)823-2611x672,9401 Market St,Austin,TX,73301,United States,18,transform magnetic e-tailers,Asked if we support Terraform providers for infrastructure as code.,2025-09-14T16:54:11.921697,LRN512
28724d60-e8e2-4014-baac-120847a1684b,1d4d44e8-36df-4ae7-9ff6-7f8f34c60b68,Micheal,Cowan,UX/UI Designer,Beasley and Sons,micheal.cowan@example.com,+1-447-884-2389x594,934 Main St,New York,NY,10001,United States,30,synergize e-business convergence,Encountered friction with the SSO setup; needs technical support.,2025-03-11T16:13:30.166494,LRN512
e9bb9c16-f36b-442d-a90a-68eaaf51e0d8,e57d161a-aec1-433f-bbc0-de461ccc3be0,Daniel,Moore,Technical Product Manager,James LLC,daniel.moore@example.net,(625)341-3337,9381 Main St,Guadalajara,JAL,44100,Mexico,85,engage holistic technologies,Suffering from database locking issues; looking for advice.,2025-06-14T23:33:31.872382,LRN512
066ad0f1-1fd6-4717-96bb-3101516d419f,3744cddf-360a-4b70-b706-9925a3cca3f2,Darrell,Haley,Technical Product Manager,"Lewis, Knox and Mitchell",darrell.haley@example.org,863-760-8916,1895 Market St,Los Angeles,CA,90001,United States,85,facilitate world-class content,Interested in migrating legacy systems to a microservices architecture.,2025-06-08T18:30:33.730726,LRN512
fc77439b-8df2-4e99-a057-3336279fad0e,769fb7bd-81b6-449d-8678-662ea2a12ebb,Randy,Livingston,Engineering Manager,"Roberts, Smith and Knight",randy.livingston@example.net,906.277.0560,3747 Maple Ave,Los Angeles,CA,90001,United States,88,innovate end-to-end users,Inquired about volume pricing for high-throughput data streaming.,2025-10-09T02:44:09.828289,LRN512
90135506-fa19-4755-9184-4c6d05585ec0,6c710699-91c6-4b5f-9526-bb38fb6e3e6c,Roger,Brooks,Backend Developer,Perez-Howe,roger.brooks@example.com,(628)355-7515x34127,2202 Washington St,Chicago,IL,60601,United States,94,re-intermediate holistic applications,Interested in automated testing strategies for their mobile app.,2025-01-25T04:43:39.802352,LRN512
db44f4ff-e13c-49b3-b0d9-78707c98ec31,7c19a11c-24cf-4a19-8b87-4f12f8892067,Michael,Fuller,AI Researcher,"Roberts, Sparks and Allen",michael.fuller@example.net,458-632-4923,3350 Oak St,San Francisco,CA,94105,United States,25,maximize virtual interfaces,Evaluating the feasibility of a multi-tenant architecture.,2025-09-22T00:20:37.294089,LRN512
51e439eb-c6a1-4cee-b973-a07d7c28d2f4,d41ef6a6-586e-46cd-9950-e28e3ed529ac,Linda,Williams,Frontend Developer,"Miller, Jackson and Patton",linda.williams@example.com,337.359.0645x93387,9370 Maple Ave,Stockholm,Stockholm,111 22,Sweden,100,re-intermediate holistic functionalities,Mentioned a need for real-time analytics and dashboarding.,2025-01-06T13:00:27.352541,LRN512
05d381e9-310d-4bba-96aa-11e78c358d3e,c5ab78a7-18da-4f24-b34c-ba5472ec0204,Brenda,Hernandez,Full Stack Developer,Harrison Ltd,brenda.hernandez@example.org,8962221740,3325 Maple Ave,Vancouver,BC,V6B 1P1,Canada,1,orchestrate compelling niches,Asked about our uptime SLAs and incident response times.,2025-03-14T22:16:34.033796,LRN512
32bcb150-ee25-4526-84be-68d446ad1cf7,a2a0f128-fc85-4503-8f67-fadbce0e4983,Jason,Long,VP of Engineering,"Stein, Martinez and Suarez",jason.long@example.com,539.314.1843,4997 Innovation Way,Ottawa,ON,K1P 1J1,Canada,38,transition revolutionary e-services,Asked detailed questions about our GraphQL API rate limits.,2025-06-06T15:18:47.440073,LRN512
5a551a4a-fb02-4089-823f-6e347c8a99a9,bef09594-1280-44cf-8004-aba87eda5579,Brian,Walsh,Technical Product Manager,Flores Group,brian.walsh@example.org,5868807060,2838 Washington St,Miami,FL,33101,United States,26,revolutionize compelling deliverables,Interested in automated testing strategies for their mobile app.,2025-07-27T16:42:08.247611,LRN512
e332eaa5-026f-43c2-a6c1-17369032d0bb,a01d9d9f-b3a1-47c7-a14f-e2a50b24b467,Jason,Moss,AI Researcher,"Mendoza, Morse and Harris",jason.moss@example.org,001-241-240-4413x63094,4135 Main St,Guadalajara,JAL,44100,Mexico,46,engineer user-centric networks,Suffering from database locking issues; looking for advice.,2025-07-25T05:48:16.028858,LRN512
ed6e7d5f-a6cd-461d-8cec-724ca7c54c69,70d80ac5-3eb2-41b1-8d29-7f08d402681d,Emily,Hall,Android Developer,Reid LLC,emily.hall@example.com,474.799.9357,1216 Tech Blvd,Monterrey,NL,64000,Mexico,35,engage interactive e-services,Interested in automated testing strategies for their mobile app.,2025-04-24T16:44:55.157472,LRN512
e7d20c63-a603-45d1-a5c1-206d6eb1ff2b,aa12eed4-9507-47fb-94dd-2ac59c50de2c,Lori,Delacruz,Data Scientist,Martinez-Price,lori.delacruz@example.org,2169904995,9880 Main St,Boston,MA,02110,United States,89,exploit open-source web-readiness,Evaluating the feasibility of a multi-tenant architecture.,2025-02-13T19:47:24.287086,LRN512
9acca995-9fd0-45b4-9060-7509fa0d9b5d,50d0af4a-a1f3-4b02-a47c-c5699cb35314,Samuel,Rhodes,Mobile Developer,Miller and Sons,samuel.rhodes@example.com,821-368-6168x8967,7298 Oak St,Chicago,IL,60601,United States,33,engineer cross-platform web-readiness,Suffering from database locking issues; looking for advice.,2025-05-17T07:12:41.602742,LRN512
c791d1ee-edf5-489d-a882-efbef745658e,0bf8e180-5f27-421f-8e25-0f6a1dad1067,Kevin,Sampson,UX/UI Designer,Larsen-Rowe,kevin.sampson@example.com,+1-691-522-9863x5960,5295 Innovation Way,Amsterdam,NH,1012,Netherlands,79,orchestrate killer models,Interested in automated testing strategies for their mobile app.,2025-07-16T23:40:08.912151,LRN512
002b9c0e-35ce-4a3a-bc89-31bad3ce2066,77246767-6777-48d7-9bbc-9d13d22208da,Kristen,West,Backend Developer,Johnson-Brown,kristen.west@example.org,(548)854-0317,9407 Maple Ave,Atlanta,GA,30303,United States,66,transition revolutionary mindshare,Discussed the benefits of Rust over C++ for their new engine.,2025-08-23T16:46:27.120265,LRN512
23e0b528-6313-4d4d-ad47-790e7ec33c50,70cf07c9-2181-4ba8-b82a-f3453df01f5e,Kristen,Kim,VP of Engineering,"Garcia, Guerra and Clements",kristen.kim@example.net,(386)329-7721x26370,3229 Broadway,New York,NY,10001,United States,53,incubate viral metrics,Excited about the roadmap for serverless function support.,2025-03-07T02:40:16.982001,LRN512
dbc4fd91-6c0e-48ee-aab8-2b01132d4812,06298152-1b35-47be-8876-29c916ea9b87,Jason,Williams,Security Engineer,Jacobs-Garcia,jason.williams@example.net,372-542-9867x57668,1036 Innovation Way,Berlin,Berlin,10115,Germany,4,embrace transparent users,Inquired about volume pricing for high-throughput data streaming.,2025-06-25T22:07:45.290648,LRN512
84cc2340-b484-4a48-bb0c-0bec88fc900d,07522044-8cf3-4308-a937-a66d77cb5bda,Jeffrey,Johns,QA Engineer,Cunningham-Keith,jeffrey.johns@example.net,6832272482,4028 Oak St,Toronto,ON,M5H 2N2,Canada,64,maximize proactive e-commerce,Asked about our uptime SLAs and incident response times.,2025-06-20T15:54:07.625771,LRN512
31a2fc39-1466-4c92-93cb-13a3774bae3e,52b432a6-8b05-4201-a3f8-62f154f78868,Amanda,Klein,AI Researcher,Hernandez PLC,amanda.klein@example.net,9714207926,9406 Maple Ave,Calgary,AB,T2P 1J9,Canada,23,scale wireless markets,Encountered friction with the SSO setup; needs technical support.,2025-01-11T03:54:26.024431,LRN512
c964bf11-e340-46e0-8398-f38df0429674,494f0ab9-0aa9-4db6-9874-f99e33995718,Jackie,Roberts,Machine Learning Engineer,Mathis Group,jackie.roberts@example.com,696-944-0050,7974 Main St,Montreal,QC,H3B 1A7,Canada,11,evolve open-source interfaces,Asked about our uptime SLAs and incident response times.,2025-05-26T07:13:30.875013,LRN512
712a86be-9ff4-4e36-9174-42f845a6e142,c70f9bc9-ea2a-478e-a1fe-708d498232f2,Misty,Rose,Site Reliability Engineer (SRE),Porter-Lopez,misty.rose@example.com,563.578.1023,2488 Innovation Way,Montreal,QC,H3B 1A7,Canada,30,synthesize enterprise users,Suffering from database locking issues; looking for advice.,2025-06-23T18:47:06.612099,LRN512
50fea8ee-6da2-43ee-9ada-ab8c79bfd28d,f5da7a5a-07e5-43e2-b573-fd8466f72142,Robert,Hood,Database Administrator,Myers and Sons,robert.hood@example.com,4115453793,3991 Oak St,Atlanta,GA,30303,United States,34,visualize value-added initiatives,Mentioned a need for real-time analytics and dashboarding.,2025-04-09T18:06:27.570379,LRN512
75985572-c0d9-4bb1-bcdd-4c050ee6e756,4ae1def9-d51d-49c2-86c1-d412bc4a29e9,Sarah,Flores,Test Automation Engineer,Lynch-Cooper,sarah.flores@example.net,+1-648-814-6828x20792,8106 Tech Blvd,Amsterdam,NH,1012,Netherlands,21,innovate out-of-the-box markets,Exploring options for edge computing and low-latency delivery.,2025-07-05T01:31:12.751388,LRN512
04616123-9f22-4872-8510-bd00af55fd53,ca927aaf-679c-41d1-a0b7-385933820d81,Miranda,Smith,Systems Administrator,Hawkins Inc,miranda.smith@example.org,001-635-527-1009x781,2849 Broadway,Los Angeles,CA,90001,United States,36,embrace frictionless users,Looking to replace their current data warehouse with a more scalable solution.,2025-09-19T03:57:17.514753,LRN512
b25e80d8-9eca-43d8-a2fc-37938b87de2b,4e5089d7-35d4-427a-bcff-e5dcfa584532,Mackenzie,Erickson,Frontend Developer,"Rivera, Roach and Jones",mackenzie.erickson@example.com,001-875-300-4486,6181 Market St,Denver,CO,80202,United States,98,scale 24/7 metrics,Interested in automated testing strategies for their mobile app.,2025-07-18T06:27:36.560251,LRN512
a98c36f0-ab44-4e58-9e92-ee544cc0aff1,41e37513-a561-404d-8aa9-8536d96d0b5b,Mary,Cook,Engineering Manager,Williams-Lee,mary.cook@example.net,9986496539,977 Oak St,New York,NY,10001,United States,53,incentivize bleeding-edge platforms,Exploring options for edge computing and low-latency delivery.,2025-01-15T20:43:39.431000,LRN512
5b5fbecc-0ffd-4b44-82bb-d70329833b53,7a803ead-b8cd-4309-a77a-4a1c46464de1,Alicia,White,UX/UI Designer,"Williams, Brandt and Gallegos",alicia.white@example.net,529.284.6208x8877,5475 Innovation Way,Atlanta,GA,30303,United States,62,repurpose best-of-breed technologies,Suffering from database locking issues; looking for advice.,2025-02-12T13:02:06.180247,LRN512
a90713ce-03c7-423f-9d45-cb3679a62cff,49ff0ecd-c468-48be-8894-e711689a9412,Courtney,Chase,Database Administrator,"Molina, Shannon and Case",courtney.chase@example.net,829-357-5244,7042 Maple Ave,San Francisco,CA,94105,United States,61,utilize intuitive interfaces,Wants to integrate our widget into their React Native application.,2025-05-29T04:19:21.751637,LRN512
7200c99d-1f45-485a-b2a9-146927b5de34,b556e77e-7fa6-4e9a-89c1-4150da5e68ba,Melissa,Cooper,iOS Developer,Guerra-Brown,melissa.cooper@example.com,001-365-331-3990x2531,5356 Oak St,Seattle,WA,98109,United States,64,mesh clicks-and-mortar systems,Interested in migrating legacy systems to a microservices architecture.,2025-01-18T10:22:25.636370,LRN512
f8d1aeb1-e2f5-458c-a9d5-d56ae38bec98,eb9a0139-c63e-4d17-a296-e5928a584b96,James,Martin,AI Researcher,Kennedy LLC,james.martin@example.net,(683)494-4598x9375,7751 Oak St,Vancouver,BC,V6B 1P1,Canada,82,deploy vertical info-mediaries,Discussed the benefits of Rust over C++ for their new engine.,2025-07-11T21:56:12.329788,LRN512
ab0f21d6-e7d1-446e-a2b9-d13ba29d57a5,a5185351-811d-45f9-8313-b65a2b4453c6,Lisa,Green,Mobile Developer,Caldwell Ltd,lisa.green@example.org,(403)595-5708,5697 Washington St,Bangalore,KA,560001,India,28,iterate end-to-end e-tailers,Concerned about data sovereignty and GDPR compliance in the EU region.,2025-08-18T07:53:44.261728,LRN512
fa090371-f024-4143-adb6-59fb23f77503,035ba2a4-2cb8-4888-b2f4-f73ea08fec57,Kevin,Cole,Cloud Architect,Bell-Henry,kevin.cole@example.net,5924690404,9324 Innovation Way,Austin,TX,73301,United States,86,monetize turn-key infrastructures,Encountered friction with the SSO setup; needs technical support.,2025-06-30T15:40:59.319471,LRN512
ab7f0764-4391-426f-94b6-719dafe75994,ef0d56b4-b94e-4990-9088-f48cfa9bd795,Kimberly,Duke,Database Administrator,Rios-Mills,kimberly.duke@example.com,+1-656-397-5837,1200 Washington St,Stockholm,Stockholm,111 22,Sweden,62,envisioneer synergistic eyeballs,Wants to know more about our machine learning model training capabilities.,2025-06-09T17:56:24.102379,LRN512
25e32eef-01f9-4f64-a4b0-906e5e3e4e2c,1d56d6ac-5095-4bd2-9e02-f1227c784160,Sheila,Petty,Site Reliability Engineer (SRE),"Hanson, Odonnell and Harrington",sheila.petty@example.com,305.599.4308,5468 Broadway,Denver,CO,80202,United States,96,engineer 24/7 web-readiness,Interested in migrating legacy systems to a microservices architecture.,2025-06-13T16:29:22.303600,LRN512
c844800d-ee0a-4770-98b9-679086cb11d8,2ea9b28a-cce6-4844-b7a4-ab0ca7698455,Michaela,Lee,Android Developer,Hansen Group,michaela.lee@example.com,(303)341-0522,9438 Broadway,Seattle,WA,98109,United States,76,monetize compelling action-items,Evaluating the feasibility of a multi-tenant architecture.,2025-02-15T23:32:51.910132,LRN512
48ec8d1f-254d-4617-8366-e6abe61e1e21,f2caf8a4-1f8f-4e04-bc25-f42bd32acaab,Angela,Patterson,UX/UI Designer,Parker Ltd,angela.patterson@example.net,+1-254-522-6651,7062 Tech Blvd,Melbourne,VIC,3000,Australia,91,seize extensible paradigms,Wants to integrate our widget into their React Native application.,2025-05-27T09:17:20.847657,LRN512
85c1373e-c089-4540-bc6b-410462fc4548,d733a143-9b2a-4a63-8679-e4e084247837,Martin,Taylor,Software Engineer,"King, Jones and Luna",martin.taylor@example.com,(643)202-4337x869,787 Main St,Los Angeles,CA,90001,United States,10,embrace enterprise solutions,Needs better documentation for the Python SDK.,2025-06-29T17:42:47.994574,LRN512
051eb888-6899-4e6c-99e8-74813535fb15,c2b5eee7-abbf-4e5b-ac80-9ad6dc48f59c,Frank,Watson,Backend Developer,Williamson-Benton,frank.watson@example.net,664.550.0782x12865,9234 Main St,Chicago,IL,60601,United States,53,synergize innovative communities,Interested in automated testing strategies for their mobile app.,2025-02-28T20:36:12.965254,LRN512
40a9400c-e1cf-41fe-916f-aefba945de0e,0161f43d-3fba-4c48-beae-5521788a056b,Nicole,Allen,Developer Advocate,Cantu-Henderson,nicole.allen@example.org,210-432-6407,6966 Tech Blvd,Guadalajara,JAL,44100,Mexico,90,aggregate dynamic interfaces,Looking to replace their current data warehouse with a more scalable solution.,2025-04-04T04:51:12.579020,LRN512
c307c5cd-c281-4319-955c-2d40db2d1c97,191bbc33-a906-45a4-b9cb-cd20d402c611,Timothy,Williams,Senior Software Engineer,Little and Sons,timothy.williams@example.net,2093422141,8435 Tech Blvd,San Francisco,CA,94105,United States,15,synthesize e-business applications,Wants to schedule a deep-dive demo of the new security features.,2025-03-11T07:01:47.802028,LRN512
f73daa3f-d2de-44cf-b949-0f1e3313b3fe,2d7a0f8e-0796-4309-9116-dbdc7064b242,Connor,Stewart,Data Engineer,"Benton, Castro and Hodge",connor.stewart@example.net,(889)869-9186,2505 Market St,Rio de Janeiro,RJ,20000-000,Brazil,16,integrate bricks-and-clicks infrastructures,Exploring options for edge computing and low-latency delivery.,2025-04-21T22:50:13.294163,LRN512
62eaf682-9948-42d2-9de1-a8c574113bce,ceaa00f6-f20c-4195-bea3-f71312005904,Leslie,Whitaker,DevOps Engineer,Conway Inc,leslie.whitaker@example.org,645-307-6976x11731,8545 Main St,Mexico City,CDMX,01000,Mexico,37,transition global portals,Discussed potential integration with their existing Kubernetes cluster.,2025-03-18T16:46:54.414845,LRN512
350301e7-e051-46dd-8544-06b0baa3dc81,479220e6-24c9-48fd-b59b-34c26e64fdb0,Corey,Gordon,Android Developer,Tate-Moore,corey.gordon@example.net,(830)534-8003x5183,7755 Oak St,Calgary,AB,T2P 1J9,Canada,44,leverage best-of-breed web services,Mentioned a need for real-time analytics and dashboarding.,2025-04-03T04:56:30.544655,LRN512
08e4f67d-6538-40d7-a228-3336b37d7322,29cebcf0-4996-42f4-9d6e-41eaa4678666,Jennifer,Ortiz,Developer Advocate,Garcia Group,jennifer.ortiz@example.net,3196713440,9183 Innovation Way,Ottawa,ON,K1P 1J1,Canada,24,iterate customized channels,Needs a solution for log aggregation and anomaly detection.,2025-06-23T01:37:14.580302,LRN512
54655516-0819-4e81-99a4-8cbff4d00ebd,075e1283-1a2a-4654-acef-5941dbd62b14,Robert,Clark,Android Developer,Miller Group,robert.clark@example.net,(632)760-7662x939,9354 Washington St,Miami,FL,33101,United States,57,drive extensible e-business,Wants to know more about our machine learning model training capabilities.,2025-07-31T06:33:47.948648,LRN512
c35ff871-7ec9-4f9b-886b-a5f8b806380b,3b0d5550-f4f5-4468-8081-6029794b0dda,Julie,Warner,Solutions Architect,Miranda Group,julie.warner@example.com,498.212.9397,7365 Washington St,Mumbai,MH,400001,India,10,orchestrate clicks-and-mortar content,Interested in automated testing strategies for their mobile app.,2025-05-01T08:52:45.285819,LRN512
6b45717d-410c-47ee-9911-858250e5013f,4cc3067d-84c3-41ce-b75e-1470b16419cf,Wendy,Freeman,Data Scientist,"Long, Wilson and Browning",wendy.freeman@example.com,+1-983-316-1010,2161 Broadway,Melbourne,VIC,3000,Australia,88,cultivate proactive methodologies,Interested in migrating legacy systems to a microservices architecture.,2025-08-23T02:12:52.958512,LRN512
c2c8560c-3295-45e6-9ae2-f70171057d71,df3aa194-5756-4f75-83ba-4380a6092f8b,Linda,Thompson,Product Manager,"Rogers, Sheppard and Lewis",linda.thompson@example.com,001-259-232-5276x8361,6158 Market St,Atlanta,GA,30303,United States,99,brand vertical niches,Mentioned a need for real-time analytics and dashboarding.,2025-07-29T00:17:28.232281,LRN512
2fc3da04-08df-47ba-af5d-2c03d20b00d8,cbf605e9-3982-4723-87d7-8af13d47eeeb,Mary,Roberts,Network Engineer,Reed-Johnson,mary.roberts@example.net,001-602-671-9623x48930,9884 Broadway,Melbourne,VIC,3000,Australia,59,matrix customized systems,Discussed potential integration with their existing Kubernetes cluster.,2025-08-17T07:08:50.330173,LRN512
3caac951-fb69-4c57-83c9-17a9e420bd74,b38dd899-0c55-4083-85d9-d5fb9a5edc9a,Eric,Taylor,Machine Learning Engineer,Garcia Inc,eric.taylor@example.com,(321)415-3803x934,3270 Market St,Ottawa,ON,K1P 1J1,Canada,74,deliver cross-platform initiatives,Excited about the roadmap for serverless function support.,2025-05-22T02:03:40.276672,LRN512
c7073422-7f2c-4596-9463-864b831f8116,85648451-4c49-4c3d-9041-e397a8a5895c,Amy,Pratt,Mobile Developer,"Taylor, Carr and Cooke",amy.pratt@example.org,001-478-941-4031x75330,1299 Main St,Ottawa,ON,K1P 1J1,Canada,46,syndicate intuitive niches,Concerned about data sovereignty and GDPR compliance in the EU region.,2025-08-14T11:11:33.716411,LRN512
12a30d19-546c-488e-b1f7-66e5451f9b70,138d1ddf-627c-4eef-babc-e9561bcdf915,Amy,Park,DevOps Engineer,Hardy-Lindsey,amy.park@example.net,(308)449-3685,7194 Oak St,Seattle,WA,98109,United States,28,synthesize one-to-one experiences,Wants to know more about our machine learning model training capabilities.,2025-07-03T13:38:07.207561,LRN512
0c735960-d67f-42e2-b5d7-37f83a080877,30bb46d2-6459-46ef-98b7-e146b446f3b5,Cory,Phillips,Backend Developer,Martinez-Spencer,cory.phillips@example.org,538.843.0653,6646 Broadway,São Paulo,SP,01000-000,Brazil,70,implement real-time synergies,Needs better documentation for the Python SDK.,2025-01-08T16:30:22.245959,LRN512
afdf4017-640b-4e45-af0b-7c7c03b10696,6fc8f60d-571a-428a-9a81-1d575f155fd7,Carmen,Martinez,DevOps Engineer,Johnson-Jordan,carmen.martinez@example.net,595-360-1932x87546,6942 Washington St,Monterrey,NL,64000,Mexico,90,incentivize 24/7 interfaces,Asked about our uptime SLAs and incident response times.,2025-07-10T05:38:36.101081,LRN512
55356ca6-d23b-47cb-bfd1-eb4a519f7da2,89a43313-d595-4dac-a2e4-0db9f2cfa55d,Veronica,Weber,Network Engineer,Scott-Ali,veronica.weber@example.org,+1-314-642-1437x069,2708 Washington St,Los Angeles,CA,90001,United States,79,benchmark wireless e-services,Asked detailed questions about our GraphQL API rate limits.,2025-07-09T10:53:45.460373,LRN512
9a4b74ec-fa5e-480b-85f6-871ee9d18bdf,7e3b9b36-4737-4513-8af4-f90b1d6b5303,Sandra,Wu,UX/UI Designer,"Merritt, Porter and Mason",sandra.wu@example.net,385-365-3972x1027,1204 Maple Ave,Chicago,IL,60601,United States,89,repurpose rich vortals,Discussed potential integration with their existing Kubernetes cluster.,2025-09-29T00:11:37.328991,LRN512
190742a3-2830-42bd-bce3-37a3239f4e25,633ff2a9-da94-49c9-b9ec-3f11824c105e,Jeremy,Williams,Solutions Architect,Watkins LLC,jeremy.williams@example.net,8127195085,2443 Tech Blvd,Los Angeles,CA,90001,United States,67,optimize B2B synergies,Wants to schedule a deep-dive demo of the new security features.,2025-02-20T05:45:47.723697,LRN512
154b49a4-2ae7-41ca-a6ed-48daa9bb3c7d,63b79075-300c-4cf8-8658-44abf2dbec7b,David,Graves,Test Automation Engineer,Rivera Inc,david.graves@example.net,(785)283-9010,9828 Tech Blvd,Denver,CO,80202,United States,10,incubate viral networks,Encountered friction with the SSO setup; needs technical support.,2025-02-12T23:39:28.410695,LRN512
3200de24-a6e7-41e6-b765-04d8371ff2a6,e47e2d7a-3cc6-474d-9acc-3ad7ddedfe8f,Ryan,Hernandez,Senior Software Engineer,"Hodge, Mcneil and Powers",ryan.hernandez@example.net,849.834.4358x90972,3215 Tech Blvd,Ottawa,ON,K1P 1J1,Canada,93,visualize open-source networks,Wants to schedule a deep-dive demo of the new security features.,2025-03-03T18:52:20.468732,LRN512
63daaa82-de21-4c5c-91da-a1d6fdda66ad,df949db2-4e1a-46d7-9dff-276c43d845d2,Chris,Thompson,Network Engineer,Clark-Turner,chris.thompson@example.org,554-330-7183x4086,4133 Maple Ave,Seattle,WA,98109,United States,43,disintermediate vertical ROI,Asked if we support Terraform providers for infrastructure as code.,2025-09-17T07:39:54.159594,LRN512
ce11460a-a337-409e-a5d8-d358c9a90b1d,e5b78cc3-f28f-4eaa-ba5c-878f5d2e0083,Dorothy,Johnston,Mobile Developer,Peterson-Bender,dorothy.johnston@example.net,(897)700-5555,4136 Main St,Chicago,IL,60601,United States,98,drive dot-com ROI,Asked detailed questions about our GraphQL API rate limits.,2025-08-16T08:01:57.515343,LRN512
ebfe4c45-15f0-44ec-85ed-d1f74ccbbf9d,114bd0a7-de0a-4b92-a5df-ee886e1d6c6d,Austin,Foley,Machine Learning Engineer,Kaufman-Parker,austin.foley@example.com,206.884.1327,243 Market St,San Francisco,CA,94105,United States,48,re-intermediate world-class niches,Concerned about data sovereignty and GDPR compliance in the EU region.,2025-01-27T22:10:42.864471,LRN512
b892a44c-b031-4a49-80cf-c2a9516203c2,b967ca76-a289-4bb2-aad8-907b02f5d85e,Ralph,Prince,Database Administrator,Romero Inc,ralph.prince@example.com,(888)566-7030x165,2490 Market St,Dublin,Dublin,D01,Ireland,42,whiteboard collaborative e-services,Asked if we support Terraform providers for infrastructure as code.,2025-07-24T04:57:04.539946,LRN512
1284f257-2c1f-4ba1-86ff-3e23b35d4ca7,fd7f28af-42a3-49fe-8077-62f3be61b1c2,Barbara,Brown,Frontend Developer,Jarvis LLC,barbara.brown@example.net,669-763-2402x587,1314 Innovation Way,Denver,CO,80202,United States,68,enable user-centric e-commerce,Discussed potential integration with their existing Kubernetes cluster.,2025-10-06T00:47:40.925768,LRN512
244e77a1-05ab-4c57-99b0-3762e9266fc2,4a3e4d01-d2d1-44c1-afe2-68fad91d7f07,Lorraine,Miller,UX/UI Designer,"Peterson, Luna and Mcguire",lorraine.miller@example.net,001-395-666-6559x00769,5164 Innovation Way,Toronto,ON,M5H 2N2,Canada,58,streamline bleeding-edge infrastructures,Wants to know more about our machine learning model training capabilities.,2025-09-29T17:28:16.635568,LRN512
