Scan ID,Attendee ID,First Name,Last Name,Title,Company,Email,Phone,Address,City,State,Postal Code,Country,Lead Score,Qualifiers,Notes,Timestamp,Session ID
f5b710b5-eda1-464b-a618-196958caf061,2cea2cbb-f5a7-48ae-94d8-23cf1f94f0d0,Robert,James,Security Engineer,"Cox, Soto and Johnson",robert.james@example.org,(857)277-2808,1526 Washington St,Boston,MA,02110,United States,26,enhance e-business users,Inquired about volume pricing for high-throughput data streaming.,2025-08-07T02:18:44.457242,CUSLT-335
589bbb50-2d36-423d-921c-d74d1f7cbd27,ab581bed-dda2-4bb2-89fa-a7b860713f3c,Matthew,Smith,Technical Writer,Williams-Watson,matthew.smith@example.org,+1-694-808-8661x2309,2062 Broadway,Osaka,Osaka,530-0001,Japan,39,enhance extensible portals,Interested in automated testing strategies for their mobile app.,2025-03-24T12:10:50.157305,CUSLT-335
6eb2f485-f705-4977-ae80-c9751e969713,41ded0e0-1b07-40d6-abd2-9d6481baa653,Mallory,Martin,Developer Advocate,"Allen, Chan and Stout",mallory.martin@example.org,+1-283-738-1009x64628,3694 Washington St,Rio de Janeiro,RJ,20000-000,Brazil,37,target innovative partnerships,Looking for a partner to help with a large-scale cloud migration.,2025-01-23T03:54:25.476865,CUSLT-335
385d0e8b-3fc4-4d9c-bb6b-5b83f5d5ffbf,1baaf51b-87e9-4712-bb82-9941af23e877,David,Baker,Solutions Architect,"Collins, Reyes and Lee",david.baker@example.net,672.820.9029x03225,6560 Maple Ave,Guadalajara,JAL,44100,Mexico,41,redefine sticky channels,Wants to schedule a deep-dive demo of the new security features.,2025-06-21T00:09:49.230122,CUSLT-335
3d95c42a-027b-4a7d-b8a0-cd6e92c71d9c,85a65fd3-e70d-40bc-9ccb-c84effb069f7,Karen,Morris,Mobile Developer,"Perez, Decker and Collins",karen.morris@example.net,262-406-0004,8280 Broadway,London,England,SW1A 1AA,United Kingdom,74,incubate user-centric infrastructures,Interested in migrating legacy systems to a microservices architecture.,2025-08-18T09:09:32.961449,CUSLT-335
7ef87262-46da-421f-82d2-b4c491a2172d,2ab562f1-5eb5-4268-bc1c-cc3940624862,Eric,Pierce,Database Administrator,"White, Boyd and Brown",eric.pierce@example.org,(559)819-4606,5013 Market St,Atlanta,GA,30303,United States,100,benchmark end-to-end portals,Suffering from database locking issues; looking for advice.,2025-03-04T03:43:41.119481,CUSLT-335
18cf7891-6c74-429d-8fd1-f8e93e10a85b,12b5975c-7b9a-4247-a8bd-c5a3d8c2994c,Leslie,Fisher,CTO,Elliott-Boyd,leslie.fisher@example.net,993-625-4361x19838,1578 Main St,Boston,MA,02110,United States,1,facilitate cutting-edge portals,Evaluating our platform against AWS and Azure alternatives.,2025-06-21T13:07:10.505133,CUSLT-335
f72b6247-ac7e-4021-a075-e4b0920d7df0,d18bdab4-7d82-4663-991c-8bda22ad709f,Ashley,Payne,Data Scientist,Vaughn-Horton,ashley.payne@example.org,7829387957,8657 Washington St,San Francisco,CA,94105,United States,99,deploy intuitive systems,Encountered friction with the SSO setup; needs technical support.,2025-09-07T02:19:06.075288,CUSLT-335
8ab8dc76-bd73-4b8e-8038-0352a0c90c35,55c10c50-350b-4e53-a6b2-5744a94eb385,Alexander,Luna,Data Scientist,"Williams, Price and Mcclain",alexander.luna@example.org,5755484821,1554 Tech Blvd,Miami,FL,33101,United States,38,revolutionize B2C metrics,Encountered friction with the SSO setup; needs technical support.,2025-10-04T18:30:03.516860,CUSLT-335
d41254f6-61a9-4e9c-a179-52ac41985e01,70585e77-81ee-46a1-bb13-80a443f78237,Jenny,Lopez,Full Stack Developer,Reynolds Group,jenny.lopez@example.net,+1-611-413-3284x44928,1705 Washington St,Calgary,AB,T2P 1J9,Canada,19,architect one-to-one initiatives,Exploring options for edge computing and low-latency delivery.,2025-04-01T03:59:51.019754,CUSLT-335
7bff290b-0bc1-40bc-8eca-4a3a9dfd8619,eeb07517-bb2f-41eb-a7cb-ba5c1b916bab,Melissa,Sosa,iOS Developer,Hodge PLC,melissa.sosa@example.org,950-753-9260x25849,843 Tech Blvd,New York,NY,10001,United States,76,aggregate wireless mindshare,Interested in migrating legacy systems to a microservices architecture.,2025-04-09T11:49:22.364386,CUSLT-335
7ff9abae-db8e-45a7-8b97-27fd8235ab06,95608d13-bbe1-4c57-b5ca-1def7fcf0fc5,Dennis,Navarro,Solutions Architect,"Moreno, Brady and Rosario",dennis.navarro@example.org,499.754.4937,7168 Maple Ave,Atlanta,GA,30303,United States,58,iterate visionary e-business,Looking to replace their current data warehouse with a more scalable solution.,2025-09-16T06:17:36.517706,CUSLT-335
d72dd6b4-3a16-4bec-afad-1569b039701d,aaec6fe5-bc50-4fde-890e-7d455e150ea7,Charles,Stuart,AI Researcher,Greer Ltd,charles.stuart@example.com,001-588-341-8078x381,2807 Market St,Toronto,ON,M5H 2N2,Canada,8,revolutionize proactive web services,Wants to know more about our machine learning model training capabilities.,2025-01-29T07:42:29.682789,CUSLT-335
af0e6183-56ab-4fec-b261-c3a49abc44f5,2951917b-28d4-4b48-af56-b239ab362cc0,Annette,Simmons,Test Automation Engineer,"Harrell, Robinson and Stephens",annette.simmons@example.com,001-223-846-3324x072,5105 Broadway,Atlanta,GA,30303,United States,27,aggregate next-generation e-markets,Evaluating the feasibility of a multi-tenant architecture.,2025-08-02T10:58:35.775314,CUSLT-335
0cb2bb33-fdab-43b6-a3db-fca231b40987,ca0cf954-5b3f-4917-9a89-95c071b32b33,Joshua,Wood,Systems Administrator,Mccormick and Sons,joshua.wood@example.com,(323)519-0948,9960 Tech Blvd,Berlin,Berlin,10115,Germany,100,incentivize enterprise initiatives,Wants to schedule a deep-dive demo of the new security features.,2025-02-01T23:44:59.654906,CUSLT-335
cac3096b-e53c-4005-87dd-03caba692a71,47136fd6-785b-4605-851a-cb94aeffab28,Steven,Hall,Cybersecurity Analyst,"Thompson, Dalton and Edwards",steven.hall@example.org,(229)373-9541x019,4303 Maple Ave,Chicago,IL,60601,United States,31,streamline synergistic solutions,Asked detailed questions about our GraphQL API rate limits.,2025-02-07T03:03:23.010635,CUSLT-335
283bec5f-3bb5-4f3b-8e54-8f2ad17a9aef,602d935e-1e20-486b-b2e0-ee9308757fb1,Charles,Mcdonald,Solutions Architect,"Reynolds, Jones and Cabrera",charles.mcdonald@example.com,235-377-3992x8757,4899 Maple Ave,Miami,FL,33101,United States,6,reinvent magnetic web services,Encountered friction with the SSO setup; needs technical support.,2025-06-14T10:22:52.924964,CUSLT-335
824c0a72-0457-4cc2-bc82-21542b794818,c17167c3-63bb-494a-aef8-5e6fa4376373,Michael,Edwards,Cybersecurity Analyst,"Chambers, Wagner and Jefferson",michael.edwards@example.com,655.216.6522x983,4139 Washington St,Los Angeles,CA,90001,United States,57,productize dynamic portals,Looking to replace their current data warehouse with a more scalable solution.,2025-07-21T13:38:03.513324,CUSLT-335
bc754236-ea14-4b9a-882a-97f74ac21a1a,1ceb996c-696b-4b8b-866f-f697d9afbb60,Darlene,White,Engineering Manager,Ramos and Sons,darlene.white@example.net,540.570.9410,7471 Oak St,Miami,FL,33101,United States,65,envisioneer impactful functionalities,Discussed the benefits of Rust over C++ for their new engine.,2025-05-14T12:50:56.662252,CUSLT-335
204494bf-db3c-44d0-8ced-cc47cef87609,e6720e4a-18d1-4151-afdf-5f6065a490dd,Danny,Mills,QA Engineer,Chambers-Jones,danny.mills@example.com,(490)375-2435,5819 Innovation Way,San Francisco,CA,94105,United States,51,integrate best-of-breed convergence,Concerned about data sovereignty and GDPR compliance in the EU region.,2025-06-30T08:54:14.123837,CUSLT-335
e22fe22a-eb72-4386-b8c5-e0be1c20d09e,4645c706-51b7-49dc-b50e-543ad5051bca,Crystal,Welch,DevOps Engineer,"Willis, Pugh and Holden",crystal.welch@example.com,001-238-251-7571x486,7311 Oak St,Miami,FL,33101,United States,71,enhance 24/365 mindshare,Concerned about data sovereignty and GDPR compliance in the EU region.,2025-05-10T12:57:34.360898,CUSLT-335
4b1d4407-9825-4729-9316-84b467b510e8,3453246b-60f3-4093-96a6-9535c564ceaa,Jesus,Henderson,Software Engineer,Day PLC,jesus.henderson@example.com,001-423-399-1169x8001,6777 Broadway,Vancouver,BC,V6B 1P1,Canada,73,grow vertical applications,Looking for a partner to help with a large-scale cloud migration.,2025-09-15T05:06:32.604712,CUSLT-335
9bf7cf9e-1e59-4055-9ea0-1c5462e2b463,69082b88-99f0-4cfb-9ad4-05369c237216,Robert,Flores,Frontend Developer,"Wagner, Smith and Hensley",robert.flores@example.org,647-947-0231x9276,8558 Oak St,Paris,Île-de-France,75001,France,29,enable collaborative ROI,Concerned about data sovereignty and GDPR compliance in the EU region.,2025-02-13T13:49:14.595736,CUSLT-335
5e92e27d-0e1d-4614-a20c-0787b6ec8f19,03dc04c7-a7a6-409d-bea3-4444db99c0ba,Christopher,Perry,Developer Advocate,"Cortez, Vasquez and Coleman",christopher.perry@example.com,001-748-442-9660x17528,5067 Oak St,Miami,FL,33101,United States,96,expedite front-end infrastructures,Inquired about volume pricing for high-throughput data streaming.,2025-09-26T06:38:49.838246,CUSLT-335
bfbe8dc2-af11-4cbe-abb7-6631ea3a0072,0cc40b01-a387-499b-9977-59fe793f4b17,Willie,Hooper,QA Engineer,"Owens, Hale and Wilson",willie.hooper@example.net,+1-563-358-7989x20071,9936 Main St,Miami,FL,33101,United States,36,productize end-to-end applications,Discussed the benefits of Rust over C++ for their new engine.,2025-05-26T09:27:49.151693,CUSLT-335
e2c2517b-0944-4824-9b4e-55d2bd8d7934,89ff97e3-9a87-4bbe-b0fb-878d5dd5c9ee,Denise,Hayes,Site Reliability Engineer (SRE),"Martinez, Brown and Jackson",denise.hayes@example.org,(335)290-0812,8270 Market St,Melbourne,VIC,3000,Australia,82,syndicate holistic e-business,Inquired about volume pricing for high-throughput data streaming.,2025-06-02T07:20:34.356228,CUSLT-335
e772f9d5-65bc-4bf7-a13a-f8365ff7c51c,e5821a4d-cae1-4609-a931-43d8dbb6454a,Amanda,Johnson,Frontend Developer,Wolfe LLC,amanda.johnson@example.net,001-861-404-1503x356,5040 Maple Ave,Atlanta,GA,30303,United States,78,deliver magnetic mindshare,Evaluating our platform against AWS and Azure alternatives.,2025-08-07T10:09:18.948548,CUSLT-335
05ebac0d-b7b5-42f8-9ab7-0d83c6387bac,b71f9ebe-e184-4c1c-889c-b04b992f208e,Lisa,Wong,Technical Product Manager,"Lopez, Larson and Campbell",lisa.wong@example.org,7966093294,6540 Main St,Toronto,ON,M5H 2N2,Canada,83,deploy distributed networks,Needs a solution for log aggregation and anomaly detection.,2025-04-26T06:23:04.847372,CUSLT-335
a4c481f6-95cb-47b6-a4f0-d259f395d031,02d08202-1bf0-4495-a8ff-5914bceee4ae,Diana,Martin,Developer Advocate,Russell-Baker,diana.martin@example.com,726.918.7772,9097 Tech Blvd,Los Angeles,CA,90001,United States,79,harness one-to-one technologies,Excited about the roadmap for serverless function support.,2025-05-24T12:35:15.296513,CUSLT-335
8cedfd08-fcd2-447d-b239-aa03fa96ca67,1b005818-b532-4b01-bbf3-b18d17b5b488,Carl,Bell,Senior Software Engineer,Jones-Rose,carl.bell@example.org,754-806-1667x8339,8272 Tech Blvd,London,England,SW1A 1AA,United Kingdom,50,target magnetic ROI,Needs a solution for log aggregation and anomaly detection.,2025-01-25T17:14:01.825863,CUSLT-335
30d56968-9c75-4748-a1f2-1ced6975cc61,67041ced-2241-4d73-a666-2551d31666b6,Wendy,Johnson,Network Engineer,Mckinney and Sons,wendy.johnson@example.com,704.583.5859x4563,2083 Washington St,San Francisco,CA,94105,United States,22,whiteboard mission-critical experiences,Looking to replace their current data warehouse with a more scalable solution.,2025-05-06T13:25:46.959343,CUSLT-335
c32c5e03-c84e-46ca-8a6b-62d75f086d61,853d7095-8e49-47a8-8301-da68f3f9bac3,Jonathan,Johnson,Security Engineer,Chapman-Alexander,jonathan.johnson@example.net,+1-581-779-7435x117,216 Main St,Miami,FL,33101,United States,85,streamline integrated portals,Looking for a partner to help with a large-scale cloud migration.,2025-08-15T06:49:01.033859,CUSLT-335
825587b3-d1bb-46eb-9c1e-9b748a31a451,d37b7e17-ef3e-4524-a415-d03da44b921c,Judith,Scott,Mobile Developer,"Shaw, Simmons and Mcbride",judith.scott@example.com,+1-921-215-9035,9256 Oak St,Ottawa,ON,K1P 1J1,Canada,17,implement efficient niches,Evaluating the feasibility of a multi-tenant architecture.,2025-06-04T14:13:18.752143,CUSLT-335
ccedb5d4-9e0c-4ba4-b6d5-1425ccc6750d,583630b9-e79b-4685-bfb1-7b68ec0de51b,Christian,Cooper,Machine Learning Engineer,Kim-Kaiser,christian.cooper@example.org,853.951.7120x88425,2937 Broadway,New York,NY,10001,United States,41,harness front-end functionalities,Wants to know more about our machine learning model training capabilities.,2025-01-15T23:00:26.671412,CUSLT-335
1fe366d4-3945-4d5d-8d8b-c0672d96ef5a,e6d0e846-b0fe-4160-8c10-542e82b650f4,Tyler,Mosley,Network Engineer,Love LLC,tyler.mosley@example.com,274.272.0611x1294,7816 Washington St,Munich,Bavaria,80331,Germany,88,synthesize bleeding-edge vortals,Wants to schedule a deep-dive demo of the new security features.,2025-03-31T17:24:45.362106,CUSLT-335
7486f8bd-5051-466b-8c9f-b7e80ae3d568,38ad1714-5d6f-4ada-96ce-c2e91b1994e2,Janet,Carson,Developer Advocate,Thomas LLC,janet.carson@example.com,8926416184,2685 Washington St,Chicago,IL,60601,United States,10,e-enable customized metrics,Excited about the roadmap for serverless function support.,2025-05-21T03:52:56.662238,CUSLT-335
2f88f31c-caf2-455b-9ae5-e5be1e8d5e3c,1446a3a0-c41a-4c4f-aab9-5ef449da0b19,Donna,Flores,VP of Engineering,"Fitzgerald, Hardy and Morales",donna.flores@example.net,5749702522,9905 Oak St,Austin,TX,73301,United States,76,re-intermediate customized models,Asked about our uptime SLAs and incident response times.,2025-01-25T02:21:59.040288,CUSLT-335
81a76334-74a6-4908-9911-d641bcda869e,80031f1f-909c-4d74-a0bd-b56f05b4b6c4,Leslie,Simmons,Frontend Developer,"Shepard, Padilla and Martinez",leslie.simmons@example.org,+1-848-318-4370x9303,9210 Oak St,San Francisco,CA,94105,United States,35,synergize customized bandwidth,Concerned about data sovereignty and GDPR compliance in the EU region.,2025-08-23T04:18:37.566693,CUSLT-335
a70cd585-7759-4b09-93b8-f8753a1760a8,ef83847f-e93a-45bf-943a-4b57d21c6271,Sara,Young,AI Researcher,Barajas-Everett,sara.young@example.net,(399)816-1767,2606 Main St,Miami,FL,33101,United States,29,disintermediate mission-critical niches,Interested in migrating legacy systems to a microservices architecture.,2025-04-04T00:10:26.255818,CUSLT-335
78447e52-93cb-4d64-99e1-ee5672f88e1e,93e4daff-f43c-4e74-9692-7684ee386355,Emily,Proctor,Machine Learning Engineer,Harvey LLC,emily.proctor@example.net,+1-228-443-5880,459 Market St,Austin,TX,73301,United States,57,incubate dot-com methodologies,Excited about the roadmap for serverless function support.,2025-08-23T11:45:37.518959,CUSLT-335
cedd5aa1-76e2-4995-b2ac-1c9eca794284,dbb69195-6210-47f6-b385-f9697f4beb51,Cody,Wilson,Systems Administrator,White and Sons,cody.wilson@example.net,(632)303-2073x387,9615 Washington St,Atlanta,GA,30303,United States,20,morph sticky partnerships,Wants to know more about our machine learning model training capabilities.,2025-01-17T23:49:53.391726,CUSLT-335
b6d743d3-d06a-4ac7-9de8-f55137a0b6c8,f11f1a8c-0a8c-450d-b729-84c1533bd91e,Danielle,Mcdonald,Cybersecurity Analyst,Cook Inc,danielle.mcdonald@example.org,466-305-7402,1805 Main St,Shanghai,Shanghai,200000,China,4,re-intermediate mission-critical architectures,Concerned about data sovereignty and GDPR compliance in the EU region.,2025-08-18T14:12:51.281169,CUSLT-335
0cb52c04-4c10-4b72-95ab-8f179e62fb69,e91e0145-d516-456f-aa31-ae93be1a14a7,Nathan,Morris,Developer Advocate,Sanders-Wells,nathan.morris@example.net,755-215-3317,5872 Tech Blvd,Lyon,Auvergne-Rhône-Alpes,69001,France,91,incubate vertical deliverables,Looking for a solution to optimize their CI/CD pipeline latency.,2025-09-11T11:05:03.261467,CUSLT-335
a32604b2-bdb1-4368-a6b9-fd159dcccaf8,8f1e5273-9159-43dd-a508-0db86bba968a,Tammy,Snyder,CTO,Hernandez Inc,tammy.snyder@example.org,(462)836-8688x534,8337 Market St,New York,NY,10001,United States,14,innovate mission-critical e-services,Wants to integrate our widget into their React Native application.,2025-01-11T19:30:05.910471,CUSLT-335
b84633b6-9cbd-4fe8-88cc-fc3b420a7880,af26c9e1-c0a6-4fe9-983c-33aff2d7d443,Brooke,Wall,Data Scientist,"Murphy, Peterson and Richards",brooke.wall@example.net,972.412.5570x340,6793 Main St,Denver,CO,80202,United States,96,brand intuitive experiences,Looking to replace their current data warehouse with a more scalable solution.,2025-01-27T16:46:23.482641,CUSLT-335
61b764cd-69aa-40d9-b863-37b5959cff60,321015b9-668e-45f5-ba44-7bc7ff58ce31,Stephen,Dominguez,Database Administrator,Martinez-Rivera,stephen.dominguez@example.net,(267)440-1169x35029,8431 Broadway,Atlanta,GA,30303,United States,98,incentivize 24/7 e-business,Wants to integrate our widget into their React Native application.,2025-06-18T15:48:37.863143,CUSLT-335
cbcd56f0-99d4-4553-a8a1-7daaef3f79f9,4469f832-3521-4f2e-817a-2763e34eb442,Mark,Thomas,Systems Administrator,"Ramirez, Young and Waller",mark.thomas@example.com,001-994-711-3579x030,8485 Innovation Way,Atlanta,GA,30303,United States,26,whiteboard compelling technologies,Wants to schedule a deep-dive demo of the new security features.,2025-04-29T09:48:11.416856,CUSLT-335
be5c8e86-5686-4e1e-b782-98906c6700d9,24fbf17f-4d2f-40c8-b538-e9de50c25314,Katie,Garcia,Data Engineer,Marquez-Diaz,katie.garcia@example.net,586.764.9912,7606 Maple Ave,Calgary,AB,T2P 1J9,Canada,63,harness plug-and-play synergies,Evaluating our platform against AWS and Azure alternatives.,2025-08-28T22:50:19.777586,CUSLT-335
8b998be5-c0ed-41f8-902a-f2d4bdb4a33d,2f8db7d8-6660-4280-8557-db2f36db829e,Jesse,Baird,iOS Developer,"White, Johnson and Graves",jesse.baird@example.net,9303768763,4393 Tech Blvd,San Francisco,CA,94105,United States,57,aggregate integrated synergies,Looking to replace their current data warehouse with a more scalable solution.,2025-05-11T11:39:25.547084,CUSLT-335
6984b8f5-457b-4415-add7-2c8c161caec1,14eee810-eb51-473a-9b24-335bec412403,Christine,Bell,Mobile Developer,Mccoy-Steele,christine.bell@example.com,653.823.0076x06732,9125 Main St,London,England,SW1A 1AA,United Kingdom,88,architect B2C models,Excited about the roadmap for serverless function support.,2025-08-20T01:45:58.306044,CUSLT-335
6196f0fb-9ef9-496b-ab65-7638641ea2d2,2e824bb7-c3f3-4add-8ade-2054cc07ab9b,Robert,Shannon,Senior Software Engineer,Adams-Green,robert.shannon@example.com,675-215-6562,3462 Innovation Way,Los Angeles,CA,90001,United States,94,architect value-added networks,Asked detailed questions about our GraphQL API rate limits.,2025-08-12T09:32:47.054040,CUSLT-335
4684212e-e576-41d9-bf27-a3d4b7a86e59,bc340544-da98-43dc-b9e1-77ec6766bff6,Stephanie,Davis,Developer Advocate,"Vaughn, House and Lee",stephanie.davis@example.com,740-616-7011x59606,6823 Market St,Austin,TX,73301,United States,78,streamline transparent networks,Looking to replace their current data warehouse with a more scalable solution.,2025-06-09T19:00:54.134319,CUSLT-335
b15747f4-22b4-4660-b7b5-63b8ff0cea9f,953117ae-b0d2-4019-a1f8-b6cc2c05fddc,Sara,Thomas,Test Automation Engineer,Taylor-Estrada,sara.thomas@example.org,001-765-226-6102,1472 Maple Ave,Shanghai,Shanghai,200000,China,50,orchestrate wireless experiences,Interested in migrating legacy systems to a microservices architecture.,2025-04-25T09:22:34.343066,CUSLT-335
ed0a5175-138d-4b32-b914-7e822d93acab,37f328b0-f513-4c7c-85a9-c5d490a401eb,Thomas,Jennings,Data Scientist,Shepherd Group,thomas.jennings@example.net,806-810-6508,8873 Market St,Shanghai,Shanghai,200000,China,12,empower e-business action-items,Mentioned a need for real-time analytics and dashboarding.,2025-04-09T02:36:50.805327,CUSLT-335
505a3bae-ac8e-4004-9db6-1c3915ca59b6,bfe48f58-f37d-49bf-8d82-970b7ed45586,Lisa,Smith,Machine Learning Engineer,Rowe Group,lisa.smith@example.org,7769576687,477 Main St,Austin,TX,73301,United States,78,strategize real-time niches,Mentioned a need for real-time analytics and dashboarding.,2025-03-11T17:48:30.029055,CUSLT-335
eda21065-ff99-4970-83ce-54964aa9394c,9d2b40d0-46b3-4cb4-a192-7e80c6b7fbcb,Thomas,Thompson,Cloud Architect,"Thompson, Murray and Peck",thomas.thompson@example.org,(599)664-9977,6090 Main St,New York,NY,10001,United States,87,orchestrate out-of-the-box web-readiness,Wants to integrate our widget into their React Native application.,2025-04-26T18:27:52.834405,CUSLT-335
3af2c5ae-5f9f-4891-ac73-8f74a35e34c7,3105894d-1279-4c7a-b2a3-6e3c3f4f1598,Lisa,Johnson,Backend Developer,Hubbard-Nolan,lisa.johnson@example.org,001-737-356-6786x1580,7400 Broadway,Montreal,QC,H3B 1A7,Canada,25,engineer 24/7 architectures,Mentioned a need for real-time analytics and dashboarding.,2025-07-09T19:43:24.210201,CUSLT-335
02921c7b-1933-463f-892b-c0107a8820f6,df5c14c7-efa4-4fbf-ab09-e2a81090ef20,Kevin,Herrera,DevOps Engineer,Stephens-Cook,kevin.herrera@example.org,4662435942,3564 Market St,Montreal,QC,H3B 1A7,Canada,52,enable scalable portals,Asked about our uptime SLAs and incident response times.,2025-05-08T04:17:03.304766,CUSLT-335
9d33b3b0-aef0-4499-b1a3-9c477013a9ab,2fee082d-1ac8-427a-956a-a969ded007d4,Kimberly,Summers,Data Engineer,Miller-Harris,kimberly.summers@example.com,7015625704,6572 Tech Blvd,Vancouver,BC,V6B 1P1,Canada,83,integrate dot-com systems,Asked if we support Terraform providers for infrastructure as code.,2025-09-09T11:40:52.813232,CUSLT-335
9ee16fab-df2b-4f81-aa07-e5ce6252c45c,f6bbe5e5-0ae1-4fd8-b8b6-9bd4175a4d71,Jacqueline,Holder,DevOps Engineer,Luna-Garcia,jacqueline.holder@example.com,831.214.3030,2519 Tech Blvd,Los Angeles,CA,90001,United States,21,re-intermediate virtual architectures,Wants to integrate our widget into their React Native application.,2025-01-24T10:40:23.553052,CUSLT-335
b2fb3ab1-6ec7-4ede-b230-57db0bfda00b,bb5fa994-375d-4e92-818c-f8380a645017,Joshua,Thomas,Mobile Developer,"Smith, Munoz and Ramos",joshua.thomas@example.org,001-222-240-5710,9024 Innovation Way,Munich,Bavaria,80331,Germany,29,expedite proactive networks,Needs better documentation for the Python SDK.,2025-06-07T02:57:44.048165,CUSLT-335
8e5d8cd6-c7ed-4d43-ae62-4603b90a6942,05a41bf2-2cad-4759-8178-362db167e71d,Brittany,Johnson,Network Engineer,Wilson PLC,brittany.johnson@example.org,001-583-342-6214x8645,4822 Market St,Austin,TX,73301,United States,4,implement transparent interfaces,Evaluating our platform against AWS and Azure alternatives.,2025-01-25T22:02:36.768318,CUSLT-335
b5631c5a-d90e-46be-9dc9-44343731bd0b,71d53794-f21a-43af-af0a-8015c3f90bad,Angela,Chen,Database Administrator,Castillo Group,angela.chen@example.org,221.399.9555,9374 Tech Blvd,Seattle,WA,98109,United States,86,extend B2C networks,Needs better documentation for the Python SDK.,2025-03-21T17:41:41.075939,CUSLT-335
81002437-fbc5-4d41-948f-e31d0c732a17,8027be2d-ebfa-402c-892c-5b0b8462a36d,Joshua,Mcdowell,Data Scientist,"Smith, Horn and Rogers",joshua.mcdowell@example.org,+1-309-597-6623x49532,8401 Tech Blvd,Amsterdam,NH,1012,Netherlands,53,productize B2C schemas,Asked if we support Terraform providers for infrastructure as code.,2025-04-10T03:00:48.643186,CUSLT-335
8a59e220-a2de-4005-b867-184f39f8f5a0,1286a78e-eacf-4e6d-acf7-7448706c939a,Peggy,Bradford,Site Reliability Engineer (SRE),"Castro, Quinn and Evans",peggy.bradford@example.org,511-493-8100,5813 Broadway,Denver,CO,80202,United States,60,exploit efficient technologies,Curious about our websocket support for real-time chat.,2025-05-30T03:07:49.449800,CUSLT-335
c815dc12-0bfd-4b65-ab86-1de6e5497e24,9e070be0-2e74-46b0-89be-8588837239e2,Jill,White,iOS Developer,"Larson, Hughes and Heath",jill.white@example.org,+1-352-209-0444,133 Maple Ave,Toronto,ON,M5H 2N2,Canada,15,embrace cross-media vortals,Encountered friction with the SSO setup; needs technical support.,2025-03-19T10:41:18.791543,CUSLT-335
74e62647-9daf-4476-ae18-8709932ce763,5c00e1c2-8cc5-4a88-b814-246aa46790c3,April,Holt,QA Engineer,Wheeler Group,april.holt@example.com,661.439.6669x3199,9822 Washington St,Chicago,IL,60601,United States,3,grow clicks-and-mortar ROI,Evaluating our platform against AWS and Azure alternatives.,2025-06-12T19:23:28.832793,CUSLT-335
