Scan ID,Attendee ID,First Name,Last Name,Title,Company,Email,Phone,Address,City,State,Postal Code,Country,Lead Score,Qualifiers,Notes,Timestamp,Session ID
c5ba5052-3286-4104-9ce0-9af967a8c644,b4f51fdc-c9df-4316-bba0-a0ffef595c79,Haley,Robbins,Database Administrator,"Pacheco, Gaines and Cole",haley.robbins@example.com,(411)732-1717x33315,2798 Maple Ave,Los Angeles,CA,90001,United States,60,utilize compelling networks,Mentioned a need for real-time analytics and dashboarding.,2025-01-31T21:27:43.343951,LRN314
ab97b3e4-279a-47ef-8204-d9a6c9d9adc5,2f82137d-d442-4a0e-9ad4-2abbde9a159a,Michael,Brooks,VP of Engineering,Velasquez LLC,michael.brooks@example.org,599-342-1516x0358,9741 Market St,Monterrey,NL,64000,Mexico,87,generate sticky initiatives,Asked if we support Terraform providers for infrastructure as code.,2025-01-07T00:43:12.497339,LRN314
eefb336e-c954-4bce-9365-890baff6b0df,0f2cfd68-e4db-470d-8006-a15b4bd5b9b7,Reginald,Arnold,Mobile Developer,"Middleton, Harris and Hunt",reginald.arnold@example.net,374-962-6564x98814,927 Innovation Way,Bangalore,KA,560001,India,96,exploit plug-and-play e-markets,Asked about our uptime SLAs and incident response times.,2025-01-31T01:07:47.952607,LRN314
fb6760c7-2037-4c21-86df-3410567ac467,527cc56e-c0fa-4904-b395-849e610e2320,Jacob,Warren,iOS Developer,Cole Group,jacob.warren@example.net,373.693.1857x60900,2262 Broadway,Ottawa,ON,K1P 1J1,Canada,42,architect rich portals,Needs better documentation for the Python SDK.,2025-05-21T08:50:22.528513,LRN314
b38913ce-d406-49a5-8c58-2434761deded,aa82edfd-7871-4d1c-9dcd-650fe56597ca,Tina,Smith,Engineering Manager,"Webster, Lam and Townsend",tina.smith@example.net,001-552-889-2021x022,7290 Main St,Shanghai,Shanghai,200000,China,65,embrace global functionalities,Looking for a partner to help with a large-scale cloud migration.,2025-02-06T10:27:44.109243,LRN314
7d5121ac-5ad6-4cd7-b71f-8fb81c5f03b3,5f19001a-3dcd-4d5a-a409-e40328b084b6,Monica,Graham,Full Stack Developer,Navarro-Mann,monica.graham@example.com,(318)943-9622,5772 Market St,Mexico City,CDMX,01000,Mexico,41,extend user-centric communities,Looking for a solution to optimize their CI/CD pipeline latency.,2025-03-05T10:55:29.384401,LRN314
8aa4ce4a-51ae-4813-bfee-eeb3af02c149,3255684b-1781-42ea-93e8-d678dd2e5041,Heather,Hopkins,Product Manager,Miller-Simmons,heather.hopkins@example.net,2508101945,1831 Main St,Toronto,ON,M5H 2N2,Canada,10,repurpose collaborative experiences,Inquired about volume pricing for high-throughput data streaming.,2025-01-07T23:44:48.269506,LRN314
d8320e39-e84e-4fd8-899b-18d4a94e9813,33843a79-6c71-4863-aad1-0f1445b500a5,Mike,Phillips,Frontend Developer,Anderson LLC,mike.phillips@example.org,7863389326,3517 Maple Ave,Paris,Île-de-France,75001,France,80,drive e-business web services,Interested in automated testing strategies for their mobile app.,2025-03-14T08:31:05.178993,LRN314
2ccb33da-f2fd-4b55-8470-7c2a3f6bd16b,1e094fd2-3c9e-4e58-bf39-e145c8b1767c,Danielle,Mosley,Full Stack Developer,"Evans, Jackson and Gilbert",danielle.mosley@example.com,+1-301-370-9966x50425,3386 Tech Blvd,New York,NY,10001,United States,59,e-enable granular initiatives,Wants to know more about our machine learning model training capabilities.,2025-05-31T06:01:16.608185,LRN314
014480ef-a5de-495b-b473-b880d5b523f3,7c5e1627-7da9-411e-9e91-bf8a1a37e854,Jose,Allen,Product Manager,Robinson-Daugherty,jose.allen@example.com,672-835-6359,2348 Broadway,Calgary,AB,T2P 1J9,Canada,99,disintermediate compelling partnerships,Encountered friction with the SSO setup; needs technical support.,2025-07-31T13:18:11.933548,LRN314
005974ef-a1bd-40ec-8de4-9b2da9f3f2c8,1fac0887-a59e-483c-aa71-874ee9d2f2e2,Mary,Martinez,iOS Developer,Reeves PLC,mary.martinez@example.net,001-567-509-3454,8630 Innovation Way,Austin,TX,73301,United States,95,streamline web-enabled action-items,Inquired about volume pricing for high-throughput data streaming.,2025-05-13T13:44:37.009486,LRN314
64210099-e46e-47a2-b64b-64aaff4a9bc1,a989bec6-8ac4-4530-8b1b-9dfb5f4bae3e,Patrick,Nelson,Solutions Architect,"Jones, Oconnor and Schaefer",patrick.nelson@example.com,(936)562-0986x49126,3015 Broadway,New York,NY,10001,United States,61,implement collaborative e-services,Wants to schedule a deep-dive demo of the new security features.,2025-08-28T12:56:00.224223,LRN314
19906573-355b-4703-8429-ac6af1fefac0,073af358-f258-4931-bf85-fd994433988f,John,Jones,Network Engineer,Barnes-Ross,john.jones@example.net,626.935.8128x56617,333 Main St,Chicago,IL,60601,United States,22,envisioneer proactive niches,Interested in automated testing strategies for their mobile app.,2025-08-04T17:04:48.316412,LRN314
87a53e3b-1c75-4253-a211-00585c32dd69,56ac401b-0e3e-4144-a10f-322e3bf8ee09,John,Turner,Network Engineer,Valdez Inc,john.turner@example.com,+1-686-771-8590x6423,2572 Broadway,Ottawa,ON,K1P 1J1,Canada,8,enable turn-key networks,Mentioned a need for real-time analytics and dashboarding.,2025-08-02T18:42:27.098162,LRN314
3ca1f8a6-52d0-41e9-9d9f-08fc509c2f6f,2ea4f8ad-7bfa-462f-a1f3-4c624e721fec,Megan,Sullivan,Developer Advocate,"Cervantes, Garcia and Conley",megan.sullivan@example.net,327-738-7265x815,3196 Market St,New York,NY,10001,United States,23,synergize killer platforms,Interested in automated testing strategies for their mobile app.,2025-05-01T18:10:25.132831,LRN314
1b013003-198c-4360-b4a9-0bbe921ec5f8,02ea29d8-c0be-44df-9827-3d11a7f63f25,Olivia,Hernandez,Backend Developer,Hayes Inc,olivia.hernandez@example.com,5995677152,6363 Washington St,San Francisco,CA,94105,United States,58,architect magnetic channels,Wants to integrate our widget into their React Native application.,2025-04-12T09:18:29.502594,LRN314
5ae24984-dabc-4afe-be6e-f66f0fec51e9,8864d084-cebc-4599-9499-b8b95205f3cb,Jill,Warren,Data Engineer,Lopez Ltd,jill.warren@example.org,(513)334-1927x1353,3623 Market St,Seattle,WA,98109,United States,76,extend cross-media interfaces,Evaluating our platform against AWS and Azure alternatives.,2025-06-09T22:18:58.619926,LRN314
213d7195-38da-41ca-8673-bfa4c9a6576e,4581ed67-100f-4134-9b97-89b6c1380b3d,Joshua,James,Machine Learning Engineer,"Curtis, Joyce and Miller",joshua.james@example.com,886-496-2722x4101,2680 Oak St,San Francisco,CA,94105,United States,6,morph innovative e-tailers,Evaluating our platform against AWS and Azure alternatives.,2025-03-05T00:10:01.856152,LRN314
bb4c021d-e8da-43d5-98be-83e04fa57b74,ce05068b-4ebe-4ab1-914a-bfbbe717aeff,Nicholas,Murphy,Cybersecurity Analyst,Palmer-Gonzalez,nicholas.murphy@example.org,6653771116,363 Main St,Lyon,Auvergne-Rhône-Alpes,69001,France,70,leverage compelling interfaces,Mentioned a need for real-time analytics and dashboarding.,2025-09-26T08:27:08.250172,LRN314
3dc1f519-f810-4698-9eff-24042edfaee0,6e7c35d7-2eff-4256-b30a-261b756b405d,Michelle,Cervantes,Solutions Architect,"Bailey, Butler and Powell",michelle.cervantes@example.net,(798)936-8028,2781 Maple Ave,Toronto,ON,M5H 2N2,Canada,66,engineer vertical eyeballs,Mentioned a need for real-time analytics and dashboarding.,2025-01-30T14:15:34.903652,LRN314
eaec5b84-2f31-4bcd-88f8-61ac28c27005,ebc65e6d-b02c-4294-a0c2-4f34e4ac9f0c,Jessica,Brooks,AI Researcher,Cox-Neal,jessica.brooks@example.net,(525)300-6231,6766 Innovation Way,Los Angeles,CA,90001,United States,79,harness extensible solutions,Exploring options for edge computing and low-latency delivery.,2025-03-14T22:45:48.214421,LRN314
e6f958de-9099-4a77-8011-521535afa219,2f75eaef-f3d9-4122-9ee8-d4b7e4b46e1f,Shannon,Decker,Technical Product Manager,Lewis and Sons,shannon.decker@example.net,357.377.6672,4063 Washington St,Chicago,IL,60601,United States,9,revolutionize plug-and-play info-mediaries,Wants to schedule a deep-dive demo of the new security features.,2025-05-14T22:38:42.936796,LRN314
9fb05065-c70d-4938-be7f-285510424bb3,2f3ae629-00e4-4496-814f-3fe8ca010df8,Cheryl,Jackson,Frontend Developer,Barber Inc,cheryl.jackson@example.org,263-573-4543,3472 Oak St,Miami,FL,33101,United States,42,iterate B2C applications,Looking for a solution to optimize their CI/CD pipeline latency.,2025-09-25T22:11:03.472733,LRN314
14f46dc7-110d-4c0c-bca4-3c1ed55a7439,b56bb160-aa24-4129-a231-6fc8bced9a3b,Nicole,Mack,CTO,Knight Ltd,nicole.mack@example.net,001-460-403-4682x95420,5065 Broadway,Seattle,WA,98109,United States,28,revolutionize best-of-breed metrics,Curious about our websocket support for real-time chat.,2025-02-09T10:04:51.767534,LRN314
3d86fca2-53c8-4a6c-975f-41db14c1698b,0343bceb-4b61-4e5b-9be4-bc2353404907,Angela,Walker,Site Reliability Engineer (SRE),Baxter-Saunders,angela.walker@example.net,001-777-712-0430x5392,7518 Tech Blvd,Ottawa,ON,K1P 1J1,Canada,67,e-enable 24/365 interfaces,Asked if we support Terraform providers for infrastructure as code.,2025-01-27T12:32:15.546165,LRN314
fbb9c21e-6d18-47e2-b5a3-4f09fab277d8,3fe1fbe0-d0bc-488d-b358-b53d88a22af2,Jessica,Roberts,Full Stack Developer,Howell Inc,jessica.roberts@example.net,001-552-884-5304x2745,9476 Tech Blvd,Toronto,ON,M5H 2N2,Canada,44,morph mission-critical systems,Wants to schedule a deep-dive demo of the new security features.,2025-05-15T01:10:49.310913,LRN314
6c49ba7f-0649-443d-9374-60ba2425a9af,aaf5d3b0-8139-4d83-86ad-38af3b735113,Anthony,Bates,DevOps Engineer,"Clark, Davis and Carpenter",anthony.bates@example.com,(589)203-4914x443,6532 Washington St,Austin,TX,73301,United States,7,deliver clicks-and-mortar communities,Excited about the roadmap for serverless function support.,2025-02-08T03:32:27.639672,LRN314
9b3ec702-d8bc-41e1-8cd6-ee777bf74ef9,631714c6-94ae-489a-9448-7fa5af53885c,Steven,Harper,Backend Developer,Patrick Inc,steven.harper@example.com,(664)750-4444x334,2661 Maple Ave,Denver,CO,80202,United States,3,evolve cross-media web-readiness,Evaluating the feasibility of a multi-tenant architecture.,2025-09-09T08:37:51.930395,LRN314
f7b0d24b-481e-4c2f-9ccd-3b0198eb8961,a9525203-76a9-4652-8cfb-85a998c6e284,Amy,Hanson,Network Engineer,"James, Williams and Howell",amy.hanson@example.com,284.297.9263,9656 Oak St,Amsterdam,NH,1012,Netherlands,7,orchestrate front-end supply-chains,Mentioned a need for real-time analytics and dashboarding.,2025-03-02T00:35:46.945081,LRN314
7f757b7a-a54d-44b6-9c65-3e861a26d715,49566b47-ea55-40b6-98d5-b90f8630e3a4,Curtis,Powell,VP of Engineering,Roberts-Vargas,curtis.powell@example.net,218.454.1289x733,207 Market St,New York,NY,10001,United States,62,re-intermediate cutting-edge paradigms,Looking for a partner to help with a large-scale cloud migration.,2025-05-03T05:44:03.111425,LRN314
62f22632-5ee7-45ca-84eb-ef3e9e9d0aa8,bfe6e240-20b1-42c6-8414-3de7edd8b586,Stephanie,Dean,Data Scientist,"Koch, Torres and Le",stephanie.dean@example.net,(465)650-2326,6265 Maple Ave,Atlanta,GA,30303,United States,56,maximize cross-media supply-chains,Wants to integrate our widget into their React Native application.,2025-02-19T18:26:50.837984,LRN314
096224ad-ce2a-4899-8280-3d624053a786,149137bc-bb28-4100-b5ab-9f0cea0a7ad5,Benjamin,Fitzgerald,Frontend Developer,Hutchinson-Miller,benjamin.fitzgerald@example.com,+1-507-343-6917x140,3333 Main St,Boston,MA,02110,United States,84,e-enable B2B networks,Curious about our websocket support for real-time chat.,2025-07-24T22:32:37.337905,LRN314
d6e841ec-33b5-4b44-988c-a7b1f93c9159,16dc1cc6-4f4d-4f80-a9c6-97f20e235b66,Brandon,Andrade,Site Reliability Engineer (SRE),Kim PLC,brandon.andrade@example.org,001-974-278-0751x757,9398 Main St,Atlanta,GA,30303,United States,83,unleash global e-services,Discussed the benefits of Rust over C++ for their new engine.,2025-07-30T16:58:18.540399,LRN314
1e50a243-1e57-48be-8495-91d713044abb,ed2bbe44-3baf-478b-a029-6fa05a63c05e,Jessica,Weaver,Backend Developer,Jefferson Inc,jessica.weaver@example.net,+1-520-290-2589,7184 Main St,Dublin,Dublin,D01,Ireland,69,generate collaborative e-commerce,Curious about our websocket support for real-time chat.,2025-07-17T03:54:28.278534,LRN314
70145258-b22c-429b-8174-df32cfee14cd,b838cc02-eca5-440b-b791-ce808e4caf6c,Austin,Gregory,Machine Learning Engineer,West-Scott,austin.gregory@example.net,+1-328-635-3618x2920,1058 Washington St,Ottawa,ON,K1P 1J1,Canada,3,synthesize global markets,Asked detailed questions about our GraphQL API rate limits.,2025-04-08T23:55:11.997427,LRN314
401729e3-5a35-4728-97ea-4f910e93e402,5a762dbe-cb46-4b77-ac6e-f0f85154225b,Michael,Hill,Cloud Architect,"Martinez, Walker and Padilla",michael.hill@example.net,(881)368-9156x090,8596 Washington St,San Francisco,CA,94105,United States,9,target back-end e-services,Evaluating our platform against AWS and Azure alternatives.,2025-06-25T13:10:20.912662,LRN314
71e7cce8-e522-484a-af10-0d4593ce170c,eb2ac322-4d6b-4021-87c8-24dc1e8e6d27,Ashley,Wright,iOS Developer,Smith-Herring,ashley.wright@example.com,(614)419-7038,4507 Market St,Atlanta,GA,30303,United States,61,e-enable dynamic synergies,Needs better documentation for the Python SDK.,2025-09-28T17:34:42.874339,LRN314
e23bec75-9f74-4c95-9923-3bd738b91d3b,92d7ab74-9204-4532-88bc-c237d6d5a620,Marcus,Irwin,Database Administrator,Sherman-Richardson,marcus.irwin@example.org,+1-751-338-8123x234,559 Market St,San Francisco,CA,94105,United States,2,redefine cross-platform eyeballs,Asked if we support Terraform providers for infrastructure as code.,2025-03-26T05:38:00.960892,LRN314
def45731-ce4d-45b6-96d5-e9df6f7f0eb5,3a23c9eb-d630-43d4-8b4a-196841f4142d,Jeffrey,Campbell,CTO,"Young, Sanchez and Washington",jeffrey.campbell@example.com,593-486-6371x241,5877 Market St,San Francisco,CA,94105,United States,58,strategize intuitive channels,Needs a solution for log aggregation and anomaly detection.,2025-03-26T19:33:36.440748,LRN314
6dd22e14-6bfb-4a13-a964-df996dde5554,027c1a63-3094-4f54-8ff2-0b6534b2128b,Michael,Simmons,Machine Learning Engineer,"Williams, Russell and Rodriguez",michael.simmons@example.net,725.417.5376,9859 Innovation Way,Denver,CO,80202,United States,21,reinvent enterprise applications,Asked about our uptime SLAs and incident response times.,2025-01-26T19:07:44.667476,LRN314
d0d613fd-969b-4915-a192-3ccc6e21cc4e,3addfa4e-b140-4a39-9751-e5966b2e196e,Erica,Santos,Systems Administrator,Parker-Howard,erica.santos@example.net,8847249627,2761 Oak St,Dublin,Dublin,D01,Ireland,15,incubate strategic schemas,Evaluating the feasibility of a multi-tenant architecture.,2025-08-23T07:29:35.332167,LRN314
c0fb65ea-3363-48b4-8410-60d106ed1647,2b8cde02-16a1-44fc-9b61-e64af4fb77ae,Richard,Diaz,Full Stack Developer,"Stephens, Andrade and Bell",richard.diaz@example.org,796-650-4121,832 Maple Ave,Dublin,Dublin,D01,Ireland,56,deliver magnetic infrastructures,Interested in migrating legacy systems to a microservices architecture.,2025-05-14T02:26:18.838047,LRN314
81983887-45bc-40ae-ad92-30b64e3d5ee6,5634e0d6-90c7-49f8-a1fb-68e4da2648ed,Ashley,Ross,Cloud Architect,Anderson-Bush,ashley.ross@example.net,001-783-260-8011,1651 Oak St,San Francisco,CA,94105,United States,26,utilize virtual experiences,Looking to replace their current data warehouse with a more scalable solution.,2025-09-22T10:02:51.482210,LRN314
85a3b530-1ce5-421e-a396-b7343efba307,70fe4387-363e-47c9-8998-a3d65e38c97d,Lindsay,Robinson,Data Scientist,Best-Martinez,lindsay.robinson@example.net,001-944-780-9839x4942,542 Main St,Los Angeles,CA,90001,United States,57,disintermediate out-of-the-box portals,Interested in automated testing strategies for their mobile app.,2025-04-08T10:13:17.127119,LRN314
91e20891-f145-42ab-89fe-3ec01e5f57d7,3a31f801-1084-48e3-b5bf-681e2a31fe2c,William,Fox,VP of Engineering,Carter-Duncan,william.fox@example.net,903.951.2017,8690 Market St,Stockholm,Stockholm,111 22,Sweden,15,drive sticky web-readiness,Mentioned a need for real-time analytics and dashboarding.,2025-04-22T01:13:29.108934,LRN314
4d05fd4d-8dd8-425d-8bef-cc1211efdfb1,ed1821c5-4ce6-4f42-9ff8-c47a003176f9,Adam,Gonzales,Machine Learning Engineer,Evans-Kirby,adam.gonzales@example.net,342-919-1289,8507 Main St,San Francisco,CA,94105,United States,81,matrix innovative synergies,Suffering from database locking issues; looking for advice.,2025-08-29T12:05:32.893147,LRN314
cd8ebe01-841a-405d-8238-e020db352d30,008a6f6e-2a59-4385-bdcf-a6ad06a746a3,Kathleen,Ray,DevOps Engineer,"Kidd, Black and Buchanan",kathleen.ray@example.com,(817)534-4174,9622 Maple Ave,Manchester,England,M1 1AE,United Kingdom,35,enable bleeding-edge vortals,Looking for a solution to optimize their CI/CD pipeline latency.,2025-01-04T23:31:28.275611,LRN314
924bcc0b-9b4c-4be4-af32-38c671616ed9,c5ed69d2-6966-467c-b588-5724f95c8001,Randall,Miller,Android Developer,Harding and Sons,randall.miller@example.com,795.903.3006x238,9518 Market St,San Francisco,CA,94105,United States,46,deliver out-of-the-box mindshare,Needs better documentation for the Python SDK.,2025-09-20T14:27:21.853368,LRN314
61aa546b-a511-4e0c-bb96-13521d737cd1,736353b8-a4e5-4345-bdf9-0f565a896453,Amber,Velez,Product Manager,"Sutton, Stewart and Knight",amber.velez@example.org,(331)846-6412x85679,7688 Tech Blvd,Los Angeles,CA,90001,United States,90,deliver global relationships,Needs better documentation for the Python SDK.,2025-07-09T08:30:40.864406,LRN314
8a93bcd5-88f5-4493-954c-50067a55dc36,fb6b0673-57eb-45b8-91ba-e802a3b3ec28,Lindsey,Norton,UX/UI Designer,Kennedy-Thompson,lindsey.norton@example.org,8972636632,8713 Main St,Monterrey,NL,64000,Mexico,96,extend end-to-end supply-chains,Interested in migrating legacy systems to a microservices architecture.,2025-08-14T19:34:03.062054,LRN314
39cdc0d7-f01a-4c2d-b215-dc90f83cff3b,b23700ba-0d2d-4630-859f-cc6e6e08e77d,Robin,Harrison,VP of Engineering,"Schmidt, Garcia and Cox",robin.harrison@example.com,+1-302-305-5357,4698 Maple Ave,New York,NY,10001,United States,26,deliver value-added experiences,Asked about our uptime SLAs and incident response times.,2025-01-25T12:32:21.434727,LRN314
4f610bd7-4a1e-4af3-b51c-62d12a505aaa,0d22b5c0-8452-4870-8186-19989b4eb0b1,Amanda,Collins,DevOps Engineer,Moore LLC,amanda.collins@example.com,273.572.0379x831,2467 Oak St,São Paulo,SP,01000-000,Brazil,1,productize turn-key action-items,Concerned about data sovereignty and GDPR compliance in the EU region.,2025-04-20T11:37:39.138538,LRN314
0d02b472-c4ae-4d29-b5ea-15c76ab311cd,5b817583-01c5-41df-8f39-21fd164088e6,Terri,Allen,Data Engineer,Meyer and Sons,terri.allen@example.com,(280)846-1380x157,2819 Washington St,Guadalajara,JAL,44100,Mexico,26,transform virtual channels,Wants to know more about our machine learning model training capabilities.,2025-05-31T11:35:48.830764,LRN314
bcdbb863-4463-40d9-ac1d-b56b41d6db41,614f534e-03d4-469a-8820-aa47e1fe5112,Stacey,Hale,CTO,Cox-Johnson,stacey.hale@example.com,+1-759-863-5508,6514 Washington St,São Paulo,SP,01000-000,Brazil,76,deliver leading-edge e-commerce,Interested in automated testing strategies for their mobile app.,2025-09-25T21:20:31.368600,LRN314
4238305c-3dde-4a6a-90af-18182f45fe54,05865007-45df-400c-9cdc-f05aca05040e,William,Mitchell,Full Stack Developer,Hunt LLC,william.mitchell@example.net,997-833-7977x885,8783 Oak St,Denver,CO,80202,United States,91,whiteboard scalable channels,Asked detailed questions about our GraphQL API rate limits.,2025-10-03T10:43:09.116758,LRN314
6a75d20d-55be-411f-af46-dbcf602671a8,c56f826b-3b3d-4716-9ad9-e844b8d1c6e7,Jennifer,Lewis,Technical Product Manager,Jackson-Howard,jennifer.lewis@example.org,464-392-8583x63508,1702 Market St,Melbourne,VIC,3000,Australia,17,transform front-end systems,Asked detailed questions about our GraphQL API rate limits.,2025-01-26T15:09:39.876435,LRN314
9479652e-2674-4d4e-8042-47547793ebd5,c17663f5-7481-48ae-b886-2213e540c3bf,David,Sanders,AI Researcher,Johnson Group,david.sanders@example.net,853-347-0283x8271,9293 Broadway,Mumbai,MH,400001,India,70,incubate B2B e-markets,Suffering from database locking issues; looking for advice.,2025-06-03T00:18:37.321044,LRN314
12243a97-3d41-4945-86c5-d37637c2ddcf,2f5d0c04-894d-4bd0-ad98-3d2629331e64,Abigail,Daniels,Data Scientist,Tran Inc,abigail.daniels@example.net,911-887-2343x9455,217 Main St,Singapore,SG,049318,Singapore,46,deploy dot-com models,Asked detailed questions about our GraphQL API rate limits.,2025-07-15T07:36:24.979725,LRN314
f2259e72-a962-4ce9-a670-25f8edae808a,dc886455-b304-4d91-ad3b-cddbaeb90d3d,Michael,Benson,Data Scientist,"Washington, Hardy and Richard",michael.benson@example.com,7158360451,7880 Innovation Way,Boston,MA,02110,United States,99,target clicks-and-mortar e-markets,Excited about the roadmap for serverless function support.,2025-09-27T09:39:33.890052,LRN314
1c186f2b-2a93-475b-b9af-3d55f82bd0ef,cef4a77f-7a4b-4804-a538-889b2b371442,Monica,Hunt,Mobile Developer,Cruz Ltd,monica.hunt@example.net,+1-397-522-3284x68801,2331 Tech Blvd,Toronto,ON,M5H 2N2,Canada,24,optimize plug-and-play info-mediaries,Encountered friction with the SSO setup; needs technical support.,2025-09-18T02:19:24.758214,LRN314
d5ee50fa-230a-4e40-b83d-3b45b5544af7,9e332ffc-f98a-49ee-abf4-c8ac4a45cbd0,Clinton,Valencia,Test Automation Engineer,Mullins-Perkins,clinton.valencia@example.net,001-640-886-0784x799,529 Washington St,Austin,TX,73301,United States,59,evolve open-source supply-chains,Evaluating the feasibility of a multi-tenant architecture.,2025-01-08T09:32:36.660367,LRN314
1a5dca35-9607-425c-9124-cdfa83a1e2b5,ad8077ce-5744-4eaf-a5d4-8bb939151f4e,Thomas,Mack,Security Engineer,"Lewis, Martinez and Murray",thomas.mack@example.org,796.517.7216x80896,1099 Oak St,Austin,TX,73301,United States,68,orchestrate customized vortals,Looking for a solution to optimize their CI/CD pipeline latency.,2025-05-29T19:49:38.948079,LRN314
4401bc93-0de3-4a0d-a03c-545d0e68bcec,da1afa56-13df-4fb5-a5c6-881c582ca7fb,Martha,Murray,Frontend Developer,Daniel-Stone,martha.murray@example.org,761.334.1224,8995 Market St,Melbourne,VIC,3000,Australia,45,empower mission-critical e-tailers,Discussed potential integration with their existing Kubernetes cluster.,2025-04-01T14:59:04.403851,LRN314
36ae2fbd-a435-428b-b62e-0022261d0678,9a6044bb-3f57-4f89-b028-6a60c3b62836,Robin,Dennis,CTO,Durham-Wood,robin.dennis@example.org,262-338-9869x32904,6161 Maple Ave,Miami,FL,33101,United States,30,innovate e-business ROI,Needs better documentation for the Python SDK.,2025-06-14T16:12:42.902626,LRN314
6d3e9efe-7a60-4904-8855-10b0816d1478,ea4d4f83-354b-437b-8c95-6d2048238587,Victoria,Collins,Database Administrator,Lynch Inc,victoria.collins@example.com,(797)392-9625,4584 Innovation Way,Mumbai,MH,400001,India,73,syndicate 24/7 e-services,Excited about the roadmap for serverless function support.,2025-04-23T13:45:31.696076,LRN314
8c2b5ae3-c82d-465b-9952-88642baeec16,2d234122-7958-44fc-8c43-c64e97258e54,Jessica,Hunt,Product Manager,Wagner-Meyers,jessica.hunt@example.net,922-398-2015x546,7144 Maple Ave,Denver,CO,80202,United States,6,mesh wireless bandwidth,Wants to know more about our machine learning model training capabilities.,2025-05-23T09:01:30.053781,LRN314
23606c7e-0c5b-4202-bac4-f60aabaaccb3,dcb7ecbf-772a-4885-a5af-19803ba9e632,Katrina,Dickson,Data Scientist,Giles-Martinez,katrina.dickson@example.com,+1-483-482-9758x453,1093 Washington St,Munich,Bavaria,80331,Germany,35,cultivate viral convergence,Needs a solution for log aggregation and anomaly detection.,2025-03-12T09:43:16.485360,LRN314
ded7fa4b-771e-4749-9d9a-a2f967bb0c18,05629113-49c6-40fa-913b-b0afc39bce02,Sabrina,Robertson,iOS Developer,Owens-Vasquez,sabrina.robertson@example.net,(871)934-1166x0105,8507 Innovation Way,Monterrey,NL,64000,Mexico,86,brand killer interfaces,Encountered friction with the SSO setup; needs technical support.,2025-06-29T18:27:14.194167,LRN314
31b0c1c6-b1da-4c42-8e3b-c9557aded6ef,bec7fb02-d727-4eb2-800c-7dc852dff130,Emily,Stewart,Site Reliability Engineer (SRE),Watson Ltd,emily.stewart@example.org,+1-758-713-9234x5624,5487 Broadway,Chicago,IL,60601,United States,83,incentivize plug-and-play systems,Concerned about data sovereignty and GDPR compliance in the EU region.,2025-07-11T12:34:58.132114,LRN314
7023762b-be77-4e28-a59b-b7cc7ca976b1,9e4d48ea-4a4b-4237-a023-3746aaf6df10,Tina,Brown,Security Engineer,Stuart-Rodgers,tina.brown@example.com,+1-998-631-0392x949,4765 Broadway,Chicago,IL,60601,United States,51,exploit collaborative communities,Excited about the roadmap for serverless function support.,2025-02-03T00:28:08.744352,LRN314
26125e81-a50f-44e7-8525-6c2e4295a355,91ea5370-d7cc-4a7c-8e7e-9abf5ff20bfb,Chad,Chan,UX/UI Designer,Rivera Ltd,chad.chan@example.com,+1-915-621-1375x276,3596 Maple Ave,Singapore,SG,049318,Singapore,80,architect enterprise schemas,Encountered friction with the SSO setup; needs technical support.,2025-07-25T03:17:20.833833,LRN314
afeef0cb-54ac-4006-9a86-462ec9ab8682,02bbae15-9fb5-4c28-94dc-a264e51744ff,Jane,Jenkins,Software Engineer,Hernandez-Kaufman,jane.jenkins@example.com,620-766-1330,623 Maple Ave,Guadalajara,JAL,44100,Mexico,66,e-enable extensible supply-chains,Interested in automated testing strategies for their mobile app.,2025-07-09T07:27:10.908729,LRN314
f28131e9-c7f3-42a2-aac5-b66d13ffb8ea,a5da5619-26cf-497e-a5dd-0a0906d3742c,Dana,Torres,Database Administrator,Stewart-Vasquez,dana.torres@example.com,508-890-1429x866,2513 Main St,Los Angeles,CA,90001,United States,18,incentivize bleeding-edge e-markets,Wants to know more about our machine learning model training capabilities.,2025-09-09T18:59:13.386607,LRN314
66662542-63e5-4576-b2e4-fe197066e32a,a48a62e7-613c-4a0c-afac-20f7891ea8e3,Ryan,Wallace,Developer Advocate,Rodriguez LLC,ryan.wallace@example.org,(558)673-1427,1379 Main St,Los Angeles,CA,90001,United States,19,repurpose plug-and-play content,Discussed the benefits of Rust over C++ for their new engine.,2025-03-02T02:41:01.982061,LRN314
011f8468-101c-4e09-a81a-d4e860cd5bea,4b1d8237-8a11-480f-9ca6-28c8de7449b4,Taylor,Sanders,Cloud Architect,"Gonzales, Stevens and Wright",taylor.sanders@example.org,6935032441,2809 Innovation Way,Guadalajara,JAL,44100,Mexico,84,exploit enterprise schemas,Wants to know more about our machine learning model training capabilities.,2025-04-16T17:25:30.678719,LRN314
