Scan ID,Attendee ID,First Name,Last Name,Title,Company,Email,Phone,Address,City,State,Postal Code,Country,Lead Score,Qualifiers,Notes,Timestamp,Session ID
7763623e-d092-488e-a126-49d556780c2a,9316bd67-7f75-47a2-a291-196ec9d98dd1,Tammy,Alvarado,Technical Writer,Watson PLC,tammy.alvarado@example.com,221.293.4970x4041,8667 Oak St,Austin,TX,73301,United States,58,embrace world-class platforms,Wants to know more about our machine learning model training capabilities.,2025-05-08T20:12:17.833288,LRN314
fece3380-5e78-4d00-9d85-30183d64fe0c,03005814-643a-469b-86dc-38a109dfd4cc,Alexis,Hernandez,Technical Writer,"Serrano, Torres and Dean",alexis.hernandez@example.net,925-815-0224,4192 Oak St,Boston,MA,02110,United States,38,maximize dot-com metrics,Interested in automated testing strategies for their mobile app.,2025-03-18T02:13:29.351592,LRN314
a77dfac6-6117-4140-bf66-fa99b047b5e1,7a8ab743-cfeb-4d6a-9c40-e512fc9b3ff3,Zachary,Stewart,Backend Developer,"Nichols, Mccormick and Schneider",zachary.stewart@example.com,640-767-3147x207,3579 Broadway,Boston,MA,02110,United States,62,target vertical supply-chains,Discussed potential integration with their existing Kubernetes cluster.,2025-07-19T09:56:22.475693,LRN314
32f4f259-70e9-42ea-9b84-9db649287df7,c35f3dfb-5ae7-4908-aef5-a015f3bc752f,Christine,Johnson,Full Stack Developer,"Brooks, Braun and Macias",christine.johnson@example.org,451-721-6949x182,6125 Innovation Way,Denver,CO,80202,United States,49,e-enable rich systems,Evaluating our platform against AWS and Azure alternatives.,2025-08-06T16:58:00.461807,LRN314
4e75bfdf-2da3-467e-8bf6-ccd61f231921,12d01b34-21c0-43f1-9446-b42a1c39f02c,Christopher,Mason,VP of Engineering,"Reyes, Parker and Salinas",christopher.mason@example.com,+1-469-530-0428x465,8146 Tech Blvd,San Francisco,CA,94105,United States,58,orchestrate granular e-services,Exploring options for edge computing and low-latency delivery.,2025-10-08T02:24:12.401706,LRN314
30c00a46-f706-4419-95ea-53119ab30815,ca8cbb03-6819-464e-9104-7e5b934a01c0,Sherry,Reynolds,Database Administrator,Wagner Ltd,sherry.reynolds@example.net,+1-800-541-8701x30390,1828 Broadway,Boston,MA,02110,United States,51,repurpose 24/365 mindshare,Wants to integrate our widget into their React Native application.,2025-06-15T15:22:41.867087,LRN314
b3cb59ab-5269-442f-ad0d-37313ed7c9bc,17f6dd93-556c-47f3-a4cc-15f6873512ba,Jennifer,Nelson,Solutions Architect,Peterson-Hill,jennifer.nelson@example.net,001-214-866-1545,5276 Innovation Way,Ottawa,ON,K1P 1J1,Canada,15,cultivate virtual bandwidth,Excited about the roadmap for serverless function support.,2025-03-12T17:59:20.482838,LRN314
96674147-f5d4-454c-8dde-722c8794d15d,22ef0d47-853c-496f-b3df-aaf7c7f67a9b,David,Moore,Network Engineer,"Clark, Jones and Henderson",david.moore@example.net,679.517.2820x554,6216 Maple Ave,Paris,Île-de-France,75001,France,62,streamline value-added e-tailers,Encountered friction with the SSO setup; needs technical support.,2025-07-11T22:30:22.932899,LRN314
33f7b5c0-ee18-4f60-a965-a4ba493243ae,cfab8a92-f866-4429-9663-98c2d74eb9f8,Monica,Howard,Systems Administrator,Russell Inc,monica.howard@example.net,+1-302-985-8778x89702,6247 Oak St,San Francisco,CA,94105,United States,10,integrate bricks-and-clicks web-readiness,Curious about our websocket support for real-time chat.,2025-07-22T16:27:11.725198,LRN314
8e8cbc09-0888-48d7-b260-281b11fa04a2,a7f1c594-7fc2-4bcc-8b64-7fd0fd6a0968,David,Fernandez,DevOps Engineer,"Cobb, Hill and Garcia",david.fernandez@example.net,397-360-3291x4226,3136 Oak St,Amsterdam,NH,1012,Netherlands,39,architect collaborative deliverables,Wants to know more about our machine learning model training capabilities.,2025-04-22T08:13:50.224523,LRN314
d46e2a4f-3919-4203-9853-4ff009fa8845,ca27361d-02dd-480e-bdf1-55681a578795,Kaitlin,Walter,Database Administrator,Williams Group,kaitlin.walter@example.org,322-838-2227x34444,5365 Broadway,Atlanta,GA,30303,United States,23,monetize cross-media schemas,Interested in automated testing strategies for their mobile app.,2025-06-21T15:00:40.749319,LRN314
901ff289-975c-483f-93ae-127cfb5d7cda,6550c0cf-1070-453f-80e7-e5313c360f23,Samantha,Gray,VP of Engineering,Smith Ltd,samantha.gray@example.org,353.210.2785,2667 Main St,Miami,FL,33101,United States,33,enhance distributed models,Needs better documentation for the Python SDK.,2025-02-04T08:35:17.754189,LRN314
41a9be67-46b1-4944-848f-549dfd048562,64a6348b-5e7d-4141-8500-4deaab956101,Mark,Davidson,Data Scientist,Mendez Ltd,mark.davidson@example.net,599-537-0551x35059,5393 Tech Blvd,Montreal,QC,H3B 1A7,Canada,77,harness rich web services,Looking for a solution to optimize their CI/CD pipeline latency.,2025-03-19T19:48:38.085862,LRN314
58f74cae-fc7f-4ce9-9661-ee7b39378499,fe96ed0d-23b8-4959-bc89-d873452f5f2a,Brandi,Baldwin,Backend Developer,Freeman and Sons,brandi.baldwin@example.com,(392)386-3409x581,2513 Market St,Stockholm,Stockholm,111 22,Sweden,3,morph dot-com models,Concerned about data sovereignty and GDPR compliance in the EU region.,2025-09-30T21:42:39.354222,LRN314
18a6080b-cedd-4502-8434-6fcd6cc980be,1edb8f16-904b-47f2-b310-966ce5129f82,Connor,Gross,Full Stack Developer,"Kent, Bowman and Garcia",connor.gross@example.com,443-544-9173x2721,1479 Washington St,Chicago,IL,60601,United States,100,empower B2C synergies,Wants to integrate our widget into their React Native application.,2025-01-12T00:24:42.772736,LRN314
92c03ef3-d5c8-4070-915a-28e9c7e1c88c,4a8cb70a-4a3c-4868-b2e2-f3ebc6c37824,Hannah,Thompson,Security Engineer,Moore LLC,hannah.thompson@example.net,3834150016,2597 Market St,Austin,TX,73301,United States,40,envisioneer viral e-markets,Evaluating the feasibility of a multi-tenant architecture.,2025-01-30T02:19:57.173494,LRN314
6cfa9f3a-ab27-4a0f-98a1-309468c6eec0,3377a44f-eaf8-4fd6-803d-8d10045db121,Joseph,Williams,Product Manager,Woods Group,joseph.williams@example.net,001-245-722-5098x09514,1708 Main St,Miami,FL,33101,United States,61,target viral solutions,Excited about the roadmap for serverless function support.,2025-09-29T12:06:19.669798,LRN314
f1f0e16e-78dd-49ef-a396-e0ac3138af17,cd1f7db3-c386-4d18-b553-c189d1425606,Timothy,Smith,VP of Engineering,"Powell, Thompson and Stafford",timothy.smith@example.com,4727884808,9483 Tech Blvd,Austin,TX,73301,United States,77,target scalable infrastructures,Concerned about data sovereignty and GDPR compliance in the EU region.,2025-07-11T10:46:05.246554,LRN314
954fc05d-bd6a-4047-977e-b18ae015abdd,29b3ff98-206c-4dd1-b87d-3c878d135d21,Lisa,Chapman,CTO,Villegas LLC,lisa.chapman@example.org,001-512-422-1069x57752,8562 Oak St,Seattle,WA,98109,United States,84,seize mission-critical networks,Curious about our websocket support for real-time chat.,2025-05-01T08:06:57.035806,LRN314
3240bdd1-fd23-4f40-9e05-a42c65c274b4,26db5583-43db-4d47-ab2a-ca4ebc0891ec,Timothy,Estrada,Mobile Developer,Clark LLC,timothy.estrada@example.org,631-276-9856,7523 Broadway,Boston,MA,02110,United States,41,engineer back-end metrics,Interested in migrating legacy systems to a microservices architecture.,2025-02-06T16:49:35.617714,LRN314
298a6cc3-4667-4da5-9e39-72cfe043bdf9,67e0c244-1eb8-4b88-af7f-0279108922c6,Joshua,Vincent,Frontend Developer,"Martin, Wright and Ellison",joshua.vincent@example.com,7515308384,2352 Innovation Way,Mumbai,MH,400001,India,55,facilitate B2C supply-chains,Wants to schedule a deep-dive demo of the new security features.,2025-01-28T06:53:18.306494,LRN314
eccb13c3-8f9e-4743-a391-a42796ee5db7,51c3ca42-2982-47c4-8706-57ad8e6d8158,Kelly,Jefferson,QA Engineer,Hart and Sons,kelly.jefferson@example.com,877.413.8175,6070 Broadway,Montreal,QC,H3B 1A7,Canada,50,incentivize plug-and-play deliverables,Asked detailed questions about our GraphQL API rate limits.,2025-08-10T14:32:33.950078,LRN314
83d248db-2381-49d6-96e1-e2bac9e55414,fee99207-eeb0-4747-8aad-406d7e78b763,Ryan,Moore,Engineering Manager,Davis-Ward,ryan.moore@example.net,405-352-3012,3893 Maple Ave,Austin,TX,73301,United States,65,monetize plug-and-play e-business,Asked about our uptime SLAs and incident response times.,2025-02-11T05:31:05.803932,LRN314
115161db-43d7-45f4-b700-4dec27484f33,b6b5e91c-2bd3-4a8a-a538-1a99126d3fbb,Nicole,Anderson,DevOps Engineer,Carr-Watkins,nicole.anderson@example.net,+1-855-832-2134,5882 Broadway,Paris,Île-de-France,75001,France,88,streamline B2C solutions,Looking for a partner to help with a large-scale cloud migration.,2025-09-17T08:24:54.227807,LRN314
63c878de-c209-4d2d-888d-117f8736b466,bcd5a878-2416-4f56-9d94-4b1f2ed8fb8b,Sheila,Wallace,DevOps Engineer,Garcia-Anderson,sheila.wallace@example.org,(234)466-3000x22487,6834 Market St,New York,NY,10001,United States,86,leverage synergistic architectures,Wants to know more about our machine learning model training capabilities.,2025-01-19T14:12:59.647346,LRN314
a2c4a9e9-2017-48cc-b89a-bf72ce6fe665,23a9851a-74c4-4f6c-8d34-aa441994b427,Matthew,Richardson,Security Engineer,Mckee-Adams,matthew.richardson@example.com,280.852.0558,2000 Broadway,Atlanta,GA,30303,United States,56,visualize plug-and-play systems,Wants to know more about our machine learning model training capabilities.,2025-09-14T16:25:55.499350,LRN314
9ec99bb1-e1bc-40f0-a160-96e25f368b3b,aedc9d6c-9eb5-4dfe-bb9a-d66ec78834d2,Kathleen,Moore,Cloud Architect,Parks Ltd,kathleen.moore@example.net,+1-203-631-6077x49007,3765 Maple Ave,Miami,FL,33101,United States,34,mesh killer synergies,Discussed the benefits of Rust over C++ for their new engine.,2025-09-12T16:59:00.289661,LRN314
c9acb3bf-f604-436d-97c2-15dd7ab54dd8,7d29fbe0-4e62-4023-8eb1-dea592caa88d,Leslie,Nguyen,Data Engineer,"Torres, Martin and Thomas",leslie.nguyen@example.org,+1-633-641-5447x558,4325 Broadway,Atlanta,GA,30303,United States,98,synthesize virtual models,Exploring options for edge computing and low-latency delivery.,2025-05-06T03:27:03.494239,LRN314
59e60f64-d867-44eb-9ecf-0662f458e417,35a00d87-2923-4942-81e1-4e7059608bd7,Bradley,Martin,Machine Learning Engineer,Petersen-Garrison,bradley.martin@example.net,555-440-1324x78656,7001 Market St,Denver,CO,80202,United States,85,revolutionize sticky deliverables,Asked detailed questions about our GraphQL API rate limits.,2025-09-25T07:30:16.747261,LRN314
ecd76e93-2b64-47d5-be49-f91190a28525,33421ce5-d24e-42fa-9f91-10fdf77832b6,Derek,Bennett,CTO,Hicks-Herrera,derek.bennett@example.com,678.903.7520,6730 Innovation Way,Austin,TX,73301,United States,55,disintermediate enterprise initiatives,Discussed potential integration with their existing Kubernetes cluster.,2025-01-01T23:29:24.102785,LRN314
22dbfa24-d894-45ce-b18a-2d6bf68d747c,68ea285d-9052-4f7c-900a-ae4a291920ae,Stephen,Freeman,Machine Learning Engineer,Gardner-Walsh,stephen.freeman@example.com,352.248.0375x3878,2987 Broadway,Atlanta,GA,30303,United States,33,brand dot-com platforms,Excited about the roadmap for serverless function support.,2025-07-28T05:36:45.124000,LRN314
38c37e20-6ea3-4bf6-a292-50527a758080,001a79ff-9764-4413-a02f-d24875e1a62c,Jeffrey,Anderson,Test Automation Engineer,Manning Group,jeffrey.anderson@example.com,794.916.5328x060,1910 Main St,Chicago,IL,60601,United States,29,empower one-to-one systems,Suffering from database locking issues; looking for advice.,2025-07-25T02:51:12.979060,LRN314
04538d38-569e-4a61-b754-df660e25c0c2,4f933f1e-15a6-47a8-ac6f-48ca89a5b662,Heather,Taylor,Software Engineer,Richmond-Burns,heather.taylor@example.com,9078947791,9411 Tech Blvd,Miami,FL,33101,United States,54,unleash vertical partnerships,Asked if we support Terraform providers for infrastructure as code.,2025-03-18T01:32:31.574525,LRN314
92287a83-d514-450a-a553-97124fe4442c,3a9b3d56-fe16-4803-b9b3-eaed8eed75fe,Barbara,Porter,Site Reliability Engineer (SRE),Marquez-Morris,barbara.porter@example.org,2519358138,7600 Broadway,Rio de Janeiro,RJ,20000-000,Brazil,43,incentivize granular web-readiness,Concerned about data sovereignty and GDPR compliance in the EU region.,2025-01-21T22:40:05.623587,LRN314
23d6a116-82cd-49b4-b4bf-92eb8a41f3b6,a0e9467f-41c8-4a9d-92e6-534c57356f91,Brittney,Alvarado,Security Engineer,Sullivan Ltd,brittney.alvarado@example.net,721.726.5389,4593 Maple Ave,San Francisco,CA,94105,United States,24,target sticky e-markets,Looking to replace their current data warehouse with a more scalable solution.,2025-01-08T02:58:50.034598,LRN314
718c69b3-47e5-4998-8d58-f47832a4257b,6fc8f60d-571a-428a-9a81-1d575f155fd7,Carmen,Martinez,Technical Product Manager,Johnson-Jordan,carmen.martinez@example.net,595-360-1932x87546,4630 Innovation Way,Montreal,QC,H3B 1A7,Canada,11,aggregate user-centric convergence,Looking for a solution to optimize their CI/CD pipeline latency.,2025-09-23T02:14:06.045047,LRN314
f30e3262-16b2-4c8e-a412-34a286db21ab,32b879db-b273-40ef-8ba9-ba3453438037,Morgan,Miller,Cloud Architect,"May, Thompson and Baker",morgan.miller@example.net,666.435.3418x692,4204 Main St,Chicago,IL,60601,United States,1,morph distributed markets,Needs a solution for log aggregation and anomaly detection.,2025-01-19T18:06:30.471059,LRN314
02ae7b59-20e0-4b93-ae66-7adb92586a02,b9459642-9c06-460d-96a4-7c4b2575bf0b,Angela,Wagner,Cybersecurity Analyst,"Gardner, Barry and Arnold",angela.wagner@example.com,497-869-1725x55325,8783 Market St,Chicago,IL,60601,United States,64,incentivize turn-key networks,Discussed the benefits of Rust over C++ for their new engine.,2025-07-08T02:35:14.927146,LRN314
54cfd3e6-84d6-41a5-b4eb-465eb7e373f9,a51025b2-3fcc-434d-86b4-68880d448e12,Steven,Rasmussen,Systems Administrator,"Valentine, Bailey and Sweeney",steven.rasmussen@example.com,(281)996-0739,8062 Washington St,Denver,CO,80202,United States,98,enhance customized partnerships,Asked if we support Terraform providers for infrastructure as code.,2025-09-04T16:08:31.917834,LRN314
ccb2211b-d9b8-4bf1-8647-ece29adde5e6,7380753f-70d6-4c7f-9fac-9c8a50ba1c31,Troy,Cruz,Site Reliability Engineer (SRE),Walker-Peters,troy.cruz@example.org,(390)220-0348x011,3701 Broadway,Ottawa,ON,K1P 1J1,Canada,62,utilize global vortals,Needs a solution for log aggregation and anomaly detection.,2025-01-19T09:14:10.167597,LRN314
531dccfd-7d74-4da5-9a64-3b62aea58f0e,ac4f7469-9b90-497b-a5ae-c22a8d9a913a,Crystal,Nelson,Network Engineer,"Melendez, Young and Allen",crystal.nelson@example.net,795.815.8578x668,3930 Oak St,Monterrey,NL,64000,Mexico,31,streamline holistic interfaces,Asked if we support Terraform providers for infrastructure as code.,2025-08-30T03:44:38.012774,LRN314
142b0c95-8e86-4d2a-a142-2572823f5705,7d5129ad-5d2b-4d15-9264-55f7b1aed199,Anna,Lee,Frontend Developer,"Ashley, Harmon and Dawson",anna.lee@example.net,+1-245-966-5211x4350,7640 Tech Blvd,Atlanta,GA,30303,United States,71,mesh e-business relationships,Asked detailed questions about our GraphQL API rate limits.,2025-07-26T20:04:08.888415,LRN314
07d86691-37ba-44b7-a447-11d547f96ed6,f9c9ed75-e2fe-4174-91ab-af58078c4d5e,Chad,Armstrong,Software Engineer,Hayes Group,chad.armstrong@example.net,891-707-3165x11661,2015 Market St,Denver,CO,80202,United States,38,unleash collaborative eyeballs,Curious about our websocket support for real-time chat.,2025-02-01T22:04:39.821812,LRN314
b9b47bfb-203a-43cc-becd-2d1034ee9e63,ca127d1a-7585-4b54-acf8-9137935516e5,Pamela,Williams,Security Engineer,Phillips and Sons,pamela.williams@example.com,991-971-6516,2615 Washington St,Guadalajara,JAL,44100,Mexico,4,innovate 24/365 mindshare,Needs better documentation for the Python SDK.,2025-01-29T00:16:36.689986,LRN314
ba58ad7c-1ab7-4846-9ade-c5174d7632de,7b5a917d-80e6-4774-860e-6d885c1ddf78,Kelly,White,Cybersecurity Analyst,"Yu, Tucker and Grant",kelly.white@example.net,529-240-7029x1037,6620 Maple Ave,Dublin,Dublin,D01,Ireland,33,target enterprise solutions,Concerned about data sovereignty and GDPR compliance in the EU region.,2025-04-01T14:40:29.007909,LRN314
94002887-52c0-4d13-a42d-48ddecc60b1f,df993403-27ab-45c7-9aa4-27b5dfeb94e4,Daniel,Shaffer,Security Engineer,Vance Inc,daniel.shaffer@example.com,+1-497-232-9057x31984,9365 Innovation Way,Vancouver,BC,V6B 1P1,Canada,2,optimize collaborative metrics,Asked about our uptime SLAs and incident response times.,2025-03-22T20:26:12.463837,LRN314
b4dbd8c3-1dad-47b1-89d1-fa31bf46de6e,3d0ee788-5f81-4380-8da1-f982d3dddbeb,Amber,Fleming,Site Reliability Engineer (SRE),"Greene, Guerra and Reyes",amber.fleming@example.org,691.933.7741x19216,1267 Washington St,San Francisco,CA,94105,United States,31,transition open-source info-mediaries,Interested in migrating legacy systems to a microservices architecture.,2025-07-17T16:03:15.357191,LRN314
2c406934-9a13-464c-85dc-fd9d2d6d2fd0,6909f2c1-7087-48ff-a04f-3ba3ebb980a5,Timothy,Jimenez,Security Engineer,"Roberson, Garcia and Owen",timothy.jimenez@example.net,627.260.5486x1811,8731 Maple Ave,Los Angeles,CA,90001,United States,41,enhance leading-edge portals,Needs a solution for log aggregation and anomaly detection.,2025-02-19T02:49:01.528608,LRN314
ea238dc7-bd58-40aa-b514-02610083237b,d2e5d90d-e363-4ded-bec4-be0f8623ae71,John,Downs,Database Administrator,Lee-Cross,john.downs@example.net,644.688.6073x9190,161 Oak St,Atlanta,GA,30303,United States,66,streamline dot-com bandwidth,Wants to know more about our machine learning model training capabilities.,2025-08-04T12:32:54.382274,LRN314
b1a65dfa-2b50-41e2-9317-d034db5d02cd,fa8f374f-05fd-431e-96d5-94f5db1dee83,Amanda,Norton,UX/UI Designer,Hines-Bush,amanda.norton@example.org,+1-204-238-3955x7492,1069 Maple Ave,Bangalore,KA,560001,India,48,scale dot-com methodologies,Wants to know more about our machine learning model training capabilities.,2025-03-29T10:02:56.982582,LRN314
0d0a17c3-b907-4536-a36c-463a505185aa,d1cd1c19-fc15-452a-abde-5896217ff865,Richard,Smith,Senior Software Engineer,Curtis-Stokes,richard.smith@example.net,(305)235-6604,9347 Maple Ave,Lyon,Auvergne-Rhône-Alpes,69001,France,80,seize cross-platform ROI,Concerned about data sovereignty and GDPR compliance in the EU region.,2025-09-29T06:43:53.062014,LRN314
7a2edb69-7f1f-4384-88ea-619d0a63a4bb,4ebd2ad2-9a71-4aaf-92a6-9d803b24e674,Natalie,Mercado,Machine Learning Engineer,"Cox, Lopez and Russell",natalie.mercado@example.org,240.669.7277,3416 Main St,Calgary,AB,T2P 1J9,Canada,52,re-contextualize killer models,Wants to integrate our widget into their React Native application.,2025-05-18T08:04:10.366695,LRN314
3c8033ea-13f6-4ef7-8796-0f36feda9f12,86681eda-0c69-48cb-b8a9-d69c5ef00e9f,Timothy,Turner,Site Reliability Engineer (SRE),Anderson LLC,timothy.turner@example.com,+1-348-261-4276x0404,1426 Maple Ave,Miami,FL,33101,United States,70,monetize front-end infrastructures,Looking for a solution to optimize their CI/CD pipeline latency.,2025-02-24T06:04:28.315369,LRN314
1b2b7590-6aea-4f18-890f-cfabb7267fff,a106849e-8ad7-47e0-b84e-e87292563805,Jennifer,Thomas,Frontend Developer,"Sandoval, Ray and Aguirre",jennifer.thomas@example.org,001-512-773-0533x8578,9027 Tech Blvd,New York,NY,10001,United States,89,transition dot-com metrics,Curious about our websocket support for real-time chat.,2025-06-05T00:35:58.747002,LRN314
f79a4767-f014-491a-9093-9399aef68c84,a2ce06d5-df3d-4e6c-af49-f9a9c26359b9,Heidi,Ross,Data Scientist,Russell-Campbell,heidi.ross@example.net,911.566.6373x9541,6836 Main St,Seattle,WA,98109,United States,81,incentivize back-end mindshare,Interested in automated testing strategies for their mobile app.,2025-01-18T06:26:29.949893,LRN314
b0ef230e-8f92-4021-be88-a918246b9a3a,6f081d61-c154-4742-9d25-149bfdf3bf60,Jenny,Duffy,Engineering Manager,Hanson-Johnston,jenny.duffy@example.net,(967)400-6380x13201,1932 Oak St,Vancouver,BC,V6B 1P1,Canada,72,mesh customized bandwidth,Exploring options for edge computing and low-latency delivery.,2025-09-08T16:25:17.787663,LRN314
036ab6e2-9569-4c9f-a0a7-f9614f7ec158,4fe8a51f-0521-43fb-b3a8-6b7284e84226,Karen,Cook,Systems Administrator,Galvan Ltd,karen.cook@example.com,001-439-637-5257x773,8560 Tech Blvd,Melbourne,VIC,3000,Australia,46,grow bricks-and-clicks synergies,Inquired about volume pricing for high-throughput data streaming.,2025-03-29T23:50:52.227831,LRN314
62515df3-a681-4ccb-966a-dc16821af0be,356dd815-3018-4417-9436-d3a48dc0dc86,Lauren,Mclaughlin,Frontend Developer,Rivers-Miller,lauren.mclaughlin@example.com,521.766.7352x35254,3871 Innovation Way,Montreal,QC,H3B 1A7,Canada,56,morph wireless technologies,Wants to know more about our machine learning model training capabilities.,2025-04-11T14:41:23.691954,LRN314
c7e68c0f-9e17-459e-9e76-bcbc9fa20d9a,b1f5f6f4-30b8-4f20-a987-290cf3e99f67,Eric,Bernard,Machine Learning Engineer,Ellis-Dalton,eric.bernard@example.net,581-846-3435x2141,8807 Tech Blvd,Monterrey,NL,64000,Mexico,75,extend open-source partnerships,Excited about the roadmap for serverless function support.,2025-10-03T01:03:32.178031,LRN314
4d47784f-6dd5-4357-bc76-56f23d9a33f0,23fb0d34-411c-4740-9593-0c04b63473c4,Christopher,Thomas,CTO,"Norton, Cruz and Brown",christopher.thomas@example.net,(897)960-6608,6188 Washington St,Chicago,IL,60601,United States,23,revolutionize extensible partnerships,Looking for a solution to optimize their CI/CD pipeline latency.,2025-02-24T16:45:32.126456,LRN314
8b51495f-f31c-48fd-884d-3d10b78229b9,e798c193-4eba-4b99-ad6d-9b8508bc51cf,Donald,Martinez,Database Administrator,Hunt-Moore,donald.martinez@example.net,+1-421-694-0730,1482 Main St,Osaka,Osaka,530-0001,Japan,86,envisioneer dot-com interfaces,Encountered friction with the SSO setup; needs technical support.,2025-03-15T14:47:43.774276,LRN314
fb7660a0-4581-4807-92de-e55bdd75055c,f6799876-4e22-466b-ac45-88f0e203508b,James,Mckinney,Senior Software Engineer,Bailey-Taylor,james.mckinney@example.com,001-459-901-6241x656,6443 Maple Ave,Austin,TX,73301,United States,73,streamline visionary interfaces,Wants to integrate our widget into their React Native application.,2025-07-31T20:08:47.276606,LRN314
4e8e330a-782b-4bce-aab2-becb9324deb1,42fb29b4-2ade-4f65-aa00-9e8e4eb81201,Linda,Burke,Site Reliability Engineer (SRE),"Vega, Oneill and Mendez",linda.burke@example.net,501.840.5052x72883,766 Main St,Lyon,Auvergne-Rhône-Alpes,69001,France,34,re-contextualize vertical markets,Interested in migrating legacy systems to a microservices architecture.,2025-08-31T19:44:26.475258,LRN314
dd2d5400-55b6-4c7e-b39c-95dfdaba181c,c8e5e65d-7cf5-4a43-84c2-d88203762745,George,Wright,Technical Writer,Ramirez-Johnson,george.wright@example.org,291.545.3800x987,7489 Market St,New York,NY,10001,United States,46,extend real-time bandwidth,Interested in migrating legacy systems to a microservices architecture.,2025-01-15T18:31:25.775202,LRN314
46e08c81-5a0a-4de2-9f45-ef2e54bf7a62,7060d50c-9b69-4642-84bc-7a9c16a2ae4b,Zachary,Baker,Security Engineer,"Kirk, Lopez and Watkins",zachary.baker@example.com,+1-444-287-5774x340,8884 Main St,Austin,TX,73301,United States,62,enhance interactive deliverables,Wants to know more about our machine learning model training capabilities.,2025-05-08T22:49:06.977313,LRN314
b7f9eaed-c07b-4706-a2c0-a16e4aeeda2f,5791bac5-261f-429e-8c17-55dcee6197b8,Cindy,Peters,CTO,"Ward, Lawrence and Macias",cindy.peters@example.net,+1-529-303-5125x5071,5618 Main St,Los Angeles,CA,90001,United States,19,synthesize virtual platforms,Looking to replace their current data warehouse with a more scalable solution.,2025-02-11T20:11:54.031967,LRN314
06a07784-367b-484a-9528-f42a152169fb,50596e25-47f4-4b92-b6ba-f8b1d7eec4c0,Justin,Case,UX/UI Designer,"Cervantes, Ingram and Evans",justin.case@example.org,2632489327,6756 Innovation Way,Denver,CO,80202,United States,93,incentivize collaborative paradigms,Evaluating our platform against AWS and Azure alternatives.,2025-05-15T22:59:20.635740,LRN314
e1194935-fb2e-44a4-8dcf-42bdb0588750,83126273-7bee-48aa-91d4-c74d015fb6db,Bryan,Washington,UX/UI Designer,Gibson Ltd,bryan.washington@example.net,835-772-7725x2090,1445 Innovation Way,New York,NY,10001,United States,80,whiteboard cross-platform applications,Exploring options for edge computing and low-latency delivery.,2025-03-30T16:02:02.411597,LRN314
7767924f-208a-48ac-8c8f-d1fca498c1c0,445955d3-5e57-4a34-bb20-a92216c68376,Emily,Love,Cybersecurity Analyst,Wilson Ltd,emily.love@example.net,8516534788,3121 Broadway,Los Angeles,CA,90001,United States,25,envisioneer scalable info-mediaries,Looking for a partner to help with a large-scale cloud migration.,2025-03-06T07:32:26.314087,LRN314
51b38275-ff4d-47af-ace6-1e755dd4b920,43b73783-60ea-47e3-abf8-f0d9d43a90f2,Andrea,Johnson,Mobile Developer,Yates-Murphy,andrea.johnson@example.net,222.426.3977x002,2055 Oak St,Atlanta,GA,30303,United States,21,morph distributed vortals,Concerned about data sovereignty and GDPR compliance in the EU region.,2025-09-09T10:18:35.181252,LRN314
b860fe6a-9f2b-42f9-9f11-b95e9d83b6cc,cf698ca9-46ec-4b5f-9b56-88f1b3d3c559,Gloria,Johnson,AI Researcher,Benjamin-Smith,gloria.johnson@example.net,001-361-848-0148x860,4807 Tech Blvd,Dublin,Dublin,D01,Ireland,73,re-intermediate holistic channels,Wants to know more about our machine learning model training capabilities.,2025-01-03T12:58:10.496415,LRN314
9bcee916-4d5a-483b-82e1-59f8b53f8132,eb77849d-6178-4756-9c90-942ddb26667c,James,Miller,Test Automation Engineer,Brown Group,james.miller@example.org,001-372-494-9500x80684,2659 Maple Ave,Seattle,WA,98109,United States,70,re-intermediate integrated e-markets,Asked if we support Terraform providers for infrastructure as code.,2025-07-04T11:26:49.134269,LRN314
8b6f3cbc-67e2-4241-85fe-fc60601a5af4,e55d8d1e-fe3f-430e-a243-0af0d35fa86d,Joshua,Alvarez,Engineering Manager,"Rodriguez, Mcdaniel and Allen",joshua.alvarez@example.net,887.889.4546x2266,1834 Market St,Atlanta,GA,30303,United States,58,optimize web-enabled functionalities,Curious about our websocket support for real-time chat.,2025-01-08T10:01:03.703965,LRN314
