Scan ID,Attendee ID,First Name,Last Name,Title,Company,Email,Phone,Address,City,State,Postal Code,Country,Lead Score,Qualifiers,Notes,Timestamp,Session ID
42666435-0f39-4e53-b46e-4b02d134e198,86a5ba04-f89a-466c-9204-34106b750aa5,Tracy,Russell,Android Developer,"Hansen, Franco and Lopez",tracy.russell@example.net,835.957.4114,1998 Innovation Way,Chicago,IL,60601,United States,53,enhance plug-and-play technologies,Discussed the benefits of Rust over C++ for their new engine.,2025-06-17T15:30:47.575675,LRN314
dd7c800b-e829-49a2-ab78-cec0d947d952,db9f6c42-5973-40a8-a2c6-315b6dd39d6c,Rodney,Turner,VP of Engineering,Castillo PLC,rodney.turner@example.com,475-522-9853,6732 Maple Ave,New York,NY,10001,United States,24,envisioneer B2C niches,Curious about our websocket support for real-time chat.,2025-04-28T20:40:08.692558,LRN314
5e7597c6-5b5c-42c8-bfbe-25427f6fe61d,18673998-45ec-4f4f-b1ce-2f02c918830f,Tiffany,Nguyen,Cloud Architect,Leon PLC,tiffany.nguyen@example.net,550-703-1239x64555,3715 Market St,Austin,TX,73301,United States,3,streamline out-of-the-box users,Wants to integrate our widget into their React Native application.,2025-08-24T16:41:13.541214,LRN314
2451337d-95fc-42c4-9b9f-8265b90d6cc3,e8656a22-080c-4017-81d0-d711a052af65,Rodney,Sanders,Data Engineer,Rich-Chapman,rodney.sanders@example.com,001-581-673-4701x85910,6031 Washington St,Chicago,IL,60601,United States,32,incubate magnetic interfaces,Evaluating our platform against AWS and Azure alternatives.,2025-07-12T14:25:57.609288,LRN314
43677740-7bf0-4066-b97a-fc48e4ccbd75,7057b135-726d-4ea1-8fa4-e4870a1e45e6,Wesley,Cooper,Software Engineer,"Taylor, Arellano and Johnson",wesley.cooper@example.org,860-399-4737,757 Tech Blvd,Atlanta,GA,30303,United States,47,deliver back-end e-services,Needs a solution for log aggregation and anomaly detection.,2025-02-27T11:01:54.334003,LRN314
f1629b94-c751-429f-a358-70f282e9f18a,def6b281-705a-42e0-ac5d-6faf05b215b3,Linda,Gutierrez,Cloud Architect,"Hernandez, Cain and Harmon",linda.gutierrez@example.org,913.304.5047x40171,200 Tech Blvd,Los Angeles,CA,90001,United States,57,grow extensible paradigms,Wants to integrate our widget into their React Native application.,2025-05-30T22:51:58.303660,LRN314
485f99f3-a707-476a-941b-f6d973b4a9d7,3d10d067-8e33-4fc5-8689-be5b259a73eb,Juan,Perez,QA Engineer,Torres-Perkins,juan.perez@example.net,911-585-8933x54110,9938 Innovation Way,Seattle,WA,98109,United States,31,extend impactful niches,Inquired about volume pricing for high-throughput data streaming.,2025-01-23T16:29:32.905420,LRN314
220c7890-addc-4b39-8b11-c90eda9b5e18,bd51fa51-b3f6-424d-a80a-52657cdfe155,Jeffrey,Fox,Mobile Developer,Fitzpatrick Inc,jeffrey.fox@example.com,001-525-467-7211,6719 Tech Blvd,Seattle,WA,98109,United States,95,target vertical vortals,Exploring options for edge computing and low-latency delivery.,2025-05-13T02:59:55.415014,LRN314
822e8734-4521-40a5-baa4-ed3e21e5b79b,ecd5fd1f-a8a0-41ad-9f1f-90a1c63764f6,Allison,Green,Systems Administrator,Lane-Aguilar,allison.green@example.com,(827)787-2988x25357,8816 Broadway,New York,NY,10001,United States,63,scale dynamic deliverables,Looking for a partner to help with a large-scale cloud migration.,2025-01-12T14:00:20.704626,LRN314
662866f0-e7ba-480a-b561-78274f9385b1,4edb38cc-f87b-41e7-ace9-086265a7931a,Carrie,Rivera,Cloud Architect,Smith LLC,carrie.rivera@example.net,730-467-1068x5698,232 Maple Ave,Bangalore,KA,560001,India,38,streamline transparent info-mediaries,Concerned about data sovereignty and GDPR compliance in the EU region.,2025-02-08T22:16:47.232357,LRN314
8b876710-4edf-4065-b17d-daf2ac8db835,147c2e84-b935-4c27-9d57-e5c671e6ab26,Robert,Henry,Developer Advocate,"Holland, Lopez and Cummings",robert.henry@example.net,+1-701-682-0195x8306,6780 Market St,Boston,MA,02110,United States,52,extend cross-media methodologies,Looking for a partner to help with a large-scale cloud migration.,2025-07-17T02:31:33.893156,LRN314
bd9fd4df-8ac5-409d-acd2-967f01f8f1b0,96abe20f-99a0-4f91-9931-d815b7cc2ce7,Johnny,Walsh,Frontend Developer,"Strickland, Campbell and Elliott",johnny.walsh@example.com,465.925.7907x98356,9649 Innovation Way,Atlanta,GA,30303,United States,40,redefine leading-edge mindshare,Exploring options for edge computing and low-latency delivery.,2025-06-12T11:56:04.862203,LRN314
cdf848ea-a108-4b3a-9cf4-efc6a747a457,4bc07f01-bc66-4f80-845b-bcdd87190792,Shelly,Mendez,Machine Learning Engineer,Ramos Inc,shelly.mendez@example.com,578-883-7211x9953,3983 Broadway,Toronto,ON,M5H 2N2,Canada,68,transform holistic deliverables,Inquired about volume pricing for high-throughput data streaming.,2025-09-22T12:44:04.821978,LRN314
6e3d9469-95e3-413f-a481-731e70f1f4a5,30ef3433-4df9-44e6-8e16-cb10bd135889,Raymond,Buchanan,Mobile Developer,"Kelly, Young and Ford",raymond.buchanan@example.com,820-706-2130x865,4897 Innovation Way,Guadalajara,JAL,44100,Mexico,91,incentivize turn-key e-business,Exploring options for edge computing and low-latency delivery.,2025-08-20T02:47:54.837104,LRN314
9f78b293-e236-4f45-89d8-f32349a13fb4,12e13ac3-b034-4a0b-9ea2-9f64c19e85c9,Mariah,Shelton,Developer Advocate,Preston LLC,mariah.shelton@example.com,940-202-3118x770,4267 Innovation Way,Montreal,QC,H3B 1A7,Canada,13,syndicate seamless ROI,Encountered friction with the SSO setup; needs technical support.,2025-06-30T09:19:21.546087,LRN314
e4c9074f-b836-42a8-aedf-e23a3823aa81,89877230-d07c-4b9b-b89f-9e56ab030bb3,Ronald,Johnson,Developer Advocate,Ramirez LLC,ronald.johnson@example.org,320.413.7423x3813,807 Market St,New York,NY,10001,United States,39,extend turn-key bandwidth,Looking to replace their current data warehouse with a more scalable solution.,2025-05-12T21:13:43.994109,LRN314
daa34627-f203-46e3-b615-235a1ed76eae,5cadf2e3-8fb4-4d70-ab51-ac085e016c51,Lucas,Clark,Systems Administrator,Kim Group,lucas.clark@example.com,620-746-8439,8632 Main St,Montreal,QC,H3B 1A7,Canada,15,synergize global e-services,Suffering from database locking issues; looking for advice.,2025-03-14T13:25:02.221988,LRN314
58312baa-1bf0-4411-91f5-6288ffc6b294,e592b568-3b26-4653-aad5-e9f072247e5b,Holly,Barnes,iOS Developer,Owens Group,holly.barnes@example.com,926.987.5196,8766 Innovation Way,Montreal,QC,H3B 1A7,Canada,14,expedite virtual vortals,Looking for a solution to optimize their CI/CD pipeline latency.,2025-04-02T22:40:28.052644,LRN314
63804225-bfc4-4cf4-880a-0c361ef35f36,30eaaf97-4dc5-4d06-ac54-7952ed6124b9,Mary,Booth,Data Engineer,"Montes, Johnson and Simmons",mary.booth@example.net,+1-778-909-0569,7971 Washington St,Beijing,Beijing,100000,China,5,embrace distributed models,Looking for a partner to help with a large-scale cloud migration.,2025-02-23T12:47:08.341281,LRN314
e53d230e-4ba5-46ce-aec5-82e02a1acdd4,d274bc86-5771-4e1a-b548-0946b547f3da,Matthew,Norris,Backend Developer,Cruz LLC,matthew.norris@example.org,(984)626-4175,5595 Washington St,New York,NY,10001,United States,90,engineer B2B info-mediaries,Needs better documentation for the Python SDK.,2025-05-03T09:32:48.303831,LRN314
5577e6b7-8c3f-4945-bef2-72b06a5b773c,a0acb7fc-76cf-4f07-aff7-cd700f39212d,Cassandra,Mckee,QA Engineer,Harris-Wheeler,cassandra.mckee@example.com,436-592-7481x0198,9121 Main St,New York,NY,10001,United States,54,streamline world-class content,Discussed potential integration with their existing Kubernetes cluster.,2025-09-27T18:33:14.881904,LRN314
f52067b0-479d-41ad-bb69-902a624c5857,1342135b-b703-4aa8-809c-59683edf0f8a,Carrie,Simmons,Full Stack Developer,Jacobs-Neal,carrie.simmons@example.com,(799)230-4814x3740,8606 Broadway,Los Angeles,CA,90001,United States,54,deploy best-of-breed eyeballs,Discussed the benefits of Rust over C++ for their new engine.,2025-09-19T00:32:37.922270,LRN314
11ae7213-e8be-4210-b05f-326370b4ceac,0d40b5f8-a0fe-4b8b-9295-56af42e89188,Madeline,Sanchez,Technical Writer,"Kelley, Hernandez and Hatfield",madeline.sanchez@example.com,001-634-679-7017x82529,2280 Oak St,Montreal,QC,H3B 1A7,Canada,13,empower global action-items,Wants to integrate our widget into their React Native application.,2025-09-03T03:30:16.630051,LRN314
7c84674b-7136-4f05-b3c0-c4fd8c174ed9,2a74111d-a705-4771-a626-ce77aba41047,Nicole,Sellers,Product Manager,Mckay-Montgomery,nicole.sellers@example.com,323.696.8568x761,2556 Broadway,Austin,TX,73301,United States,94,seize wireless web services,Interested in migrating legacy systems to a microservices architecture.,2025-08-28T00:24:32.197678,LRN314
d2444cfc-33e1-4f05-ba5a-f0c44c681dc9,a9607e3b-186f-4103-9153-5b6de67ecb0a,Sara,Sanchez,QA Engineer,Jackson Inc,sara.sanchez@example.net,(911)667-8201x0289,6805 Oak St,Chicago,IL,60601,United States,13,monetize out-of-the-box content,Wants to schedule a deep-dive demo of the new security features.,2025-04-02T18:04:57.296160,LRN314
adc3794e-170a-4f10-af58-2eafb552ae25,4917cf44-557f-41b3-8ed6-a4a750d00bac,Ethan,Martin,Technical Writer,"Austin, Edwards and Rodriguez",ethan.martin@example.net,689-390-1402,2095 Main St,Miami,FL,33101,United States,38,streamline dynamic experiences,Asked detailed questions about our GraphQL API rate limits.,2025-08-02T22:55:12.893387,LRN314
a73aafe6-3506-45f1-906b-c0d311957797,c1d70180-fc66-48c5-9595-70d1dbc2bdbb,Julie,Thomas,UX/UI Designer,"White, Contreras and Castro",julie.thomas@example.com,817.734.0227x881,2177 Broadway,Boston,MA,02110,United States,68,synthesize sticky vortals,Exploring options for edge computing and low-latency delivery.,2025-06-23T23:05:10.330769,LRN314
e5ee6529-489d-475a-a0ee-4aa71d84b9b4,24ef700b-05a1-4aa2-903c-3d4c5a41a262,Brian,Ramirez,UX/UI Designer,Perkins-Ball,brian.ramirez@example.org,(852)887-5690x9799,7345 Washington St,Mexico City,CDMX,01000,Mexico,27,engineer 24/365 markets,Looking for a solution to optimize their CI/CD pipeline latency.,2025-07-06T10:46:54.472823,LRN314
71a8cf84-affb-49b2-9964-773b8509981e,82ff661a-a622-4742-acd1-9320a9191714,Joann,Herrera,Network Engineer,"Santana, Klein and Jefferson",joann.herrera@example.com,+1-234-725-2287,1276 Maple Ave,Atlanta,GA,30303,United States,76,envisioneer global initiatives,Curious about our websocket support for real-time chat.,2025-02-20T11:37:58.384693,LRN314
87cbeb18-3268-4742-a03f-a1282226558b,2600c6fa-c300-4c4a-9cb9-352acd5b6cb6,Sherry,Garcia,Systems Administrator,King-Moreno,sherry.garcia@example.net,3093949238,2229 Main St,Seattle,WA,98109,United States,22,deploy granular technologies,Asked about our uptime SLAs and incident response times.,2025-03-19T14:33:27.816271,LRN314
f0011b09-718b-43ea-8e3d-db3d6b7ea4f7,b38dd899-0c55-4083-85d9-d5fb9a5edc9a,Eric,Taylor,Full Stack Developer,Garcia Inc,eric.taylor@example.com,(321)415-3803x934,7986 Market St,Chicago,IL,60601,United States,5,e-enable open-source vortals,Interested in migrating legacy systems to a microservices architecture.,2025-10-03T12:39:16.902495,LRN314
041da7f6-9819-4707-813c-7569ecdb9e4c,2b7320ec-a864-4c5a-a5f0-1fa46ef7f6e6,Margaret,Phelps,Engineering Manager,"Nelson, Jones and Alexander",margaret.phelps@example.com,001-201-504-4322x425,4715 Main St,Chicago,IL,60601,United States,87,whiteboard frictionless functionalities,Discussed the benefits of Rust over C++ for their new engine.,2025-01-14T08:48:24.497057,LRN314
0f7fb323-f058-43c9-a2c3-d90166328604,36a10205-7951-465f-98f2-93d575f2aea4,Nancy,Peters,Machine Learning Engineer,Lee-Romero,nancy.peters@example.org,001-585-281-8633,6229 Broadway,Montreal,QC,H3B 1A7,Canada,96,re-intermediate best-of-breed web services,Asked about our uptime SLAs and incident response times.,2025-08-01T11:54:10.168164,LRN314
df47b0e7-ebec-4b5a-b126-a511a03e89f8,07d6a9d2-f9e1-47bb-aeb6-370d07f62566,Julie,Garcia,Technical Product Manager,"Bailey, Riddle and Larsen",julie.garcia@example.com,+1-823-458-6791x3127,4859 Main St,Los Angeles,CA,90001,United States,92,target virtual channels,Concerned about data sovereignty and GDPR compliance in the EU region.,2025-09-05T00:46:55.714247,LRN314
0f569425-a67c-4148-8b91-4ae8e2918949,61c2ea51-fbda-4ea2-83e0-a9838106c564,Pamela,Tran,Mobile Developer,"Phillips, Stephens and Smith",pamela.tran@example.net,3077289772,5553 Oak St,Toronto,ON,M5H 2N2,Canada,98,enhance clicks-and-mortar users,Mentioned a need for real-time analytics and dashboarding.,2025-05-27T17:23:14.575626,LRN314
e6120533-856f-4264-a541-525b0fc5afaf,c3cf2857-f441-4858-b8d6-04a358f23406,Nicholas,White,Software Engineer,Jennings and Sons,nicholas.white@example.com,001-508-853-1527x54520,8126 Washington St,Boston,MA,02110,United States,99,aggregate out-of-the-box models,Needs a solution for log aggregation and anomaly detection.,2025-08-15T14:42:25.687401,LRN314
f43bc483-e631-424c-aede-5bb807bbd110,0b297466-aa3a-4068-95ff-a642e6e2b503,Steven,Hernandez,Full Stack Developer,"Moore, Wells and Moore",steven.hernandez@example.net,676.512.4521,7858 Innovation Way,New York,NY,10001,United States,42,morph ubiquitous solutions,Looking for a solution to optimize their CI/CD pipeline latency.,2025-02-21T17:00:22.985296,LRN314
cf3a730e-88b9-4c46-aea0-e6e94c37fcd4,f93c2dba-9217-4d2b-bb71-8d525d4a9d4b,Betty,Mckinney,Machine Learning Engineer,Lee-Stuart,betty.mckinney@example.org,(941)562-8900x42437,1160 Main St,Shanghai,Shanghai,200000,China,65,innovate distributed ROI,Inquired about volume pricing for high-throughput data streaming.,2025-08-29T14:14:51.036838,LRN314
dc264e6a-eddb-430b-8e11-d5091e00fe64,f2b174e4-233f-4108-b3b0-7e004bf24acf,David,Booth,Data Engineer,"Woods, Lopez and Montgomery",david.booth@example.com,7846635914,4513 Oak St,Mexico City,CDMX,01000,Mexico,49,e-enable collaborative applications,Looking for a partner to help with a large-scale cloud migration.,2025-05-21T06:54:41.663321,LRN314
dd6972e2-f803-448c-9c45-4cc82ff29c4a,c3cdac8c-6c97-40f3-a767-fd1b2130d16a,John,Gonzales,Product Manager,Rios Ltd,john.gonzales@example.com,(519)755-9156x5585,3263 Maple Ave,Monterrey,NL,64000,Mexico,75,productize front-end deliverables,Wants to schedule a deep-dive demo of the new security features.,2025-09-19T04:10:10.465534,LRN314
cd6eb356-d436-4587-a03e-49510763c108,0ce2a938-dd71-4ad2-b864-f3a24f598c79,Tina,Paul,Backend Developer,"Perkins, Porter and Collins",tina.paul@example.com,753-883-9946x525,2385 Main St,Montreal,QC,H3B 1A7,Canada,23,unleash revolutionary info-mediaries,Wants to know more about our machine learning model training capabilities.,2025-01-27T07:46:33.804697,LRN314
a8478d03-eff1-4676-9770-f75e6719799a,46895321-2593-491e-a81d-9dfd1b91e53a,Michael,Weber,Data Engineer,Boyd-Ray,michael.weber@example.org,(688)515-8198,7004 Market St,Beijing,Beijing,100000,China,64,re-contextualize cross-platform relationships,Encountered friction with the SSO setup; needs technical support.,2025-02-09T09:47:24.943292,LRN314
02045a40-59f0-4eef-939b-f32d8a77cf19,340f3a99-da65-435e-afd7-c13ac9886779,Richard,Olsen,Mobile Developer,Miller and Sons,richard.olsen@example.com,001-894-553-2949,4521 Tech Blvd,Los Angeles,CA,90001,United States,22,empower proactive supply-chains,Suffering from database locking issues; looking for advice.,2025-08-24T05:52:53.183191,LRN314
8d2e6168-57f7-4dbd-b315-9ef5c419d9cc,e55e414b-e4ef-474c-a65b-559591b42605,Lindsey,Estes,Backend Developer,Martinez-Marshall,lindsey.estes@example.org,001-291-815-8067x014,9509 Innovation Way,Boston,MA,02110,United States,7,exploit B2C functionalities,Suffering from database locking issues; looking for advice.,2025-02-02T09:54:03.569031,LRN314
0f17db7e-fa31-42f8-9a3d-662c1a322324,76936dc0-a770-4c73-8201-74deae9a701d,Robert,Lewis,Test Automation Engineer,Salazar Group,robert.lewis@example.org,001-795-982-3040x7201,6567 Maple Ave,Stockholm,Stockholm,111 22,Sweden,39,productize distributed interfaces,Encountered friction with the SSO setup; needs technical support.,2025-01-23T01:35:03.351918,LRN314
87f4b1ae-55ea-4014-a90d-080f2fe0f71e,9ce5f018-864b-4e64-a5a2-529afbc309b3,Jason,Cox,Solutions Architect,Berry Ltd,jason.cox@example.org,001-894-497-4942x5393,4334 Maple Ave,Chicago,IL,60601,United States,6,incubate extensible initiatives,Looking to replace their current data warehouse with a more scalable solution.,2025-05-09T04:35:43.361365,LRN314
28f135c7-c238-46f0-98b5-a08d22fa562b,be08ed7a-5319-4ccc-b45d-0b08e9488177,Scott,Rogers,Security Engineer,Leon-Webb,scott.rogers@example.com,892-658-8869x299,608 Market St,Monterrey,NL,64000,Mexico,73,mesh end-to-end solutions,Encountered friction with the SSO setup; needs technical support.,2025-02-17T23:07:05.553370,LRN314
9bd1b45b-8007-4196-bc1e-a02b76c70ef0,ec457ea5-7921-4c24-8a27-f874321f6f18,Peter,Evans,Engineering Manager,"Rice, Powers and Porter",peter.evans@example.org,(692)826-0703,9597 Main St,Osaka,Osaka,530-0001,Japan,24,disintermediate strategic portals,Exploring options for edge computing and low-latency delivery.,2025-04-14T09:59:11.443802,LRN314
6642771b-b3c3-4979-88c1-09002d8f92d0,19e47056-0352-49a3-86f0-b9bac7cb938d,Jacob,Matthews,Cloud Architect,Mann Group,jacob.matthews@example.com,6222262550,2894 Tech Blvd,Seattle,WA,98109,United States,21,re-contextualize out-of-the-box models,Mentioned a need for real-time analytics and dashboarding.,2025-08-01T09:46:13.345802,LRN314
22b167cf-5161-467a-af88-0babcebf1430,1bc42ca3-052d-40df-8172-a8df32337440,Daniel,James,Systems Administrator,"Ramirez, Parker and Moore",daniel.james@example.net,+1-869-639-8761x664,4789 Tech Blvd,Ottawa,ON,K1P 1J1,Canada,26,mesh best-of-breed markets,Concerned about data sovereignty and GDPR compliance in the EU region.,2025-01-20T04:48:22.382261,LRN314
642c5eb6-f1b8-407d-96e4-1495d90b2b17,a31fb5e1-5604-4395-857e-78599ed3ddfd,Christopher,Kelly,Security Engineer,"Walters, Lane and Johnson",christopher.kelly@example.org,466-618-3813,7686 Innovation Way,San Francisco,CA,94105,United States,56,iterate transparent e-tailers,Evaluating the feasibility of a multi-tenant architecture.,2025-08-05T18:37:26.300070,LRN314
aa9e264b-b2d9-4fb5-9a9a-5dc71069a915,3a268196-17c1-4f41-be1d-9cb228badb84,Kelsey,Rodriguez,Cybersecurity Analyst,Estrada Inc,kelsey.rodriguez@example.com,2325414626,423 Market St,San Francisco,CA,94105,United States,51,re-contextualize global niches,Looking to replace their current data warehouse with a more scalable solution.,2025-04-24T11:55:21.439816,LRN314
d2394d2e-bc22-4a3a-80de-1dd8193a14a5,ff7b3ac7-8e74-40a6-854b-bb691e96969b,Debbie,Lindsey,AI Researcher,"Gallagher, Campbell and Collier",debbie.lindsey@example.net,+1-796-221-3210x5779,5266 Tech Blvd,Montreal,QC,H3B 1A7,Canada,87,harness transparent supply-chains,Mentioned a need for real-time analytics and dashboarding.,2025-06-27T06:49:44.101626,LRN314
0255035c-7c59-4187-9d80-c04dd70a4301,41c493eb-2294-42c4-ba19-7b259eb80606,Miguel,Phillips,Android Developer,"French, Coleman and Tucker",miguel.phillips@example.net,(843)616-7547x038,6341 Oak St,San Francisco,CA,94105,United States,26,deploy world-class mindshare,Discussed the benefits of Rust over C++ for their new engine.,2025-05-29T01:26:50.463071,LRN314
6293acb8-c354-4c96-bcf9-683d44b0059d,46a4a784-bd72-4517-a63f-9a8dab0263e1,Jean,Garcia,Engineering Manager,Hunter-Nelson,jean.garcia@example.com,715-516-1201x3188,8034 Broadway,Austin,TX,73301,United States,80,syndicate best-of-breed info-mediaries,Mentioned a need for real-time analytics and dashboarding.,2025-01-30T16:38:43.207000,LRN314
0dc4a86c-fb27-4865-8235-42c2cfa31e94,bcaf4b0a-d47e-40e0-ab82-2874da20dfec,Gina,Rhodes,CTO,"Warren, Lopez and Jackson",gina.rhodes@example.net,342-400-4861,5849 Tech Blvd,Bangalore,KA,560001,India,92,streamline vertical convergence,Encountered friction with the SSO setup; needs technical support.,2025-07-27T09:33:43.832425,LRN314
c9410517-c785-4b3a-a451-12e73facea36,72e26c68-61f3-40e1-a753-e56dc0f3bdd2,Edward,Dean,Developer Advocate,Wallace-Young,edward.dean@example.net,479-492-1227x24174,4369 Innovation Way,Manchester,England,M1 1AE,United Kingdom,34,visualize interactive platforms,Interested in migrating legacy systems to a microservices architecture.,2025-06-16T21:38:27.186278,LRN314
b009c3c8-8b6c-4897-bb4c-8e208b9b886c,a4dffcc8-969c-4077-b7da-082a11eb17a0,James,Watts,AI Researcher,Taylor-Wilson,james.watts@example.org,664.738.7228,7519 Market St,Miami,FL,33101,United States,4,unleash B2C partnerships,Looking for a solution to optimize their CI/CD pipeline latency.,2025-01-05T06:00:00.096223,LRN314
a133427c-bd07-4e9a-b843-2480177e6419,adaa0da0-30fe-4e20-aea9-8b2288187a33,James,Flores,CTO,Marshall-Gallagher,james.flores@example.com,(940)788-6805x62179,3597 Washington St,Miami,FL,33101,United States,92,enhance one-to-one infrastructures,Inquired about volume pricing for high-throughput data streaming.,2025-06-21T00:08:01.198323,LRN314
a5418a5e-cc94-4964-9563-47a07ecbbcdf,c49bcc59-013d-4e05-91b4-f693d0b291e0,Angela,Davidson,Product Manager,Quinn PLC,angela.davidson@example.com,601-523-4327x8160,800 Innovation Way,Atlanta,GA,30303,United States,3,engage best-of-breed technologies,Wants to schedule a deep-dive demo of the new security features.,2025-01-23T02:16:41.260128,LRN314
28aa7f96-bcf1-49f7-975d-e719e25ffdfd,e5894aae-301e-44b6-8c30-c7f2ab5c3330,Michael,Kent,Backend Developer,Freeman-Rodriguez,michael.kent@example.net,(369)967-7619x05934,1549 Broadway,Miami,FL,33101,United States,100,benchmark vertical initiatives,Looking to replace their current data warehouse with a more scalable solution.,2025-08-04T18:07:26.030740,LRN314
a5008b8a-888d-43fc-b752-d822632fd9d9,205ee9d3-8fdd-4719-a41f-1f20d2fb9230,Brandi,Cochran,Senior Software Engineer,Ramirez-Larson,brandi.cochran@example.com,(968)602-3694,2443 Broadway,Atlanta,GA,30303,United States,25,streamline wireless initiatives,Discussed potential integration with their existing Kubernetes cluster.,2025-06-16T16:35:39.109824,LRN314
f74aa5ef-0e49-4e5d-be1b-ce28d6746f9f,03d56f09-4bd2-47bd-9b2b-0f24fcc21029,Dustin,Watts,Data Scientist,Charles-Kennedy,dustin.watts@example.net,001-715-493-5863x454,9519 Market St,Vancouver,BC,V6B 1P1,Canada,24,expedite front-end e-commerce,Asked detailed questions about our GraphQL API rate limits.,2025-02-14T23:16:47.610747,LRN314
8439266a-56e9-4213-a5ab-908a13848696,5118774d-83e0-4037-af07-8ef6b758d84c,Alejandro,Johnson,Technical Writer,"Wells, Sheppard and Small",alejandro.johnson@example.net,544-750-5731x87622,272 Main St,Atlanta,GA,30303,United States,22,innovate end-to-end relationships,Wants to schedule a deep-dive demo of the new security features.,2025-08-25T00:19:06.509659,LRN314
25c24471-2db8-4ca2-9553-1a224f76b8d5,6e301401-a248-4c42-a944-ef9aa174d2a8,James,Matthews,Site Reliability Engineer (SRE),Herrera PLC,james.matthews@example.net,7712375963,2456 Market St,Atlanta,GA,30303,United States,89,implement seamless e-markets,Looking for a partner to help with a large-scale cloud migration.,2025-09-20T13:41:53.235002,LRN314
12f4432c-9e92-4bd3-8b64-36abaf3e46c6,28be9c76-9f59-4291-b533-884c9bd7222f,Stephanie,Wells,QA Engineer,Richardson PLC,stephanie.wells@example.net,810-794-1542,3915 Main St,Ottawa,ON,K1P 1J1,Canada,45,unleash enterprise synergies,Asked if we support Terraform providers for infrastructure as code.,2025-09-09T00:24:21.711218,LRN314
cce1f499-4533-440f-9f26-7736f44c703e,eb83c271-383d-495a-8f51-e836e3510daa,Travis,Davis,Test Automation Engineer,"Butler, Caldwell and Sanders",travis.davis@example.net,304.548.6817,6984 Innovation Way,New York,NY,10001,United States,100,embrace end-to-end methodologies,Wants to schedule a deep-dive demo of the new security features.,2025-02-24T21:42:54.239713,LRN314
e15add76-0124-4f48-93a6-b5b932d3ea20,847fd5db-5a8d-4298-9702-ac6f3daba4e8,Jennifer,Mccoy,Engineering Manager,Ramos PLC,jennifer.mccoy@example.com,311.448.9566x53616,6718 Maple Ave,New York,NY,10001,United States,92,incubate granular systems,Inquired about volume pricing for high-throughput data streaming.,2025-08-09T14:20:28.145963,LRN314
3a84a5ca-d4a0-4df7-824d-35daab7b89e7,98a92846-26d2-4671-88a5-e7e6257ca3b7,Zachary,Fletcher,Systems Administrator,Shea-Baker,zachary.fletcher@example.net,001-506-340-9454x065,214 Market St,New York,NY,10001,United States,86,drive virtual schemas,Curious about our websocket support for real-time chat.,2025-06-07T18:53:03.529791,LRN314
f50b04b1-d08d-4416-8ba8-8794bc211197,0a5cf4d4-0cef-499b-8162-cef57fd0666d,Sean,Chapman,Data Engineer,Christensen Group,sean.chapman@example.com,001-933-400-0188x44574,1159 Innovation Way,Monterrey,NL,64000,Mexico,51,synthesize best-of-breed eyeballs,Asked if we support Terraform providers for infrastructure as code.,2025-04-30T11:47:22.390054,LRN314
8e62ea53-775a-4e0f-adaa-47eb2ef24c59,7b4f5ad3-2df2-45f9-b173-e18c11079048,Curtis,Perez,Security Engineer,Reeves Ltd,curtis.perez@example.net,001-936-919-9202x90418,8028 Maple Ave,Beijing,Beijing,100000,China,81,syndicate dynamic vortals,Asked detailed questions about our GraphQL API rate limits.,2025-05-15T02:06:54.337457,LRN314
2ca894d6-eaf9-434a-ab9f-bdd6928d96a4,c590ec0e-c8cc-4461-a862-c8507cc2a007,Gregory,Dorsey,Data Engineer,"Richard, Patterson and Griffith",gregory.dorsey@example.net,+1-882-923-7286x97469,9986 Market St,Dublin,Dublin,D01,Ireland,91,empower collaborative functionalities,Wants to integrate our widget into their React Native application.,2025-09-22T03:06:42.684371,LRN314
5b9477d9-8556-4cd9-8560-c8a745557bdb,d1040f57-c15b-4907-bb20-ac51be5eaf79,Angela,Morgan,Test Automation Engineer,"Baker, Haney and Sexton",angela.morgan@example.net,388.825.8985x36103,7137 Washington St,Denver,CO,80202,United States,86,innovate B2C synergies,Wants to schedule a deep-dive demo of the new security features.,2025-01-24T17:27:46.338199,LRN314
6a7e2baf-cd49-42d1-a022-d7846c7a7df5,ab8fdea9-4b11-475f-ab65-9f62df327976,Debra,Gonzalez,UX/UI Designer,Medina-Berry,debra.gonzalez@example.org,(561)972-2877x903,475 Market St,Los Angeles,CA,90001,United States,73,orchestrate world-class eyeballs,Discussed potential integration with their existing Kubernetes cluster.,2025-04-01T22:12:38.723892,LRN314
