Scan ID,Attendee ID,First Name,Last Name,Title,Company,Email,Phone,Address,City,State,Postal Code,Country,Lead Score,Qualifiers,Notes,Timestamp,Session ID
4052f51d-cc1b-443a-9ef5-5d083482d1af,f487e979-d0c5-4f6e-9f71-ab62c370a3bb,Alexander,Chavez,UX/UI Designer,Scott-Todd,alexander.chavez@example.org,+1-996-919-1554x4395,6910 Market St,Amsterdam,NH,1012,Netherlands,74,engage collaborative experiences,Asked detailed questions about our GraphQL API rate limits.,2025-09-15T20:32:05.087094,LRN314
9787230b-a4f2-47f2-8ae4-1b00fa7c958e,288b0466-b52e-4b84-941a-b234503287a8,Emily,Short,AI Researcher,Meyers-Ortiz,emily.short@example.com,6923953604,3786 Broadway,Los Angeles,CA,90001,United States,80,revolutionize cross-media channels,Curious about our websocket support for real-time chat.,2025-05-09T14:44:57.760963,LRN314
b391a455-6a13-492d-a0b2-6f2c939f2dc8,b7dd5e2c-22a4-4ce8-a21c-709d5c67730d,Sara,Chavez,Frontend Developer,Scott-Perez,sara.chavez@example.org,425.275.4211x7041,8414 Oak St,Austin,TX,73301,United States,12,harness proactive interfaces,Suffering from database locking issues; looking for advice.,2025-06-30T11:45:42.561274,LRN314
57366204-c514-41b3-9939-33ae6264f65f,4391f2ae-0d1a-41f6-a882-d45d46bf2f26,Alexander,Kelly,Systems Administrator,Fleming PLC,alexander.kelly@example.net,367.856.6224,1336 Washington St,Bangalore,KA,560001,India,64,transition killer methodologies,Suffering from database locking issues; looking for advice.,2025-03-09T06:08:46.069385,LRN314
1d5e3ed4-d630-48b6-9d16-1a2d1b8dba5b,689be8d0-8950-40a7-b893-6671d630047a,Elizabeth,Hart,DevOps Engineer,Hansen-Santiago,elizabeth.hart@example.net,+1-385-618-9164,1362 Broadway,Miami,FL,33101,United States,94,enhance B2C info-mediaries,Needs better documentation for the Python SDK.,2025-05-09T01:33:59.142678,LRN314
613f05c8-fc80-44b4-8ecd-dc72f420753d,01544d13-39be-4239-8dc4-5d45d5f3b1a4,Teresa,Phelps,AI Researcher,Noble-Ritter,teresa.phelps@example.net,4258631610,4133 Maple Ave,Atlanta,GA,30303,United States,6,optimize clicks-and-mortar portals,Excited about the roadmap for serverless function support.,2025-01-19T17:49:39.895608,LRN314
d3f17350-7970-42ba-89ea-d0f0e1a58246,0be0967d-a545-45f0-9d1e-a9cf2b71772d,Edwin,Stafford,Network Engineer,Gonzales-Franco,edwin.stafford@example.net,+1-573-911-8236,4467 Market St,Monterrey,NL,64000,Mexico,98,enhance enterprise systems,Looking for a partner to help with a large-scale cloud migration.,2025-07-25T17:52:43.029212,LRN314
3ba53099-d62e-4f49-9f0e-2f835719ce10,51be13a6-3b3f-405f-9c7d-d53a8256e7d3,Jack,Castro,AI Researcher,"Hunt, Mcbride and Sanchez",jack.castro@example.com,(549)508-6819,7390 Broadway,Toronto,ON,M5H 2N2,Canada,64,transition out-of-the-box convergence,Mentioned a need for real-time analytics and dashboarding.,2025-06-11T15:47:46.871410,LRN314
b5d6329c-5788-4e9c-ae43-2c3297116fdc,1518cc42-6f0d-4995-8d3d-552eb290f3c4,Brandi,Hamilton,Mobile Developer,Grimes PLC,brandi.hamilton@example.net,+1-631-978-6656x953,2773 Broadway,Miami,FL,33101,United States,79,morph customized systems,Exploring options for edge computing and low-latency delivery.,2025-06-23T17:06:23.907344,LRN314
d8335438-54eb-4883-82c7-79d516098e63,7f39092b-3487-4675-8242-52c7d8cd9042,Justin,Adams,Site Reliability Engineer (SRE),Gates Ltd,justin.adams@example.com,216.840.9661x4303,293 Oak St,Calgary,AB,T2P 1J9,Canada,1,syndicate viral models,Looking for a partner to help with a large-scale cloud migration.,2025-01-07T13:44:14.588886,LRN314
fad05cf9-807e-46c6-a49e-db850e827686,73725e25-8d2b-4305-bc5b-f8e585f002c5,Jennifer,Adams,Solutions Architect,Dixon-Woods,jennifer.adams@example.org,699.880.8969x486,7296 Tech Blvd,San Francisco,CA,94105,United States,83,evolve killer info-mediaries,Wants to know more about our machine learning model training capabilities.,2025-08-07T08:34:24.286543,LRN314
391a6b92-c4f5-4243-bbd2-bea46fc272c8,648d1ee5-2f49-4014-ad5b-d08caa1633e1,Amanda,Pierce,Full Stack Developer,Miller-Buchanan,amanda.pierce@example.org,001-720-452-9549x76594,4320 Maple Ave,Miami,FL,33101,United States,1,strategize bleeding-edge channels,Discussed potential integration with their existing Kubernetes cluster.,2025-06-05T19:35:17.070624,LRN314
e432701b-8575-418a-8150-b6dba8de19eb,17006cd7-bacb-4ff9-a48d-e6377c734174,Robin,Evans,Data Scientist,Morgan-Stark,robin.evans@example.net,+1-211-401-5818x3448,3709 Tech Blvd,London,England,SW1A 1AA,United Kingdom,57,synergize visionary functionalities,Wants to know more about our machine learning model training capabilities.,2025-01-17T19:01:24.588458,LRN314
456c6cc1-9926-4dca-9333-32ed37ea2abc,21dc3cf5-efa6-4ac7-88b1-373f514d2347,Patricia,Harding,Cloud Architect,Rogers-Gentry,patricia.harding@example.com,(600)376-9236x0574,6021 Main St,Miami,FL,33101,United States,51,re-intermediate 24/365 markets,Interested in migrating legacy systems to a microservices architecture.,2025-04-15T02:26:32.076066,LRN314
1ac5646a-2b47-40d9-8c9a-e7a3815ed11c,a38bc918-3ae5-483d-a1a1-2d5fbd509c48,Steven,Cruz,Senior Software Engineer,"Foley, Rose and Watson",steven.cruz@example.com,697.368.2029,4793 Market St,Toronto,ON,M5H 2N2,Canada,96,re-intermediate out-of-the-box e-business,Wants to know more about our machine learning model training capabilities.,2025-01-28T03:59:04.545171,LRN314
b619732d-15c1-4531-8fa9-bf79571df4b0,9fb05582-90d8-419d-b088-b2f8bd6a6e60,Laurie,Morris,Software Engineer,"Holmes, Dennis and Rodriguez",laurie.morris@example.net,+1-366-874-8169x24962,5030 Innovation Way,San Francisco,CA,94105,United States,25,utilize interactive e-tailers,Inquired about volume pricing for high-throughput data streaming.,2025-03-28T02:50:52.089545,LRN314
966cba8f-d4c1-43e0-89bf-cc4c4f92b1a1,d666db9a-e2db-409b-acf5-ca54180d0035,Christopher,Webb,Software Engineer,"Smith, Macias and Jones",christopher.webb@example.net,917-326-8285,5958 Broadway,Atlanta,GA,30303,United States,16,envisioneer enterprise info-mediaries,Wants to schedule a deep-dive demo of the new security features.,2025-07-22T02:54:56.892168,LRN314
c1336ac8-89c1-4dd1-b4db-2b8e9dde3fb9,35131889-2552-46fa-9446-67f85727b144,Andrea,Bauer,CTO,Flores PLC,andrea.bauer@example.com,001-859-624-5115x77394,603 Main St,Vancouver,BC,V6B 1P1,Canada,17,productize B2B web-readiness,Concerned about data sovereignty and GDPR compliance in the EU region.,2025-06-14T14:11:22.432506,LRN314
6f74841c-df41-48b0-91bd-4e7c0cf13719,8911f69e-6c8e-4e70-b0e1-a2ed015c3da3,Peter,Mann,Backend Developer,"Tucker, Mora and Taylor",peter.mann@example.net,001-643-865-2657x34450,9897 Tech Blvd,Stockholm,Stockholm,111 22,Sweden,9,generate cross-platform paradigms,Inquired about volume pricing for high-throughput data streaming.,2025-03-11T17:20:14.984177,LRN314
e431bc07-8ef5-45fb-bcdb-f60d13875bb3,3ba20f83-653d-422c-bf39-0f27a758c510,Steven,Cole,Database Administrator,Taylor LLC,steven.cole@example.net,850.308.6736x17517,7320 Maple Ave,Boston,MA,02110,United States,8,reinvent virtual applications,Discussed the benefits of Rust over C++ for their new engine.,2025-05-17T09:39:43.670122,LRN314
03aa7f58-7f4a-4acf-a6c7-7e09e2ce9535,11117a40-00f5-4570-9e31-08e3645f7548,James,Rice,Machine Learning Engineer,"Stokes, Rogers and Hall",james.rice@example.net,367.445.5127,7044 Market St,Tokyo,Tokyo,100-0001,Japan,65,revolutionize real-time interfaces,Asked about our uptime SLAs and incident response times.,2025-02-10T17:08:32.955066,LRN314
579d9cbf-c0f1-4750-b15b-0bc9ee6a9f9e,0cd5d1ac-d585-47ae-9d5f-62386a332fe4,Samantha,Williams,Senior Software Engineer,"Shelton, Duran and Graham",samantha.williams@example.com,001-477-339-2140x56828,8645 Washington St,Los Angeles,CA,90001,United States,53,maximize e-business technologies,Interested in migrating legacy systems to a microservices architecture.,2025-08-29T14:38:09.835847,LRN314
d846c0c5-db20-44f1-944e-8e1df7639eac,bbc3d9dc-1a41-4230-82a2-d2695e78728a,Breanna,Duran,Product Manager,"Adams, Martinez and Diaz",breanna.duran@example.net,+1-387-349-5003x515,6871 Market St,Calgary,AB,T2P 1J9,Canada,2,deliver efficient functionalities,Looking for a partner to help with a large-scale cloud migration.,2025-03-08T17:03:11.411457,LRN314
92102390-fa91-46e9-a3b3-e79c8fb20cb5,66731d6c-895f-46c7-bdb2-dfaaab82de02,Connor,Mckay,iOS Developer,"Greene, Barnes and Martinez",connor.mckay@example.net,001-791-836-8413x158,1532 Market St,Atlanta,GA,30303,United States,52,iterate end-to-end systems,Evaluating the feasibility of a multi-tenant architecture.,2025-04-17T14:06:00.767447,LRN314
92cbca73-e350-4603-88c5-63d0dd20218e,e2a582e7-d854-4077-b69d-ccf4e1bce411,Andrew,Burch,Android Developer,Turner PLC,andrew.burch@example.net,(760)445-9184,6615 Broadway,Berlin,Berlin,10115,Germany,3,repurpose leading-edge methodologies,Asked about our uptime SLAs and incident response times.,2025-10-09T09:31:44.197371,LRN314
2e5c9cda-93f2-4c87-a74e-ba9ce2fead72,6595661d-eab7-4b45-859d-d24a2544a666,Cassidy,Martinez,Full Stack Developer,Kerr-Mccall,cassidy.martinez@example.org,9082444378,8299 Maple Ave,Los Angeles,CA,90001,United States,40,synthesize e-business info-mediaries,Wants to know more about our machine learning model training capabilities.,2025-06-07T09:39:46.359200,LRN314
c9001a4f-79ca-44c8-a64c-549b7a2c4f98,4eeb55de-bc92-4be8-87ed-a01a3281d47a,Ronald,Washington,AI Researcher,Davis Inc,ronald.washington@example.net,323.905.2686x524,789 Washington St,Mexico City,CDMX,01000,Mexico,79,exploit world-class web-readiness,Evaluating our platform against AWS and Azure alternatives.,2025-05-05T13:03:30.823177,LRN314
2ad62007-e9d9-42f6-97ce-5c7cddc17bf2,64a0893d-b2cb-4963-b1a0-123cad0dee95,Jeremy,Evans,Solutions Architect,"Santos, Torres and Fernandez",jeremy.evans@example.com,264-214-3661x736,4705 Washington St,New York,NY,10001,United States,63,evolve customized metrics,Wants to know more about our machine learning model training capabilities.,2025-04-19T13:42:52.702153,LRN314
1756d22f-45e5-42f7-9b37-12cb5aff84a6,2b383bc6-ac39-460a-b4c2-8a66236b3bee,Matthew,Morales,CTO,Hunt-Jensen,matthew.morales@example.net,897.371.7771x0672,7181 Maple Ave,Dublin,Dublin,D01,Ireland,40,reinvent B2C mindshare,Needs better documentation for the Python SDK.,2025-07-02T08:37:39.668694,LRN314
bdbd0105-ca47-4875-8163-ed6fbe9b7fb4,db0708d1-e10f-4495-9fa5-f3e8fdd5bafa,Jared,Phillips,Data Scientist,Page-Woods,jared.phillips@example.org,530-426-8831x38463,1210 Tech Blvd,Singapore,SG,049318,Singapore,97,matrix B2B info-mediaries,Discussed the benefits of Rust over C++ for their new engine.,2025-01-28T14:29:59.112585,LRN314
1322a3bc-ad8a-4e9c-ab57-5b440345fa54,25c95cfd-8e6c-49e7-98f9-7fbe82396cd5,Holly,Holt,Android Developer,Coleman-Martinez,holly.holt@example.net,(855)479-2320x361,5130 Main St,Boston,MA,02110,United States,98,implement efficient interfaces,Exploring options for edge computing and low-latency delivery.,2025-07-20T17:08:25.264575,LRN314
f0b20750-e5f7-4483-b7a6-c7aa4bd3198f,573555cb-1111-4a7e-bffe-a4d0591475ff,Eric,Williams,Technical Writer,Hudson-Bell,eric.williams@example.net,001-508-683-8958x705,8688 Innovation Way,Paris,Île-de-France,75001,France,51,optimize intuitive initiatives,Wants to schedule a deep-dive demo of the new security features.,2025-05-31T03:17:29.244239,LRN314
4babf954-bfe6-43b4-b734-508bd299770a,af842f8a-bd48-4d4f-8f45-54ba2b468640,Paige,Davenport,Technical Writer,"James, Hansen and Mahoney",paige.davenport@example.net,4383052825,3728 Tech Blvd,Atlanta,GA,30303,United States,37,evolve integrated channels,Mentioned a need for real-time analytics and dashboarding.,2025-04-21T02:56:55.287843,LRN314
cdf3d2a4-9bc9-4763-a137-2caa736232d2,37065fcf-6db9-4c4d-8c48-bd851fe64d5d,Jeff,Graham,Product Manager,Lewis-Acosta,jeff.graham@example.net,949-741-0736,7742 Market St,New York,NY,10001,United States,77,optimize plug-and-play applications,Exploring options for edge computing and low-latency delivery.,2025-09-30T11:22:05.343638,LRN314
7a643623-5c86-4624-8b86-87e0d60ce02b,2d378f9c-435c-4fdd-8671-cc2e00472e59,Joshua,Baxter,Mobile Developer,Diaz LLC,joshua.baxter@example.com,565.389.0983x30997,1910 Market St,Atlanta,GA,30303,United States,95,seize dynamic e-tailers,Encountered friction with the SSO setup; needs technical support.,2025-09-06T01:07:40.550280,LRN314
78625db6-0a6d-4b89-b6e7-2dc3a0265e6c,80879972-7de4-4913-9bb4-b76242a90d29,Amanda,Foster,Technical Writer,Gordon-Christian,amanda.foster@example.org,(620)861-9303x26304,288 Market St,Vancouver,BC,V6B 1P1,Canada,12,mesh innovative ROI,Evaluating the feasibility of a multi-tenant architecture.,2025-05-30T07:12:13.361899,LRN314
2a488c6f-daa2-4133-8b00-fc9751e221a2,459ed7e4-81e0-40af-a799-0cc73dfbaa5a,Matthew,Murray,Frontend Developer,Ramsey-Ball,matthew.murray@example.org,307.502.7804,9413 Innovation Way,Denver,CO,80202,United States,42,extend seamless users,Looking for a solution to optimize their CI/CD pipeline latency.,2025-06-28T13:03:16.303932,LRN314
39c10dc3-e8ff-411a-a534-a7c4ce09e049,9a5a5058-da01-4b1a-908f-cd8c19f3164a,Teresa,Jones,Technical Product Manager,Garcia-Perez,teresa.jones@example.com,(574)426-8374x73469,4982 Oak St,Calgary,AB,T2P 1J9,Canada,47,re-contextualize mission-critical convergence,Asked if we support Terraform providers for infrastructure as code.,2025-04-03T15:24:27.825546,LRN314
fafd81e1-4c60-4504-a0f6-c28bfa6a6add,55e39d72-33f5-4f06-8e36-7ca57c4fe855,Erika,Rios,Technical Product Manager,Oconnell-Torres,erika.rios@example.net,+1-860-268-7230x268,9783 Broadway,New York,NY,10001,United States,62,target back-end e-business,Asked detailed questions about our GraphQL API rate limits.,2025-09-21T17:00:47.700690,LRN314
f43e4355-29e0-487d-bc1f-e977e2f8ac3f,b33a6da4-289c-4e78-98ad-95c9c56e13a0,Derrick,May,Machine Learning Engineer,"Smith, Saunders and Evans",derrick.may@example.com,+1-724-715-3914x38782,6540 Broadway,Toronto,ON,M5H 2N2,Canada,47,synergize visionary schemas,Wants to integrate our widget into their React Native application.,2025-07-12T23:45:33.623593,LRN314
2c55f46c-afe4-4c86-b3d6-7affa45b68ca,bf0477a7-c5c0-47e1-ae4e-af1cc6f67d47,Angela,Garcia,Database Administrator,Miller-Rivera,angela.garcia@example.com,(466)324-3571,6311 Market St,Mumbai,MH,400001,India,42,morph turn-key metrics,Encountered friction with the SSO setup; needs technical support.,2025-04-16T23:43:22.610647,LRN314
5021565c-c9e6-4626-9cb5-d316d9ade86f,af15f06b-f837-4f9a-98c2-b64644ddc405,Jennifer,Nicholson,Technical Product Manager,Smith-Gross,jennifer.nicholson@example.net,478.238.8830x79517,1888 Oak St,Munich,Bavaria,80331,Germany,47,re-intermediate back-end supply-chains,Wants to schedule a deep-dive demo of the new security features.,2025-04-07T01:37:22.145794,LRN314
81b5b266-ac56-4da5-8daa-c5e1e6379603,33515906-9e31-4f0b-b628-b4d2d81299aa,Joseph,Sharp,Data Engineer,Hanson-Young,joseph.sharp@example.com,(701)939-3617,3703 Tech Blvd,New York,NY,10001,United States,83,innovate back-end interfaces,Encountered friction with the SSO setup; needs technical support.,2025-01-14T09:20:22.543813,LRN314
87b0e1e0-9b29-4762-ac94-d87c3c5e5526,c340814a-23b4-47b4-ab6a-8ccc0cb8647d,Eric,Jennings,QA Engineer,Allison Group,eric.jennings@example.com,001-251-480-2739x8071,6614 Tech Blvd,Denver,CO,80202,United States,52,e-enable magnetic infrastructures,Interested in automated testing strategies for their mobile app.,2025-05-20T02:55:08.815680,LRN314
9b960fab-8c88-4d93-9bcd-a975bc47f008,b7082473-d36c-4ad9-8b42-db79e58642eb,Destiny,Woods,AI Researcher,Pratt LLC,destiny.woods@example.org,239.457.6773x26404,2952 Broadway,Miami,FL,33101,United States,24,embrace cross-platform methodologies,Wants to integrate our widget into their React Native application.,2025-08-17T00:05:02.246677,LRN314
0dcb9b18-f3dd-4b5d-b5d7-4231660be97e,036b1ae0-7f99-4c67-a73e-a1479bdb2cc9,Robert,James,QA Engineer,Henderson Ltd,robert.james@example.com,607-715-1263x2755,688 Oak St,San Francisco,CA,94105,United States,29,disintermediate next-generation content,Wants to know more about our machine learning model training capabilities.,2025-04-24T19:04:06.978667,LRN314
126f2ec2-a503-4a8a-8152-2bf73f5f70f5,55930381-bd2f-4a4a-b18b-e59c8eeb9a42,Matthew,Harris,DevOps Engineer,Hayes PLC,matthew.harris@example.net,(941)550-2564x51715,4482 Tech Blvd,San Francisco,CA,94105,United States,4,repurpose strategic content,Suffering from database locking issues; looking for advice.,2025-07-07T23:30:55.394012,LRN314
9a959439-60b1-4746-9937-bf804cabbdd8,1f962548-06b3-43a7-b3c0-e00ed69e9931,Jocelyn,Ferguson,DevOps Engineer,"Santiago, Garner and Wallace",jocelyn.ferguson@example.net,(209)873-9025x50404,6651 Broadway,Los Angeles,CA,90001,United States,94,engage granular networks,Looking to replace their current data warehouse with a more scalable solution.,2025-04-10T04:59:39.578659,LRN314
010fde8e-a5a4-42c2-ac22-c54a1bb4bb2f,9e604692-4d88-4626-955c-f21fc6f909f0,Anthony,Banks,CTO,"Horne, Montoya and Rodriguez",anthony.banks@example.org,5389881578,152 Washington St,Austin,TX,73301,United States,15,leverage cross-platform relationships,Asked detailed questions about our GraphQL API rate limits.,2025-01-15T22:00:55.860180,LRN314
182e2aa1-aaf1-48d7-a590-29b6055ce96f,7e3b9b36-4737-4513-8af4-f90b1d6b5303,Sandra,Wu,Technical Writer,"Merritt, Porter and Mason",sandra.wu@example.net,385-365-3972x1027,5644 Market St,Miami,FL,33101,United States,21,morph enterprise e-commerce,Interested in automated testing strategies for their mobile app.,2025-01-15T12:11:02.864629,LRN314
7e521277-54e6-4388-9aea-9abedff3d573,72b42ee1-0200-4578-b243-7045fc94b302,Kelsey,Wiggins,QA Engineer,Trujillo Ltd,kelsey.wiggins@example.com,+1-284-394-0029x9136,1631 Maple Ave,Chicago,IL,60601,United States,16,visualize bleeding-edge technologies,Needs better documentation for the Python SDK.,2025-09-19T03:00:30.167788,LRN314
22317ca8-ac07-4da5-b75c-6ac3360bb567,d1b4caf4-34c5-42f1-8e97-138a460f5879,Sergio,Oconnor,AI Researcher,"Brown, James and Guzman",sergio.oconnor@example.net,705.679.9053x74976,6287 Washington St,Mexico City,CDMX,01000,Mexico,49,morph front-end markets,Interested in automated testing strategies for their mobile app.,2025-02-18T11:29:02.600476,LRN314
ef2d2de1-d037-4757-998b-ffb8adf939cf,4032cc56-976a-44ca-aff4-521ea868adf0,Deborah,Long,Technical Writer,"Gonzalez, Johnson and Griffith",deborah.long@example.net,(520)353-4694x39801,5200 Maple Ave,San Francisco,CA,94105,United States,24,disintermediate front-end markets,Curious about our websocket support for real-time chat.,2025-05-01T17:19:52.753986,LRN314
93845c2e-13af-4289-820e-bb798074e0e3,c76d0e2e-a70e-469f-b353-a19b44db3f35,Stephanie,Roberts,QA Engineer,Juarez LLC,stephanie.roberts@example.com,001-403-985-3907x29331,9219 Maple Ave,Calgary,AB,T2P 1J9,Canada,61,benchmark frictionless networks,Suffering from database locking issues; looking for advice.,2025-08-07T21:20:33.706634,LRN314
09e039ad-abf4-4909-a0d1-081ba4b45558,1740363d-18ad-4244-a4f6-20069ac2398c,Tracy,Richard,Software Engineer,Larson Inc,tracy.richard@example.net,+1-344-263-8625x1665,7656 Broadway,Atlanta,GA,30303,United States,1,benchmark end-to-end info-mediaries,Asked if we support Terraform providers for infrastructure as code.,2025-09-20T19:50:17.916899,LRN314
d31d7f0f-bb7c-4b4e-83c1-565e1923e017,6aa0bdd6-13c5-47d2-9b1b-c3d2a4ff2338,Eric,Wyatt,Backend Developer,Simon PLC,eric.wyatt@example.net,001-717-927-4568x4874,4448 Broadway,Dublin,Dublin,D01,Ireland,15,deploy B2B functionalities,Wants to know more about our machine learning model training capabilities.,2025-04-28T05:51:00.215880,LRN314
c212e5a9-2209-4b4c-8963-9f659aa0614e,ebe6e0b5-cf27-4ef8-980e-7ca7fc230feb,Mandy,Nunez,Security Engineer,Jenkins PLC,mandy.nunez@example.org,912-453-9024x641,6108 Tech Blvd,Lyon,Auvergne-Rhône-Alpes,69001,France,90,envisioneer front-end schemas,Asked if we support Terraform providers for infrastructure as code.,2025-08-01T04:15:45.529468,LRN314
53491d3c-b11c-461b-a20a-ba9ff7b18f63,b5696e45-2eac-452d-bcac-b13c9b9ef1e4,Margaret,Williams,Security Engineer,"Cox, Ward and Melton",margaret.williams@example.com,786-218-1244,9911 Tech Blvd,Dublin,Dublin,D01,Ireland,24,strategize revolutionary paradigms,Excited about the roadmap for serverless function support.,2025-06-13T09:41:28.189770,LRN314
d8b99836-fb72-4356-835e-5e6a9ba153dd,7ddb00f5-b16f-42d7-a46d-586a6f5a5fbb,Michelle,Ward,CTO,Harris and Sons,michelle.ward@example.net,(227)560-5041,5019 Main St,Calgary,AB,T2P 1J9,Canada,82,scale frictionless vortals,Needs better documentation for the Python SDK.,2025-03-15T17:59:45.607282,LRN314
11269da4-3721-4a28-a229-adccd9146f8d,f27ac849-344d-4d9a-b023-9844d5824398,Maureen,Esparza,UX/UI Designer,Johnson Ltd,maureen.esparza@example.com,001-271-851-0740,8499 Main St,Seattle,WA,98109,United States,53,synthesize global systems,Looking for a solution to optimize their CI/CD pipeline latency.,2025-06-17T21:07:09.124058,LRN314
8c02a4e7-33f0-418c-a1a8-5575eec449e3,a4481887-57eb-4f2d-8690-e43b742933d6,Ann,Walsh,Security Engineer,Wheeler Inc,ann.walsh@example.com,3076312854,421 Market St,Atlanta,GA,30303,United States,46,productize leading-edge portals,Evaluating our platform against AWS and Azure alternatives.,2025-01-14T01:52:34.494109,LRN314
5ba31ced-a025-4f34-87fc-9e566054b1a3,e156e51c-d5cb-4346-ac93-a1e1e9b62c75,Anna,Bradford,AI Researcher,"Brooks, Galloway and Wallace",anna.bradford@example.net,+1-725-496-6700x570,2972 Innovation Way,Dublin,Dublin,D01,Ireland,89,synthesize viral e-markets,Concerned about data sovereignty and GDPR compliance in the EU region.,2025-03-14T18:06:21.070360,LRN314
b144082f-8245-434e-93e5-b0e1490be886,24fbf17f-4d2f-40c8-b538-e9de50c25314,Katie,Garcia,Technical Product Manager,Marquez-Diaz,katie.garcia@example.net,586.764.9912,4950 Broadway,Calgary,AB,T2P 1J9,Canada,30,maximize distributed e-markets,Discussed potential integration with their existing Kubernetes cluster.,2025-05-05T03:14:44.481773,LRN314
dc072ad7-64d7-4bb6-8e69-e99a27f473ac,98f3c510-fd14-4a5d-8051-b5f7a5ed1e86,Daniel,Collins,Backend Developer,Cline LLC,daniel.collins@example.net,001-560-331-3755x48951,5851 Washington St,Miami,FL,33101,United States,62,redefine killer e-tailers,Mentioned a need for real-time analytics and dashboarding.,2025-01-19T19:20:30.206279,LRN314
f0878575-86b3-4940-993d-2b7fce8e9c88,101d8502-3bce-4019-b4aa-7bf7901f8291,Jacob,Myers,Database Administrator,"Bradley, Cameron and Gray",jacob.myers@example.net,+1-419-507-4773x35224,3158 Market St,Seattle,WA,98109,United States,79,e-enable clicks-and-mortar relationships,Concerned about data sovereignty and GDPR compliance in the EU region.,2025-08-06T05:01:44.984475,LRN314
e31392b6-d182-489e-825f-5f7c6876e10a,02d0106e-a3d7-4e87-9eaa-dfe8ea9a92af,Robert,Vaughn,Android Developer,Forbes and Sons,robert.vaughn@example.com,708.240.0607x9924,4517 Tech Blvd,Miami,FL,33101,United States,9,exploit sticky interfaces,Encountered friction with the SSO setup; needs technical support.,2025-01-20T12:04:30.517095,LRN314
c2c2f677-5395-43f2-b435-10cd37f4a265,fc54d64f-0d95-4ea2-8e9e-91741e1c9ff4,Ashley,Ramsey,Network Engineer,Watson Inc,ashley.ramsey@example.com,2808200524,7068 Washington St,Los Angeles,CA,90001,United States,31,syndicate best-of-breed solutions,Mentioned a need for real-time analytics and dashboarding.,2025-02-06T00:07:57.589533,LRN314
e8032691-a382-4b95-a5f8-755e636858e6,cb809388-b915-4b55-bc05-519d28a3b22a,Craig,Arnold,AI Researcher,Turner Ltd,craig.arnold@example.net,346-424-5049,8564 Market St,Atlanta,GA,30303,United States,11,harness value-added users,Evaluating the feasibility of a multi-tenant architecture.,2025-09-22T10:33:06.282919,LRN314
1a15aa4d-3e98-4471-838c-a9f2cfc86f58,4375b13c-0619-4b51-a7c5-278068dc6469,Thomas,Lang,Solutions Architect,Dean PLC,thomas.lang@example.com,(530)511-5270,7647 Washington St,New York,NY,10001,United States,95,deliver ubiquitous architectures,Looking for a partner to help with a large-scale cloud migration.,2025-06-21T19:21:38.180274,LRN314
e9139f25-3a8e-4e1b-892c-cc8897dcca78,2fd74c66-afc7-44d9-ad1b-0c5627f1ddfb,Nicole,Hicks,QA Engineer,"Morris, Greer and Potter",nicole.hicks@example.net,5547804981,341 Main St,San Francisco,CA,94105,United States,82,matrix B2B e-markets,Interested in migrating legacy systems to a microservices architecture.,2025-08-06T18:22:27.562432,LRN314
fcbc3ba5-af00-4ede-9601-82679fae8ff3,b1b1994f-994f-41bb-bb86-4e3cef61ca26,Hailey,Mason,UX/UI Designer,"Adkins, Mcguire and Hamilton",hailey.mason@example.org,001-820-255-7968x9084,7812 Washington St,Atlanta,GA,30303,United States,99,engineer cross-platform vortals,Wants to know more about our machine learning model training capabilities.,2025-09-26T16:30:45.770958,LRN314
afc069f7-6c6c-4c64-81e0-9c5bc948f48b,ef772cc6-fe1c-4ce4-9c5a-da748ac6ff1a,Emma,Hoover,Product Manager,Taylor-Kemp,emma.hoover@example.net,770-397-9872,5017 Washington St,Beijing,Beijing,100000,China,19,envisioneer B2C networks,Exploring options for edge computing and low-latency delivery.,2025-01-08T00:42:20.933472,LRN314
4a0adeb8-31c2-46f2-9b1c-cdf777372f65,953117ae-b0d2-4019-a1f8-b6cc2c05fddc,Sara,Thomas,Site Reliability Engineer (SRE),Taylor-Estrada,sara.thomas@example.org,001-765-226-6102,1788 Washington St,New York,NY,10001,United States,85,whiteboard frictionless vortals,Suffering from database locking issues; looking for advice.,2025-09-07T10:32:35.138660,LRN314
d39cddb3-7a9c-4b7c-b192-20b1f688e310,904eb9c4-449e-416b-94eb-e2ad6df5a668,Samantha,Vang,Technical Writer,Adams-Wood,samantha.vang@example.net,(894)526-3953x494,7308 Maple Ave,Guadalajara,JAL,44100,Mexico,45,embrace magnetic niches,Wants to integrate our widget into their React Native application.,2025-02-09T08:44:17.720754,LRN314
